id,created_at,text,retweet_count,tweet.retweeted
742699391429935104,2016-06-14 12:45:08,The Sima de los Huesos Crania: Analysis of the cranial breakage patterns https://t.co/nolv5RlgNf,1,False
741812783948267520,2016-06-12 02:02:04,Bell Beaker and the evolution of resource management strategies in the southwest of the Iberian Peninsula https://t.co/M5mjKCVs6p,1,False
740502406933270528,2016-06-08 11:15:06,Evidence of Eurasian metal alloys on the Alaskan coast in prehistory https://t.co/7atiKiUpXt,0,False
740137747550113792,2016-06-07 11:06:04,Editorial Board https://t.co/JKpNKNi1b7,0,False
738693491400671233,2016-06-03 11:27:07,Documenting the initial appearance of domestic cattle in the Eastern Fertile Crescent (northern Iraq and western… https://t.co/KHmeaNZBsk,0,False
737451427446935553,2016-05-31 01:11:36,Editorial Board https://t.co/e3BCmuOjGL,0,False
737451425546928129,2016-05-31 01:11:35,"Mesopotamian glass from Late Bronze Age Egypt, Romania, Germany, and Denmark https://t.co/bWAvhNBVOr",1,False
736363750706446336,2016-05-28 01:09:33,Statistically robust representation and comparison of mortality profiles in archaeozoology https://t.co/pkFXOETqYK,0,False
736363748802207744,2016-05-28 01:09:33,Ferrous metallurgy from the Bir Massouda metallurgical precinct at Phoenician and Punic Carthage and the beginning… https://t.co/9vtDHWMStj,0,False
735524970231566336,2016-05-25 17:36:32,"IA42: Interpreting the Rock Paintings of Abri Faravel: laser and white-light scanning at 2,133m in the southern… https://t.co/tgKKur7gX8",1,False
735329566886092800,2016-05-25 04:40:05,Procurement strategies of Neolithic colouring materials: Territoriality and networks from 6th to 5th millennia BCE… https://t.co/gHhxUymLXW,0,False
735329563983613952,2016-05-25 04:40:04,Prehistoric wine-making at Dikili Tash (Northern Greece): Integrating residue analysis and archaeobotany https://t.co/OSNF9JWKi9,1,False
735329560825335814,2016-05-25 04:40:03,Long-term rhythms in the development of Hawaiian social stratification https://t.co/qqfMkMWows,1,False
734704955664146432,2016-05-23 11:18:06,ADS Library mock up for comment https://t.co/xfG4jlDbPk,0,False
734246093098221568,2016-05-22 04:54:44,Editorial Board https://t.co/NANSHGv94y,0,False
733440878832816130,2016-05-19 23:35:06,Geo-ethnoarchaeology in action https://t.co/pBkQ37mKPc,1,False
733440876228141056,2016-05-19 23:35:06,Glass and gold: Analyses of 4th–12th centuries Levantine mosaic tesserae. A contribution to technological and… https://t.co/26iZhSq7sV,0,False
733440874353319936,2016-05-19 23:35:05,Toward disentangling stages in mixed assemblages of flake debris from biface reduction: An experimental approach https://t.co/aLB144Gd0z,0,False
733440871551508480,2016-05-19 23:35:05,Cave stratigraphies and cave breccias: Implications for sediment accumulation and removal models and interpreting… https://t.co/rnlGriAby2,0,False
730110866192932864,2016-05-10 19:02:49,New in IA41; Romano-British Pottery in the Fifth Century https://t.co/vXgkeO4Zxe,0,False
730110864699723776,2016-05-10 19:02:49,IA40: A Unique Engraved Shale Pendant from the Site of Star Carr: the oldest Mesolithic art in Britain https://t.co/mnYVB1hBxW,0,False
730110863118503936,2016-05-10 19:02:49,IA40: Heybridge: A late Iron Age and Roman settlement. Excavations at Elms Farm 1993-5. https://t.co/AF4zwaPrxH,0,False
730110861826621445,2016-05-10 19:02:48,Internet Archaeology 40: Digital community archaeologies in practice https://t.co/KD6z0ZKwM7,0,False
730110860501209088,2016-05-10 19:02:48,CHAT 2015: Registration Closes Soon https://t.co/MFYNgoEUiM,0,False
730110859150663680,2016-05-10 19:02:48,Fwd: Digital Data Re-use Award 2015 https://t.co/eryW35RhM7,0,False
730110857917566981,2016-05-10 19:02:47,CHAT 2015: Timetable now available https://t.co/UkNvvKJz9a,0,False
730110856608911360,2016-05-10 19:02:47,Digital Data Re-use Award 2015 https://t.co/gaxxTpwWiF,0,False
730110855174488064,2016-05-10 19:02:47,CHAT 2015: Registration Open https://t.co/7jRJR9y70l,0,False
730110853639340032,2016-05-10 19:02:46,New IA40: Information Policy for (Digital) Information in Archaeology https://t.co/XGLGfq0ekA,0,False
728615083249537024,2016-05-06 15:59:07,Carbon and nitrogen isotopic variability in bone collagen during the Neolithic period: Influence of environmental… https://t.co/JykExGzmNj,0,False
728615080808484865,2016-05-06 15:59:06,"New methods for investigating slag heaps: Integrating geoprospection, excavation and quantitative methods at Meroe,… https://t.co/gecRPjGId0",0,False
727849648308641792,2016-05-04 13:17:33,From radiocarbon analysis to interpretation: A comment on “Phytolith Radiocarbon Dating in Archaeological and… https://t.co/HQ8RTAchrE,0,False
726738705612869632,2016-05-01 11:43:04,Improvement of laser ablation in situ micro-analysis to identify diagenetic alteration and measure strontium… https://t.co/w2vYqu576f,0,False
726738703419219969,2016-05-01 11:43:03,Geostatistical modelling of chemical residues on archaeological floors in the presence of barriers https://t.co/u7EtX6dQ6M,0,False
726110076709310465,2016-04-29 18:05:07,Isotopic study of geographic origins and diet of enslaved Africans buried in two Brazilian cemeteries https://t.co/P2ovqN1IrF,0,False
726110075102728192,2016-04-29 18:05:07,Testing the endurance of prehistoric adornments: Raw materials from the aquatic environment https://t.co/feHAuubHyU,0,False
726110073286594560,2016-04-29 18:05:06,Standard evaluations of bomb curves and age calibrations along with consideration of environmental and biological… https://t.co/31dTxpTqUF,0,False
725722024723648512,2016-04-28 16:23:08,"Copying error, evolution, and phylogenetic signal in artifactual traditions: An experimental approach using “model… https://t.co/Rq4h3sEyZo",0,False
725722022647459840,2016-04-28 16:23:08,Distinguishing offshore bird hunting from beach scavenging in archaeological contexts: The value of modern beach… https://t.co/ilOXOoJdoA,0,False
725722020743278592,2016-04-28 16:23:07,"The technology of the earliest European cave paintings: El Castillo Cave, Spain https://t.co/ybuyOD6ojN",3,False
725365912035938305,2016-04-27 16:48:04,"Xiongnu burial complex: A study of ancient textiles from the 22nd Noin-Ula barrow (Mongolia, first century AD) https://t.co/G2bBIZOQ2l",0,False
