id,created_at,text,retweet_count,tweet.retweeted
850291353229578240,2017-04-07 10:17:10,Shifting barriers and phenotypic diversification by hybridisation. https://t.co/BSRy5bvH1G,0,False
850291348804485124,2017-04-07 10:17:09,Ionoregulatory Characteristics of Non-Rio Negro Characiforms and Cichlids. https://t.co/HTRtUMJvA8,0,False
850291343423266816,2017-04-07 10:17:08,Influence of leucine-enkephalin on pituitary-ovary axis of the cichlid fish Oreochromis mossambicus. https://t.co/SlvDQ6HEm7,0,False
850291338599845888,2017-04-07 10:17:07,Morphology and muscle gene expression in GIFT and Supreme Nile tilapia varieties reared in two cultivation systems. https://t.co/t8GdvT16JZ,0,False
850291335751909376,2017-04-07 10:17:06,Effect of propolis ethanol extract on myostatin gene expression and muscle morphometry of Nile tilapia in net cages. https://t.co/nB1MqWRxem,0,False
850291333734424576,2017-04-07 10:17:06,Biofilm is associated with chronic streptococcal meningoencephalitis in fish. https://t.co/xhY5pfrxwB,0,False
850291331876257793,2017-04-07 10:17:05,Microbial chitosan as a biopreservative for fish sausages. https://t.co/0F2TuCTiMb,0,False
850291329460453376,2017-04-07 10:17:05,Phytoremediation of wastewater toxicity using water hyacinth (Eichhornia crassipes) and water lettuce (Pistia… https://t.co/pLZFnikn5V,0,False
849562399606800384,2017-04-05 10:00:34,The effect of feed-based vaccination on tilapia farm endemic for streptococcosis. https://t.co/gdfO54p8t1,0,False
849562396502970372,2017-04-05 10:00:34,Macroalgal activity against multiple drug resistant Aeromonas hydrophila: A novel treatment study towards… https://t.co/RIl174YAmW,0,False
849201897042886656,2017-04-04 10:08:04,"Virulence assay of rhizoid and non-rhizoid morphotypes of Flavobacterium columnare in red tilapia, Oreochromis sp.,… https://t.co/XeLZ60ZVj5",0,False
847752753312964609,2017-03-31 10:09:41,The melanocortin system regulates body pigmentation and social behaviour in a colour polymorphic cichlid fish. https://t.co/40Zfwbh7ft,1,False
847752746547552262,2017-03-31 10:09:39,Characterizing bacterial communities in tilapia pond surface sediment and their responses to pond differences and… https://t.co/d8RCvSyeJa,0,False
847752737852805120,2017-03-31 10:09:37,Pathogenesis of mixed infection by Spironucleus sp. and Citrobacter freundii in freshwater angelfish Pterophyllum… https://t.co/WUxPqg6jTm,0,False
847752728109436928,2017-03-31 10:09:35,Capsule impairs efficient adherence of Streptococcus agalactiae to intestinal epithelium in tilapias Oreochromis sp. https://t.co/t8ENI1FzKg,0,False
847394255651786752,2017-03-30 10:25:09,Expanding the Link between Out-Group Threats and In-Group Behavior: (A Reply to Kavaliers and Choleris). https://t.co/8uOpXr6i67,0,False
847394252174655489,2017-03-30 10:25:08,Effect of dietary probiotic supplementation on intestinal microbiota and physiological conditions of Nile tilapia… https://t.co/23nUuFbi3V,0,False
847394248789868544,2017-03-30 10:25:07,Development of a colloidal gold immunochromatographic strip for rapid detection of Streptococcus agalactiae in… https://t.co/4ljzAlN2Ai,0,False
847394245736488960,2017-03-30 10:25:06,"Screening and identification of a microsatellite marker associated with sex in Wami tilapia, Oreochromis urolepis… https://t.co/hib3NupUby",0,False
846671733314600960,2017-03-28 10:34:06,High olfactory sensitivity to conspecific intestinal fluid in the chameleon cichlid Australoheros facetus: could… https://t.co/NKh4vwF1C3,0,False
845910725184765953,2017-03-26 08:10:07,"Dietary administration of Bacillus subtilis HAINUP40 enhances growth, digestive enzyme activities, innate immune… https://t.co/IgyIVhjsP0",0,False
845910721678327808,2017-03-26 08:10:06,"The extent to which immunity, apoptosis and detoxification gene expression interact with 17… https://t.co/RnH2Nyczbd",0,False
845910718188666880,2017-03-26 08:10:06,"Gonado-histopathological changes, intersex and endocrine disruptor responses in relation to contaminant burden in… https://t.co/t2VyymnEhk",0,False
845213750332276737,2017-03-24 10:00:36,Chronic diclofenac exposure affects gill integrity and pituitary gene expression and displays estrogenic activity… https://t.co/WDYA8SaxRz,0,False
845213746351894529,2017-03-24 10:00:35,Water mutagenic potential assessment on a semiarid aquatic ecosystem under influence of heavy metals and natural… https://t.co/op9Npm9oix,0,False
844858814281109505,2017-03-23 10:30:12,Damage-induced alarm cues influence lateralized behaviour but not the relationship between behavioural and… https://t.co/2MKzjvldqu,0,False
844858812615999496,2017-03-23 10:30:12,Effect of the early social environment on behavioural and genomic responses to a social challenge in a… https://t.co/YYBQYycJxy,0,False
844858810715947011,2017-03-23 10:30:11,"Dietary camu camu, Myrciaria dubia, enhances immunological response in Nile tilapia. https://t.co/NKrrUwPASZ",0,False
844858785030037507,2017-03-23 10:30:05,Genotoxic and mutagenic evaluation of water samples from a river under the influence of different anthropogenic… https://t.co/HIOLZ0HB9T,0,False
844130754246279169,2017-03-21 10:17:09,Prolactin and cortisol mediate the maintenance of hyperosmoregulatory ionocytes in gills of Mozambique tilapia:… https://t.co/yPrAYTtc7V,0,False
844130750127472641,2017-03-21 10:17:08,"Fish condition factor, peroxisome proliferator activated receptors and biotransformation responses in Sarotherodon… https://t.co/mKTwZQ4LWH",0,False
843061185670918144,2017-03-18 11:27:04,Community assembly in Lake Tanganyika cichlid fish: quantifying the contributions of both niche-based and neutral… https://t.co/QNbV3DutTl,2,False
843061183536029696,2017-03-18 11:27:04,Establishment and growth responses of Nile tilapia embryonic stem-like cell lines under feeder-free condition. https://t.co/IHgfGhLLbB,0,False
843061181153603584,2017-03-18 11:27:03,Determination of paraben preservatives in seafood using matrix solid-phase dispersion and on-line acetylation gas… https://t.co/NmQe9jQuks,0,False
842318672102227969,2017-03-16 10:16:35,Mossambicus tilapia (Oreochromis mossambicus) collected from water bodies impacted by urban waste carries… https://t.co/TXHmfv98Zo,0,False
842318668482588672,2017-03-16 10:16:34,A new fish cell line derived from the caudal fin of freshwater angelfish Pterophyllum scalare: development and… https://t.co/jsp5RsX6sl,0,False
841595405880053760,2017-03-14 10:22:35,Attractiveness of food and avoidance from contamination as conflicting stimuli to habitat selection by fish. https://t.co/McLWrrolIc,0,False
840521454840041472,2017-03-11 11:15:05,"Effects of dietary live and heat-inactive baker's yeast on growth, gut health, and disease resistance of Nile… https://t.co/ENkFlaERdh",0,False
840521452013019137,2017-03-11 11:15:04,"Combination of physico-chemical analysis, Allium cepa test system and Oreochromis niloticus erythrocyte based comet… https://t.co/GPycqRL37v",0,False
840159185274785792,2017-03-10 11:15:33,"Quantitative analyses of the bacterial microbiota of rearing environment, tilapia and common carp cultured in… https://t.co/yurFKIObSJ",0,False
839793793989672960,2017-03-09 11:03:37,"Evolutionary ecology of opsin gene sequence, expression and repertoire. https://t.co/EURUDxkKyW",0,False
839793791657627648,2017-03-09 11:03:37,Immunomodulatory activity of protein hydrolysates derived from Virgibacillus halodenitrificans SK1-3-7 proteinase. https://t.co/ZdaHYHyWxY,0,False
839793789535313920,2017-03-09 11:03:36,The applied indicators of water quality may underestimate the risk of chemical exposure to human population in… https://t.co/SaD7ReQznC,0,False
839793786972598272,2017-03-09 11:03:36,Dietary l-carnitine prevents histopathological changes in tilapia (Oreochromis Niloticus) exposed to… https://t.co/zPugHFN5bE,0,False
839431396426940416,2017-03-08 11:03:35,Mianserin affects alarm reaction to conspecific chemical alarm cues in Nile tilapia. https://t.co/QokH1jNepF,0,False
839431393352515584,2017-03-08 11:03:34,RNA-Seq revealed the impairment of immune defence of tilapia against the infection of Streptococcus agalactiae with… https://t.co/RuyCbNGUss,0,False
839431390819037184,2017-03-08 11:03:34,Innate immune defenses exhibit circadian rhythmicity and differential temporal sensitivity to a bacterial endotoxin… https://t.co/HWXoz1NVLS,0,False
839431387836907520,2017-03-08 11:03:33,Major surfome and secretome profile of Streptococcus agalactiae from Nile tilapia (Oreochromis niloticus): Insight… https://t.co/6D1FvKymKD,0,False
839069018170404865,2017-03-07 11:03:37,Partition and metabolic fate of dietary glycerol in muscles and liver of juvenile tilapia. https://t.co/zgqRV8Txpe,0,False
839069015947423744,2017-03-07 11:03:37,Aneugenicity and clastogenicity in freshwater fish Oreochromis niloticus exposed to incipient safe concentration of… https://t.co/88uSNdOzI8,0,False
839069014064148482,2017-03-07 11:03:36,Successful xenogeneic germ cell transplantation from Jundia catfish (Rhamdia quelen) into adult Nile tilapia… https://t.co/knLQb9wHqw,0,False
837982102465347584,2017-03-04 11:04:36,Vitamin E pretreatment prevents histopathological effects in tilapia (Oreochromis niloticus) acutely exposed to… https://t.co/gXfrKGYnzf,0,False
837982100762451968,2017-03-04 11:04:36,Digestive enzyme activity in the intestine of Nile tilapia (Oreochromis niloticus L.) under pond and cage farming… https://t.co/BFHrMIR8v9,0,False
837982098614988800,2017-03-04 11:04:35,Acute hypoxia up-regulates HIF-1α and VEGF mRNA levels in Amazon hypoxia-tolerant Oscar (Astronotus ocellatus). https://t.co/5PIiVeSsF3,0,False
837623365745557504,2017-03-03 11:19:07,"Combined administration of low molecular weight sodium alginate boosted immunomodulatory, disease resistance and… https://t.co/NrY5l4Og3H",0,False
837623361580621824,2017-03-03 11:19:06,Identification of a C-type lectin from tilapia (Oreochromis niloticus) and its functional characterization under… https://t.co/QKCSjuSFPX,0,False
837623358975987713,2017-03-03 11:19:05,"Oreochromis mossambicus diet supplementation with Psidium guajava leaf extracts enhance growth, immune, antioxidant… https://t.co/oRjXn8VuAV",0,False
837623356773933056,2017-03-03 11:19:05,Cytotoxic effects of Aeromonas hydrophila culture supernatant on peripheral blood leukocytes of Nile tilapia… https://t.co/uO69eNWeMb,0,False
837623354328674304,2017-03-03 11:19:04,Dietary supplementation with xylanase-expressing B. amyloliquefaciens R8 improves growth performance and enhances… https://t.co/9HtrcmPrNY,0,False
837623350276956160,2017-03-03 11:19:03,"Toxicity evaluation of copper oxide bulk and nanoparticles in Nile tilapia, Oreochromis niloticus, using… https://t.co/UGsZ4DyZel",0,False
837263862055370752,2017-03-02 11:30:34,quaddRAD: A new high-multiplexing and PCR duplicate removal ddRAD protocol produces novel evolutionary insights in… https://t.co/NYJVIzj5DS,2,False
836900969464025088,2017-03-01 11:28:34,"Model of an aquaponic system for minimised water, energy and nitrogen requirements. https://t.co/jivdLiMGNP",0,False
836536691007488000,2017-02-28 11:21:03,Predictive Blood Chemistry Parameters for Pansteatitis-Affected Mozambique Tilapia (Oreochromis mossambicus). https://t.co/PsTk5f9u5j,0,False
836172301406097408,2017-02-27 11:13:06,"Mayarhynchus karlae n. g., n. sp. (Acanthocephala: Neoechinorhynchidae), a parasite of cichlids (Perciformes:… https://t.co/j2lT80CNia",0,False
835964419930652672,2017-02-26 21:27:03,"One species or four? Yes!...and, no. Or, arbitrary assignment of lineages to species obscures the diversification… https://t.co/i9W855ten1",0,False
835084259362627584,2017-02-24 11:09:37,Diversification of Hox Gene Clusters in Osteoglossomorph Fish in Comparison to Other Teleosts and the Spotted Gar… https://t.co/oHggNQxH7s,2,False
835084253826166785,2017-02-24 11:09:35,"Effect of polychlorinated biphenyls on osmoregulatory response and apoptosis in GIFT tilapia, Oreochromis niloticus. https://t.co/vwkGVrgPIe",0,False
835084249229217793,2017-02-24 11:09:34,"Effect of polychlorinated biphenyls on oxidation stress in the liver of juvenile GIFT, Oreochromis niloticus. https://t.co/XDBBZj1se0",0,False
834720221969555456,2017-02-23 11:03:03,Abrupt suspension of probiotics administration may increase host pathogen susceptibility by inducing gut dysbiosis. https://t.co/vNiUc1J0un,0,False
834364433618964480,2017-02-22 11:29:17,Triple trouble? Invasive poeciliid fishes carry the introduced tilapia pathogen Gyrodactylus cichlidarum in the… https://t.co/AivOcf7dU2,0,False
834364426627141633,2017-02-22 11:29:15,Cellular stress and histopathological tools used as biomarkers in Oreochromis mossambicus for assessing metal… https://t.co/mJ96q5AGV6,0,False
834364421099040768,2017-02-22 11:29:14,Impaired antioxidant gene expression by pesticide residues and its relation with other cellular biomarkers in Nile… https://t.co/SKG5ceNp6k,0,False
834364410042802176,2017-02-22 11:29:11,"Fine-scale genetic structure patterns in two freshwater fish species, Geophagus brasiliensis (Osteichthyes,… https://t.co/hIs1KEcQty",0,False
834364403235512320,2017-02-22 11:29:10,Amperometric biosensor based on a single antibody of dual function for rapid detection of Streptococcus agalactiae. https://t.co/0mSbXoaD2P,0,False
834364394758746115,2017-02-22 11:29:08,Genetic parameters for uniformity of harvest weight and body size traits in the GIFT strain of Nile tilapia. https://t.co/yFkIVVeGdX,0,False
833632818232111104,2017-02-20 11:02:06,First record of three African trichodinids (Ciliophora: Peritrichida) in cultured Nile tilapia (Oreochromis… https://t.co/bPnqUrSeka,0,False
832920531263377410,2017-02-18 11:51:44,Genetic dissection of adaptive form and function in rapidly-speciating cichlid fishes. https://t.co/XF3o2FLgLI,0,False
832920529338183680,2017-02-18 11:51:43,"The effects of Natucin C-Natucin P mixture on blood biochemical parameters, antioxidant activity and non-specific… https://t.co/j87ZphHGj1",0,False
832920526070767617,2017-02-18 11:51:42,"Effect of N-acetyl cysteine and glycine supplementation on growth performance, glutathione synthesis,… https://t.co/dyD9CKH3Yk",0,False
832920523789066241,2017-02-18 11:51:42,Comprehensive identification and profiling of Nile tilapia (Oreochromis niloticus) microRNAs response to… https://t.co/CF9H1Uzcgd,0,False
832920521805139969,2017-02-18 11:51:41,Molecular and functional characterization of peptidoglycan-recognition protein SC2 (PGRP-SC2) from Nile tilapia… https://t.co/huEEoccNzH,0,False
832552571277422592,2017-02-17 11:29:35,The genetics of mate preferences in hybrids between two young and sympatric Lake Victoria cichlid species. https://t.co/fCSGoCbiSj,0,False
832552564780474368,2017-02-17 11:29:34,Molecular characterization of MHC class IIB genes of sympatric Neotropical cichlids. https://t.co/ZdgUkdvSiT,0,False
832183266622857216,2017-02-16 11:02:06,Enhancing growth and non-specific immunity of grass carp and Nile tilapia by incorporating Chinese herbs… https://t.co/n3z89URlrn,0,False
831822379999375360,2017-02-15 11:08:04,The effects of feeding with synbiotic (Pediococcus acidilactici and fructooligosaccharide) enriched adult Artemia… https://t.co/lLMj2ZO1vr,0,False
831822377503764481,2017-02-15 11:08:03,Cinnamon (Cinnamomum sp.) inclusion in diets for Nile tilapia submitted to acute hypoxic stress. https://t.co/aT1yOt3PoO,0,False
831459745269637120,2017-02-14 11:07:05,Cationic PEGylated liposomes incorporating an antimicrobial peptide tilapia hepcidin 2-3: an adjuvant of epirubicin… https://t.co/5jeIKb1jfl,0,False
831459742601981952,2017-02-14 11:07:05,"Aluminium sulfate exposure: A set of effects on hydrolases from brain, muscle and digestive tract of juvenile Nile… https://t.co/6eJiA8D7yT",0,False
830733987890896896,2017-02-12 11:03:11,Evolutionary associations between host traits and parasite load: insights from Lake Tanganyika cichlids. https://t.co/ElCH8NfTmg,7,False
830733980248838146,2017-02-12 11:03:09,Ancient hybridization fuels rapid cichlid fish adaptive radiations. https://t.co/isYEzPjkXG,0,False
830733974519451649,2017-02-12 11:03:08,Amazonian waters harbour an ancient freshwater Ceratomyxa lineage (Cnidaria: Myxosporea). https://t.co/audbYbGWW5,0,False
830733970409021440,2017-02-12 11:03:07,Francisella Infection in Cultured Tilapia in Thailand and the Inflammatory Cytokine Response. https://t.co/e76Q3v1iRf,0,False
830733964675469313,2017-02-12 11:03:06,Electrospun tilapia collagen nanofibers accelerating wound healing via inducing keratinocytes proliferation and… https://t.co/FX8AXdJDUf,0,False
830011445836337153,2017-02-10 11:12:04,Characterization of two novel gadd45a genes in hybrid tilapia and their responses to the infection of Streptococcus… https://t.co/ph7z82oIef,0,False
829652230642888704,2017-02-09 11:24:40,Distribution of Endomorphin-like-immunoreactive neurones in the brain of the cichlid fish Oreochromis mossambicus. https://t.co/r7KE3TVpx6,0,False
829652226909966336,2017-02-09 11:24:39,Bayesian Phylogenetic Estimation of Clade Ages Supports Trans-Atlantic Dispersal of Cichlid Fishes. https://t.co/nlrVSyDpJV,1,False
829652222849871877,2017-02-09 11:24:38,"From molecule to behavior: Brain aromatase (cyp19a1b) characterization, expression analysis and its relation with… https://t.co/4oHGnlrhN4",0,False
829652219028856832,2017-02-09 11:24:37,UPLC-MS/MS determination of florfenicol and florfenicol amine antimicrobial residues in tilapia muscle. https://t.co/4Ykm0Q4lsq,0,False
829652214897537024,2017-02-09 11:24:36,The effects of elevated carbon dioxide and temperature levels on tilapia (Oreochromis mossambicus): Respiratory… https://t.co/UTsUhgODKA,0,False
829652211223257088,2017-02-09 11:24:36,"R-spondin1 signaling pathway is required for both the ovarian and testicular development in a teleosts, Nile… https://t.co/6P5FknCfKZ",0,False
828926574871273472,2017-02-07 11:21:10,"Effects of fasting and refeeding on gene expression of slc15a1a, a gene encoding an oligopeptide transporter… https://t.co/ObJgTWnPzR",0,False
828926570806992896,2017-02-07 11:21:09,"Genome-wide identification, evolution of chromobox family genes and their expression in Nile tilapia. https://t.co/4imdJayAwn",0,False
828926566302232581,2017-02-07 11:21:08,The effect of pH on phosphorus availability and speciation in an aquaponics nutrient solution. https://t.co/bQZmnhWN0i,0,False
828926561139036160,2017-02-07 11:21:07,Acanthocephalan Parasites (Acanthogyrus sp.) of Nile Tilapia (Oreochromis niloticus) as Biosink of Lead (Pb)… https://t.co/NwgRmFCc4C,0,False
828926556462411776,2017-02-07 11:21:06,Correlated changes in body shape after five generations of selection to improve growth rate in a breeding program… https://t.co/kPg59Tnoi3,0,False
828566427678318593,2017-02-06 11:30:05,A compendium of developmental gene expression in Lake Malawi cichlid fishes. https://t.co/xDPoLRyUwb,1,False
827631297187106816,2017-02-03 21:34:12,"MOLECULAR, MORPHOLOGICAL AND ECOLOGICAL DATA OF SACCOCOELIOIDES SZIDAT, 1954 (DIGENEA: HAPLOPORIDAE) FROM MIDDLE… https://t.co/U4pG6gi06I",0,False
827631288441901056,2017-02-03 21:34:10,"Feed-based vaccination regime against streptococcosis in red tilapia, Oreochromis niloticus x Oreochromis… https://t.co/SFSEvWGNYn",0,False
827117125454008320,2017-02-02 11:31:04,Different expression patterns of renal Na(+)/K(+)-ATPase α-isoform-like proteins between tilapia and milkfish… https://t.co/u1jJzdzYjo,1,False
827117123256217601,2017-02-02 11:31:03,Kisspeptin2 stimulates the HPG axis in immature Nile tilapia (Oreochromis niloticus). https://t.co/dI1Dfp4s3x,0,False
827117120752201728,2017-02-02 11:31:03,Immunostimulation by phospholipopeptide biosurfactant from Staphylococcus hominis in Oreochromis mossambicus. https://t.co/e9hk3WRlBZ,0,False
826388329260146688,2017-01-31 11:15:05,Incipient speciation driven by hypertrophied lips in Midas cichlids fish? https://t.co/XE6Cc7Ccrw,4,False
826388325564952577,2017-01-31 11:15:05,"Molecular characterization of sdf1 and cxcr4 in the Mozambique tilapia, Oreochromis mossambicus. https://t.co/xPJPah0ar1",1,False
826388320708022274,2017-01-31 11:15:03,Anatomical and functional gonadotrope networks in the teleost pituitary. https://t.co/Cw1AJXWZk5,0,False
825297658856173569,2017-01-28 11:01:09,Quantifying mating success of territorial males and sneakers in a bower-building cichlid fish. https://t.co/o6ptqTEXUE,4,False
825297652778536961,2017-01-28 11:01:08,Responses of the Antioxidant and Osmoregulation Systems of Fish Erythrocyte Following Copper Exposures in Differing… https://t.co/Z6GsgrOtg4,0,False
825297648726925312,2017-01-28 11:01:07,Effects of Dietary Exposure to Sulfamethazine on the Hematological Parameters and Hepatic Oxidative Stress… https://t.co/e3DYHuBnrH,0,False
824935371733557248,2017-01-27 11:01:33,Histopathological alterations in the gills of Nile tilapia exposed to carbofuran and multiwalled carbon nanotubes. https://t.co/KKoghaJetH,0,False
824579540911476736,2017-01-26 11:27:37,Influence of low temperature on structure and dynamics of spermatogenesis during culture of Oreochromis niloticus. https://t.co/Q8AOTWwfkC,0,False
824579530702483458,2017-01-26 11:27:34,Mercury distribution in organs of fish species and the associated risk in traditional subsistence villagers of the… https://t.co/PffQROJCAH,0,False
823855642397900800,2017-01-24 11:31:06,"Histopathological analysis of tilapia gills (Oreochromis niloticus Linnaeus, 1758) exposed to sugarcane vinasse. https://t.co/8aaS9nir8L",0,False
823127089716965377,2017-01-22 11:16:05,Neuromolecular correlates of cooperation and conflict during territory defense in a cichlid fish. https://t.co/Nh2FsdcBNI,0,False
822399043007483905,2017-01-20 11:03:05,Effects of alkylphenols on the biotransformation of diuron and enzymes involved in the synthesis and clearance of… https://t.co/mDwKp9gEDC,0,False
822043451759808513,2017-01-19 11:30:06,"miR-122 promotes hepatic antioxidant defense of genetically improved farmed tilapia (GIFT, Oreochromis niloticus)… https://t.co/6M8vOUkMHC",0,False
822043449016786944,2017-01-19 11:30:05,Response of AMP-activated protein kinase and energy metabolism to acute nitrite exposure in the Nile tilapia… https://t.co/AtpxyLXRoJ,0,False
822043446676361217,2017-01-19 11:30:05,Chronic exposure of tilapia (Oreochromis niloticus) to iron oxide nanoparticles: Effects of particle morphology on… https://t.co/MBFUkEYATs,0,False
822043442620440577,2017-01-19 11:30:04,The response of anosteocytic bone to controlled loading. https://t.co/vJUCuhf8kA,0,False
821784498308157441,2017-01-18 18:21:07,"A gene expression study of dorso-ventrally restricted pigment pattern in adult fins of Neolamprologus meeli, an… https://t.co/E0QnAonoo2",0,False
821312130263621632,2017-01-17 11:04:05,"Parasciadicleithrum octofasciatum n. gen., n. sp. (Monogenoidea: Dactylogyridae), parasite of Rocio octofasciata… https://t.co/ZGg0PZhFWx",0,False
821312122223263745,2017-01-17 11:04:03,Molecular Cloning and Expression Analysis of IgD in Nile Tilapia (Oreochromis niloticus) in Response to… https://t.co/LyOnO49sM4,0,False
820225475628802049,2017-01-14 11:06:07,Identification and characterization of microRNAs and their target genes from Nile tilapia (Oreochromis niloticus). https://t.co/pzb3zAQM5e,1,False
820225469941354496,2017-01-14 11:06:05,Defining a breeding objective for Nile tilapia that takes into account the diversity of smallholder production… https://t.co/KZ7V0tRnpW,1,False
819867104253878273,2017-01-13 11:22:04,Mechanical Transgressive Segregation and the Rapid Origin of Trophic Novelty. https://t.co/nf3BMBxwE0,0,False
819499682237816834,2017-01-12 11:02:04,Assessment of benthic macroinvertebrates at Nile tilapia production using artificial substrate samplers. https://t.co/X0l1WeUWEZ,0,False
819139319143141376,2017-01-11 11:10:07,A non-linear mathematical model for a three species ecosystem: Hippos in Lake Edward. https://t.co/FftQnJSjgq,0,False
818776439092711424,2017-01-10 11:08:09,"Specific PCR assays to determine bovine, porcine, fish and plant origin of gelatin capsules of dietary supplements. https://t.co/TGKVpEuw2f",0,False
818776435473031168,2017-01-10 11:08:09,Laser-induced breakdown spectroscopy determination of toxic metals in fresh fish. https://t.co/WeVuTD1U6U,0,False
818056681372327936,2017-01-08 11:28:06,"Complementary description of Ergasilus arthrosis Roberts, 1969 (Copepoda: Poecilostomatoida: Ergasilidae), a new… https://t.co/uzBTMP2pmy",0,False
817687795221172224,2017-01-07 11:02:16,Cognitive skills and the evolution of social systems. https://t.co/voI0Wn9FyK,0,False
817687792603889665,2017-01-07 11:02:16,Social motivation and conflict resolution tactics as potential building blocks of sociality in cichlid fishes. https://t.co/4II2Qqa3ST,3,False
817687787977646082,2017-01-07 11:02:15,PHARMACOKINETIC EVALUATION OF MELOXICAM AFTER INTRAVENOUS AND INTRAMUSCULAR ADMINISTRATION IN NILE TILAPIA… https://t.co/EdBAw1gB01,0,False
817687783955279872,2017-01-07 11:02:14,Responses and recovery pattern of sex steroid hormones in testis of Nile tilapia (Oreochromis niloticus) exposed to… https://t.co/raSdZcMAus,0,False
817687777005314049,2017-01-07 11:02:12,Synergistic role of β-catenin1 and 2 in ovarian differentiation and maintenance of female pathway in Nile tilapia. https://t.co/u4wmQqFCUF,0,False
817687771473068032,2017-01-07 11:02:11,"Molecular characterization, functional analysis, and defense mechanisms of two CC chemokines in Nile tilapia… https://t.co/IqoH0ENQ1O",0,False
817687767748472832,2017-01-07 11:02:10,Effects of some dietary crude plant extracts on the growth and gonadal maturity of Nile tilapia (Oreochromis… https://t.co/gIrYak1rIo,0,False
