id,created_at,text,retweet_count,tweet.retweeted
817687760123281408,2017-01-07 11:02:08,Detoxification and antioxidant effects of garlic and curcumin in Oreochromis niloticus injected with aflatoxin B₁… https://t.co/GI6RmMhHrT,0,False
817333165442277376,2017-01-06 11:33:06,Assessing exposure risks for freshwater tilapia species posed by mercury and methylmercury. https://t.co/o82wIupnjz,0,False
817333156659404800,2017-01-06 11:33:04,Environmental and cortisol-mediated control of Ca(2+) uptake in tilapia (Oreochromis mossambicus). https://t.co/mVFroF8kt4,1,False
816964852069478400,2017-01-05 11:09:33,Variation of anal fin egg-spots along an environmental gradient in a haplochromine cichlid fish. https://t.co/kUIfSeXeHY,2,False
815158586842062849,2016-12-31 11:32:06,Differential Survival between Visual Environments Supports a Role of Divergent Sensory Drive in Cichlid Fish… https://t.co/6IqjJLbG29,2,False
815158583515959297,2016-12-31 11:32:05,Plasticity paves the way in an adaptive radiation. https://t.co/K9DSzEjZcC,7,False
815158580810694656,2016-12-31 11:32:05,Influence of moderate hypoxia on vaccine efficacy against Vibrio anguillarum in Oreochromis niloticus (Nile… https://t.co/SQtDiaKwxS,0,False
815158576683491328,2016-12-31 11:32:04,"Molecular structure, distribution, and immunology function of TNFSF13B (BAFF) in Nile tilapia (Oreochromis… https://t.co/th5GIX5oWQ",0,False
814796980530483200,2016-12-30 11:35:13,Tempo and mode of speciation in Holacanthus angelfishes based on RADseq markers. https://t.co/qSWD6kKut3,2,False
814430907545178113,2016-12-29 11:20:34,The SSRI fluoxetine exhibits mild effects on the reproductive axis in the cichlid fish Cichlasoma dimerus… https://t.co/CN9llcdoOM,0,False
814430905582305280,2016-12-29 11:20:33,Genome-wide SNP data reveal cryptic phylogeographic structure and microallopatric divergence in a rapids-adapted… https://t.co/QL5kcUlPGF,2,False
814067649298583552,2016-12-28 11:17:06,An allelic series at pax7a is associated with color polymorphism diversity in Lake Malawi cichlid fish. https://t.co/1MRpSfyGJM,1,False
814067644584194048,2016-12-28 11:17:05,Assessment of heavy metal pollution risks in Yonki Reservoir environmental matrices affected by gold mining… https://t.co/GeIio4ZmPw,0,False
813702740769525761,2016-12-27 11:07:05,Depth and substratum differentiations among coexisting herbivorous cichlids in Lake Tanganyika. https://t.co/AppesH6kNP,1,False
813702737665740800,2016-12-27 11:07:05,Evaluation of the genetic diversity of microsatellite markers among four strains of Oreochromis niloticus. https://t.co/pUfAGQQRY3,0,False
813702733198856192,2016-12-27 11:07:04,"Effects of a novel marine probiotic, Lactobacillus plantarum AH 78, on growth performance and immune response of… https://t.co/OlrCWWMxag",0,False
812622132668575744,2016-12-24 11:33:08,Assessment of Heavy-Metal Pollution in Sediments and Tilapia Fish Species in Kafue River of Zambia. https://t.co/xPKvwzuRgg,0,False
812622116012986368,2016-12-24 11:33:04,Characterization of a Novel Orthomyxo-like Virus Causing Mass Die-Offs of Tilapia. https://t.co/cKfmRNxA0j,0,False
812386576663592960,2016-12-23 19:57:07,Reduced host-specificity in a parasite infecting non-littoral Lake Tanganyika cichlids evidenced by intraspecific… https://t.co/DIdlnkUwh4,0,False
812386572796469249,2016-12-23 19:57:07,Identification of the sex-determining region in flathead grey mullet (Mugil cephalus). https://t.co/pxQv4iFRpR,1,False
811554840123822081,2016-12-21 12:52:06,The Opsin Genes of Amazonian Cichlids. https://t.co/Kv8lvMHZpv,2,False
811176095198216192,2016-12-20 11:47:06,Effects of sub-lethal and chronic lead concentrations on blood and liver ALA-D activity and hematological… https://t.co/LbiD564rsa,0,False
811176088004984832,2016-12-20 11:47:04,Does selection in a challenging environment produce Nile tilapia genotypes that can thrive in a range of production… https://t.co/edvNZqPoiE,0,False
809359019357806594,2016-12-15 11:26:42,Bioavailability of angiotensin I-converting enzyme (ACE) inhibitory peptides derived from Virgibacillus… https://t.co/e6BwEqDUJd,0,False
809359015704571905,2016-12-15 11:26:41,Genetic Relatedness of Salmonella Serovars Isolated from Catfish (Clarias gariepinus) and Tilapia (Tilapia… https://t.co/I70l70hAh3,0,False
809359012688859136,2016-12-15 11:26:40,Methanol extract of Nyctanthes arbortristis seeds enhances non-specific immune responses and protects Oreochromis… https://t.co/mcm8COprlh,0,False
809359009610203136,2016-12-15 11:26:39,Isolation and characterization of bacteria with antibacterial properties from Nile tilapia (Oreochromis niloticus). https://t.co/5CbW8pV3jr,0,False
809359007106203650,2016-12-15 11:26:39,Dopamine inhibits somatolactin gene expression in tilapia pituitary cells through the dopamine D2 receptors. https://t.co/GyGaU4MjFz,0,False
809359004543553539,2016-12-15 11:26:38,"Effects of dietary acidifiers on growth, hematology, immune response and disease resistance of Nile tilapia,… https://t.co/jdfHOa3rlC",0,False
809359000382754816,2016-12-15 11:26:37,Electrotransfer of the tilapia piscidin 3 and tilapia piscidin 4 genes into skeletal muscle enhances the… https://t.co/UctsaXMuNU,0,False
809358997883011072,2016-12-15 11:26:36,"3,5-Diiodothyronine-mediated transrepression of the thyroid hormone receptor beta gene in tilapia. Insights on… https://t.co/3ijkHhjPfX",0,False
809358995097993216,2016-12-15 11:26:36,Molecular characterization and immune response to lipopolysaccharide (LPS) of the suppressor of cytokine signaling… https://t.co/18locK9yvi,0,False
809358988810723328,2016-12-15 11:26:34,Molecular characterization and expression of CD2 in Nile tilapia (Oreochromis niloticus) in response to… https://t.co/W2J6vaHUBc,0,False
808783695121256449,2016-12-13 21:20:34,Dissecting the Transcriptional Patterns of Social Dominance across Teleosts. https://t.co/m3Gq141wEw,0,False
806110344594657280,2016-12-06 12:17:37,"Iranocichla persa, a new cichlid species from southern Iran (Teleostei, Cichlidae). https://t.co/YUaY0I2fNY",4,False
804764852266766337,2016-12-02 19:11:07,Genetic and developmental basis for fin shape variation in African cichlid fishes. https://t.co/XJ1Wo1qu8F,0,False
799571142008655873,2016-11-18 11:13:10,Androgen responses to reproductive competition of males pursuing either fixed or plastic alternative reproductive… https://t.co/c9jdSiIVHS,1,False
798484482336571392,2016-11-15 11:15:10,The influence of status and the social environment on energy stores in a social fish. https://t.co/0Arkx7jkbv,0,False
797036044092776452,2016-11-11 11:19:35,Geographical distribution of protozoan and metazoan parasites of farmed Nile tilapia Oreochromis niloticus (L.)… https://t.co/YEmbg10Oig,0,False
797036038447206400,2016-11-11 11:19:34,Shiga toxigenic and enteropathogenic Escherichia coli in water and fish from pay-to-fish ponds. https://t.co/frENGAtNCP,0,False
796462892769951744,2016-11-09 21:22:05,Variations on a theme: Genomics of sex determination in the cichlid fish Astatotilapia burtoni. https://t.co/MW2bElAuUN,1,False
794842120955670529,2016-11-05 10:01:43,Retinal specialization through spatially varying cell densities and opsin coexpression in cichlid fish. https://t.co/zUkjsYJwSS,1,False
794842115763159040,2016-11-05 10:01:42,Genome-Wide Identification and Transcriptome-Based Expression Profiling of the Sox Gene Family in the Nile Tilapia… https://t.co/cy7kX5mh8O,1,False
794120465706979333,2016-11-03 10:14:07,Genotoxicity Effects in Freshwater Fish from a Brazilian Impacted River. https://t.co/CnGWCeivBW,0,False
794120462590558209,2016-11-03 10:14:06,Glutathione and its related enzymes in the gonad of Nile Tilapia (Oreochromis niloticus). https://t.co/rSuta6No0z,0,False
794120459591688193,2016-11-03 10:14:06,Development of a label-free immunosensor system for detecting plasma cortisol levels in fish. https://t.co/YUiJu7LlI5,1,False
793757088702877696,2016-11-02 10:10:11,Streptococcus agalactiae isolates from cultured fishes in Malaysia manifesting low resistance pattern towards… https://t.co/FawkK4fJhp,1,False
793757081656446976,2016-11-02 10:10:10,Persistence of a single clone of Streptococcus agalactiae causing disease in tilapia (Oreochromis sp.) cultured in… https://t.co/ppFHosgQ0g,0,False
793394559610826752,2016-11-01 10:09:38,Changes of Sexual Behaviors in Rapamycin-injected Cichlid Fish Astatotilapia burtoni Males. https://t.co/gXA4B0L1ZC,0,False
793394554707648512,2016-11-01 10:09:37,Shape and Area of Keratocytes Are Related to the Distribution and Magnitude of Their Traction Forces. https://t.co/3UhG4hMveN,0,False
793394549166964736,2016-11-01 10:09:35,Daily rhythms of the expression of genes from the somatotropic axis: The influence on tilapia (Oreochromis… https://t.co/mXQwMu4GZU,0,False
793394544901443584,2016-11-01 10:09:34,Microbiological and chemical safety concerns regarding frozen fillets obtained from Pangasius sutchi and Nile… https://t.co/e4tRqVSks1,1,False
792668907492429824,2016-10-30 10:06:09,Hormonal and fitness consequences of behavioral assortative mating in the convict cichlid (Amatitlania siquia). https://t.co/XcGCedbcah,1,False
792668894955655169,2016-10-30 10:06:06,Environmental context for understanding the iconic adaptive radiation of cichlid fishes in Lake Malawi. https://t.co/6LF5KxRjRs,1,False
791944740832804864,2016-10-28 10:08:34,Polygenic sex determination in the cichlid fish Astatotilapia burtoni. https://t.co/nJjqlshG1p,0,False
