id,created_at,text,retweet_count,tweet.retweeted
847574920045481984,2017-03-30 22:23:02,The squire tells us a ghostly coincidence about learned professions. https://t.co/tA6NimNbpx,0,False
847559817556348929,2017-03-30 21:23:02,The nun relates an ironic tale about other trades and professions. https://t.co/JgO0qea5DI,0,False
847544721228562432,2017-03-30 20:23:02,The hunched old man alludes to an ironic story about queens. https://t.co/bZA9E4bNja,0,False
847529617674186754,2017-03-30 19:23:01,The student relates a ghostly anecdote about noble (gentle) ladies. https://t.co/sx1pmgmBSK,0,False
847514522285780992,2017-03-30 18:23:02,The old maid lays out an amusing accident about nations. https://t.co/ITs5QuxKtT,0,False
847499424372740097,2017-03-30 17:23:03,The nun suggests an eerie coincidence about royalty and nobility. https://t.co/LF8yB8VX92,0,False
847484324693721089,2017-03-30 16:23:03,The priest reminds us of an exhausting incident about parents and children. https://t.co/iU0CtsX2e8,0,False
847469225413193728,2017-03-30 15:23:03,The old maid tells us an amusing story about parents and children. https://t.co/5wclJrktOc,0,False
