id,created_at,text,retweet_count,tweet.retweeted
850415300587790337,2017-04-07 18:29:42,You pilfer an unusual terracotta gauntlet. It is possessed by the psychic energy of a dead ranger. It's worth no more than 82 silver.,1,False
850234104897454080,2017-04-07 06:29:41,The Giant warlord rewards you with a diabolic chain-mail tunic. It feels heavier than you'd expect and once belonged to a gnome.,0,False
850052912038510592,2017-04-06 18:29:42,You lay your hands on a magical yelling warhammer! It has an Elven accent and it's really loud.,0,False
850031633537302528,2017-04-06 17:05:08,"@Gweedabownee Obsidian great-sword (covered in unicorn toothmarks)
Diabolic bracelet (non-functional replica)",0,False
849871716042104833,2017-04-06 06:29:41,"At the back of the mysterious shop, you spy an enchanted oak quarterstaff. It feels heavier than you'd expect and once belonged to a cleric.",0,False
849690524953063427,2017-04-05 18:29:42,The sarcophagus is empty except for the mythical staff Wand of Dark which can alter the appearance of your eyes but only at night.,0,False
849509329225101312,2017-04-05 06:29:41,"Your searching yields a curious clay necklace. It's covered with engravings of mountains. It's worth nine gold pieces, minimum.",0,False
849328134080143360,2017-04-04 18:29:41,In the old crate you find the fabled wizard's staff Rod of Fire which can duplicate itself but it only works outdoors.,0,False
849146941862805505,2017-04-04 06:29:41,"You manage to steal an adamantine mace. It's covered with engravings of castles. It's worth 44 copper pieces, minimum.",0,False
849037578842107906,2017-04-03 23:15:07,"@nedwards Gold goblet (refurbished)
Quartz helm (handcrafted)",0,False
848965737133813760,2017-04-03 18:29:39,You pilfer a hide tunic. It glitters with serrated edges of handcrafted polyethylene. It's worth in the region of 18 copper.,0,False
848814998063329281,2017-04-03 08:30:40,"RT @RPGRambler: Zis dungeon, she is too damp for zee strings. I hate to keep harping on zis, but - wait. Hahaha! Get it? Harping? I make jo…",6,False
848784547349221377,2017-04-03 06:29:40,You open the urn and see a leather hat that used to belong to a ghoul. When you wear it you become allergic to eagles.,2,False
848603349725442049,2017-04-02 18:29:39,You spot a rusty flint longbow. It's engraved with an image of an owlbear battling a hawk. It's worth upwards of 54 copper pieces.,0,False
848438660924149760,2017-04-02 07:35:14,"@EnoughTimeTo Polyethylene earring (too small)
Rusty adamantine sword (needs sharpening)",0,False
848422158309216257,2017-04-02 06:29:40,You come across a magical laughing harp! It has an unsettling accent and it keeps complaining.,7,False
848240963575263233,2017-04-01 18:29:39,"In the dragon's horde, you find the fabled short sword Lightningglory, which was once used to execute a druid.",2,False
848099872830103552,2017-04-01 09:09:01,RT @NotInventedHere: It's the same paladin every time and he's getting increasingly annoyed https://t.co/xKPbsFTJdt,4,False
848059770099683328,2017-04-01 06:29:40,A wizard conjures up a tanned hide belt that used to belong to a ghoul. When you wear it you weigh less.,4,False
847878574967336960,2017-03-31 18:29:39,The Fantasy Costco sells you a diabolic mace. It summons a paladin when you touch it and once belonged to a pixie.,2,False
847697381499871233,2017-03-31 06:29:39,The Owlbear Lord awards you an enchanted wand which allows you to summon beetles but only underwater.,4,False
847516189249208320,2017-03-30 18:29:40,The golem was carrying a diabolic yodelling scythe! It has a northern accent and it periodically emits a piercing scream.,3,False
847369967871811584,2017-03-30 08:48:38,@Elektroschnitzl I didn't say it was WEARING it,0,False
847334994850660352,2017-03-30 06:29:40,You trip over a woollen boot that used to belong to a beholder. When you wear it it makes you look shorter.,0,False
847153800909635584,2017-03-29 18:29:40,"Under the mold you discover the infamous quarterstaff Deathbiter, which once beheaded a giant.",1,False
846972604795772930,2017-03-29 06:29:39,The barrel contains a weird wood helm. It's adorned with engravings of the sun. It's worth roughly nine gold pieces.,2,False
846791411374657538,2017-03-28 18:29:39,The cupboard contains an unearthly iron quarterstaff. It glows faintly and once belonged to a lich.,2,False
846711014779473920,2017-03-28 13:10:11,@mykola A dæmon summons an unusual platinum quarterstaff (doesn't harm bugbears),0,False
846708503460941825,2017-03-28 13:00:12,@deathmtn You trip over an eerie terracotta wizard's staff (doesn't harm giants),0,False
846610217018281984,2017-03-28 06:29:39,You are rewarded with an uncanny copper wizard's staff which can banish snails but it only works outdoors.,0,False
846429023311990785,2017-03-27 18:29:39,You smash the urn and discover a leather hat that used to belong to a minotaur. When you wear it you weigh more.,4,False
846247832264822785,2017-03-27 06:29:40,"You locate the infamous great-sword Darkcleaver, which was once used to execute a bugbear.",0,False
846066638202028034,2017-03-26 18:29:40,You discover an enchanted scythe. It makes you feel ill when you look at it and once belonged to a gnome.,1,False
845885441312219136,2017-03-26 06:29:39,The Ettin warlord rewards you with a curious quartz helm. It is bedevilled by a despondent phantom. It's worth about... 56 copper?,0,False
845704247127805952,2017-03-25 18:29:39,You come across a weird obsidian sword. It's covered with spikes of poorly made bronze. It's worth about... 25 copper?,2,False
845523056160235520,2017-03-25 06:29:40,You trip over a mysterious sapphire chain-mail tunic. It glows crimson in the presence of skeletons and once belonged to an imp.,4,False
845341862672158721,2017-03-24 18:29:40,The ancient urn contains a magical laughing bracelet! It has a Mezian accent and it continually critiques your fashion choices.,4,False
845160665920655360,2017-03-24 06:29:39,"The Troll King awards you the well-known short sword Darkbrand, which was once used to slay a minotaur.",1,False
845029718344843264,2017-03-23 21:49:19,@TC_Tunstall It's actually quite favourable now due to Brexit.,0,False
844979475230212096,2017-03-23 18:29:40,The basilisk was carrying a diabolic bracelet. It glows faintly and once belonged to a dracula.,0,False
844798277027450880,2017-03-23 06:29:39,The chest contains a spooky bamboo wand which allows you to summon dogs but hums.,6,False
844746804302372864,2017-03-23 03:05:07,"@theyseemebrimpn Diabolic ring (non-functional replica)
Metal shield (broken)",1,False
844745554219470848,2017-03-23 03:00:09,"@theyseemebrimpn At the back of the mysterious shop, you spy a weird silver bastard sword (broken)",0,False
844744315683454977,2017-03-23 02:55:14,"@homomculus The staff Rod of Blood (burns you when you touch it)
Weird polyethylene maul (broken)
Diabolic terracotta longbow (broken)",0,False
844744315624701954,2017-03-23 02:55:14,@ViolentHippy The Giant warlord rewards you with a stone warhammer (too hot to hold),0,False
844743036483653634,2017-03-23 02:50:09,@Flowabellle You are bestowed with a rusty stone spear (haunted),0,False
844687668898418689,2017-03-22 23:10:08,"@joemfox Aluminium pickaxe (made of foam)
Fabric helm (chafes)",1,False
844617084403433472,2017-03-22 18:29:39,You lay your hands on a leather hat that used to belong to a troll. When you wear it you hear whispering.,5,False
844435891372339201,2017-03-22 06:29:40,"In the old urn you find the infamous glaive Crimsoncleaver, which was once used to decapitate a dragon.",0,False
844254698551099394,2017-03-21 18:29:40,You are rewarded with an enchanted steel dagger. It feels heavier than you'd expect and once belonged to a giant.,2,False
844073503087345664,2017-03-21 06:29:39,The chest contains a silver pendant. It glints with serrated edges of handcrafted dragon-glass. It's worth something like £75.,1,False
843892310064664577,2017-03-20 18:29:40,A passing stranger hands you an ensorcelled adamantine wand which allows you to talk to dragons but it catches fire whenever you use it.,2,False
843711116010229760,2017-03-20 06:29:40,In the kelpie's backpack is a diabolic bone wand which change the volume of your voice but only on Tuesdays.,4,False
843529923444817920,2017-03-19 18:29:40,The sack contains an obsidian glaive. It glimmers with serrated edges of clumsily crafted flint. It's worth no more than 56 copper.,0,False
843348725669990401,2017-03-19 06:29:39,"Under the mold you discover the famous mace Firecleaver, which once slew a hobgoblin.",1,False
843167526586597376,2017-03-18 18:29:38,You stumble upon a magical terracotta warlock's staff which can cast light but is incapable of harming bugbears.,2,False
842986329873039361,2017-03-18 06:29:37,A dæmon summons a diabolic throwing knife. It hums and once belonged to a ranger.,0,False
842805139627040768,2017-03-17 18:29:38,You discover a leather helm that used to belong to a ghoul. When you wear it you become allergic to octopuss.,0,False
842623944599502848,2017-03-17 06:29:38,You find a diabolic coughing throwing knife! It has an unsettling accent and it won't stop humming out of tune.,2,False
842442749697769473,2017-03-16 18:29:38,The Ghoul Lord awards you an unearthly quartz warlock's staff which allows you to charm dæmons but only during the day.,1,False
842261557270724608,2017-03-16 06:29:38,"While looting the tomb you find the mythical great-sword Flamebreaker, which was once used to behead a bugbear.",2,False
842084262497124353,2017-03-15 18:45:08,@Sensualmassacre You recover a leather short sword (haunted),0,False
842083019661934593,2017-03-15 18:40:11,@SadGuts The treasure vault contains a mysterious iron scythe (greasy),1,False
842081748708134912,2017-03-15 18:35:08,@Egoist_Skeleton Your searching yields a strange metal warhammer (left-handed),0,False
842080362264178690,2017-03-15 18:29:38,"You spot the infamous quarterstaff Chaoscutter, which was once used to execute a bat.",0,False
841899168729821186,2017-03-15 06:29:38,You come across an unusual silver quarterstaff. It's embellished with engravings of elfs. It's worthless.,1,False
841717972192382976,2017-03-14 18:29:37,Your searching yields an oak bracer. It's embellished with skulls of well-made clay. It's worth about 9 silver pieces.,0,False
841536770902769664,2017-03-14 06:29:35,You come across a spooky ruby bracelet. It turns the user into a gaseous cloud and once belonged to a half-orc.,2,False
841355579587211265,2017-03-13 18:29:36,You detect a tarnished platinum dagger. It feels cold to the touch and once belonged to a cleric.,0,False
841174384429678595,2017-03-13 06:29:36,"You stumble upon the notorious bastard sword Darkwidow, which was once used to decapitate a wraith.",2,False
840993190157156352,2017-03-12 18:29:36,You are rewarded with an enchanted wizard's staff which can summon a psychic energy but it only works with your eyes closed.,0,False
840811997033840640,2017-03-12 06:29:36,You come across an enchanted shell gauntlet. It triggers nausea in all who touch it and once belonged to a half-elf.,1,False
840630803587563522,2017-03-11 18:29:36,You uncover an unearthly quartz scimitar. It screams when you touch it and once belonged to an orc.,4,False
840558093494829057,2017-03-11 13:40:40,RT @HeroGraveyard: https://t.co/vttBU1ZtDt,4,False
840449607322742784,2017-03-11 06:29:35,"At the back of the mysterious shop, you spy a magical mithril wand which allows you to detect jackals but it only works if you're singing.",1,False
840268414073634816,2017-03-10 18:29:36,You smash the urn and discover the well-known wand Beholderwand which allows you to charm eagles but only underwater.,7,False
840087219293437954,2017-03-10 06:29:35,You are bestowed with a leather tunic that used to belong to a basilisk. When you wear it you are compelled to commit crimes.,0,False
839906024857473025,2017-03-09 18:29:35,You stumble upon the famous wizard's staff Wizardscepter which can summon an immortal soul but only on Wednesdays.,0,False
839724833122500608,2017-03-09 06:29:36,"At the back of the mysterious shop, you spy the well-known maul Lightō, which was once used to decapitate a tiger.",0,False
839586651127054338,2017-03-08 21:20:31,"@BowenTheBear Every time it's used, roll 1d20. On a 1 it dissolves itself and does 2d6 acid damage to the wielder.",0,False
839586246808727553,2017-03-08 21:18:54,@LaurelAsplund They just give you a Look.,0,False
839543637260308480,2017-03-08 18:29:35,The Fantasy Costco sells you a spooky ruby goblet. It's engraved with an image of a hobgoblin battling a ghoul. It's worth less than $11.,0,False
839362443239378944,2017-03-08 06:29:35,You locate an ensorcelled talking throwing knife! It has a demonic accent and it keeps complaining.,6,False
839181250791370755,2017-03-07 18:29:36,"The Troll Senior Vice President awards you the mythical sword Drncarver, which was once used to decapitate a half-elf.",0,False
839000056082677761,2017-03-07 06:29:35,The Half-Elf warlord rewards you with an eerie decaying wood earring. It is haunted by a lost spirit. It's worth upwards of 31 silver.,6,False
838818847318769667,2017-03-06 18:29:32,The gnoll was carrying a copper goblet. It's encrusted with spikes of expertly crafted stone. It's worth about... four gold pieces?,1,False
838637651339194368,2017-03-06 06:29:31,"You are rewarded with the renowned bastard sword Nægbrand, which once slew a basilisk.",1,False
838525815558135808,2017-03-05 23:05:08,"@MikeWithNoName Silk hat (has been chewed by sparrow)
Hide sandal (worthless replica)",1,False
838456458236817409,2017-03-05 18:29:32,You locate an enchanted talking crown! It has an indeterminate accent and it's really loud.,12,False
838279188050292737,2017-03-05 06:45:07,@Katharocity The treasure vault contains a magical longsword (needs sharpening),0,False
838277939699548161,2017-03-05 06:40:09,"@rotomfortunae Peculiar sapphire bracelet (non-functional replica)
Ensorcelled gauntlet (haunted)",1,False
838275266329862144,2017-03-05 06:29:32,The High Council reluctantly compensates you with a hide tunic that used to belong to a minotaur. When you wear it you feel light-headed.,2,False
838094067766554625,2017-03-04 18:29:31,A dæmon summons an enchanted muttering shield! It has a Dwarvern accent and it apologises to all the monsters you kill.,15,False
837912873854767104,2017-03-04 06:29:31,"The High Council reluctantly compensates you with the fabled mace Drnkiller, which was once used to best a starfish.",2,False
837731682648264704,2017-03-03 18:29:32,You manage to steal the infamous warlock's staff Scepter of Blood which change the volume of your voice but only underwater.,1,False
837613556401127425,2017-03-03 10:40:08,"@NotInventedHere The warlock's staff Trollscepter (doesn't work on golems)
The warlock's staff Firerod (cursed)
Spooky flint sword (broken)",0,False
837550489638064128,2017-03-03 06:29:32,"In the beholder's backpack is the legendary maul Jokulfire, which was once used to vanquish an owlbear.",1,False
837395869506932736,2017-03-02 20:15:08,"@Pooflive Stone spear (made of foam)
Wood spear (extremely fragile)",0,False
837369294325493760,2017-03-02 18:29:31,Under the mold you discover a tarnished uranium warlock's staff which conjure up a rusty helm but it only works indoors.,1,False
837188092993875968,2017-03-02 06:29:30,A passing stranger hands you a terracotta cup. It's engraved with an image of a bat battling a gnoll. It's worth upwards of 12 silver.,0,False
837082558294786048,2017-03-01 23:30:08,"@NotInventedHere Enchanted pickaxe (greasy)
Ruby maul (made of foam)",0,False
837006895974068224,2017-03-01 18:29:29,"The High Council reluctantly compensates you with the legendary spear Brightslayer, which once decapitated an eagle.",1,False
836825703979040773,2017-03-01 06:29:29,You trip over the mythical wizard's staff Rod of Bugbear which can cast fireball but only during the day.,1,False
836644510536974336,2017-02-28 18:29:30,"On the ghoul's corpse you find the mythical rapier Khazcalibur, which once slew a demon.",0,False
836463316260245504,2017-02-28 06:29:29,The treasure vault contains an unsettling sapphire longbow. It's adorned with engravings of the sun. It's worthless.,3,False
836363162752516096,2017-02-27 23:51:31,RT @deathmtn: This talking bread story could be a legit D&amp;D encounter. https://t.co/YLqHPEAqtA,4,False
836282123388604416,2017-02-27 18:29:30,"You spot the mythical longsword Darkslicer, which once defeated a badger.",1,False
836100928830857217,2017-02-27 06:29:30,"From under the counter, the shopkeeper produces the renowned wizard's staff Thundercalibur, which was once used to best a jackal.",1,False
835919735116152834,2017-02-26 18:29:30,"From under the counter, the shopkeeper produces a silk shoe that used to belong to a golem. When you wear it you turn into a wyrm.",1,False
835738539111350272,2017-02-26 06:29:29,Your searching yields an enchanted wizard's staff which allows you to summon wolfs but it only works if you're singing.,4,False
835559935568195586,2017-02-25 18:39:47,RT @HeroGraveyard: https://t.co/lWjBV4Dxlc,4,False
835557347661602817,2017-02-25 18:29:30,On the basilisk's corpse you find a brass helm. It glints with serrated edges of low quality flint. It's worth less than 97 silver pieces.,0,False
835376152684478465,2017-02-25 06:29:29,You come across a strange flint cup. It's decorated with engravings of eldritch sigils. It's worth in the region of 54 silver.,0,False
835313401425448961,2017-02-25 02:20:08,"@quecksilberlamp Curious steel chain-mail tunic (dirty)
Cardboard helm (haunted)",0,False
835194957929525252,2017-02-24 18:29:29,In the ghoul's backpack is a leather cup. It  threatens with skulls of expertly crafted obsidian. It's worth upwards of 31 copper pieces.,0,False
835186011361640450,2017-02-24 17:53:56,@kendersrule Yes but not in your size. Also they are cursed.,0,False
835013762524594177,2017-02-24 06:29:29,The Fantasy Costco sells you a woollen shoe that used to belong to a basilisk. When you wear it your nose bleeds.,1,False
834832571221553156,2017-02-23 18:29:30,You pilfer a magical warlock's staff which can summon a spectre but only within a two-metre radius.,2,False
834651377422966784,2017-02-23 06:29:30,"You are bestowed with the fabled scythe Jokulcalibur, which once beheaded an ocelot.",0,False
834599943977451522,2017-02-23 03:05:07,@mircifer You spot a mahogany pair of trousers (too tight),0,False
834470181871243268,2017-02-22 18:29:29,In the troll's backpack is the fabled staff Staff of Light which conjure up a badly manufactured gauntlet but only during the day.,1,False
834430079715438592,2017-02-22 15:50:08,"@JABIsAHeel Silk belt (torn)
Unsettling leather sword (refurbished)
Magical rapier (cursed)",1,False
834427588353331200,2017-02-22 15:40:14,@MikeWithNoName You lay your hands on a diabolic throwing knife (rusty),0,False
834288987149844480,2017-02-22 06:29:29,You manage to steal a diabolic laughing short sword! It has a Bloadian accent and it keeps predicting your death.,6,False
834107796513759234,2017-02-21 18:29:30,You find a fabric hat that used to belong to a gnoll. When you wear it you turn into a whale.,3,False
834071461992210435,2017-02-21 16:05:07,"@quecksilberlamp Bone harp (cheaply made)
Sapphire lute (worthless replica)
Plastic bracer (rusty)",0,False
833926601293312000,2017-02-21 06:29:30,The Wraith warlord rewards you with a leather tunic. It's decorated spooky decorations of bats. It's worth roughly 99 copper.,5,False
833745407163453444,2017-02-20 18:29:29,You come across a shell quarterstaff. It's engraved with an image of a beetle battling a bugbear. It's worth less than 13 copper pieces.,0,False
833564212337180672,2017-02-20 06:29:29,A wizard conjures up a diabolic throwing knife. It glows faintly and once belonged to a dracula.,2,False
833383019415216129,2017-02-19 18:29:29,You spot a diabolic wand which cause harmless tremors in the ground but only at night.,1,False
833201825683763200,2017-02-19 06:29:30,You smash the urn and discover an ensorcelled diamond maul. It burns slightly when you touch it and once belonged to a wizard.,3,False
833025468785897472,2017-02-18 18:48:43,RT @DMs_Block: Listening 2 the Dungeon Masters Block #podcast? Leave us an iTunes review! Get a shout-out! #dungeonsanddragons #DnD #rpg #p…,7,False
833020629788000259,2017-02-18 18:29:29,You lay your hands on an unearthly decaying wood staff which change the volume of your voice but it makes you melancholy when you use it.,0,False
832839438992543744,2017-02-18 06:29:30,You manage to steal an enchanted coughing dagger! It has an Orcish accent and it's irritated.,2,False
832660923898671104,2017-02-17 18:40:09,"@quecksilberlamp Ruby spear (too hot to hold)
Weird brass longbow (greasy)",0,False
832658245181284352,2017-02-17 18:29:30,The Kelpie Prince awards you a strange steel wizard's staff which can cast fireball but only underwater.,0,False
832477049801433088,2017-02-17 06:29:30,"You discover the famous axe Thundersabre, which once slew a badger.",0,False
832389797280878594,2017-02-17 00:42:47,"RT @AtomicStraw: @dungeon_junk My player got this today. Totally impractical, but easily his new favorite weapon. https://t.co/A6SyTB2ThV",8,False
832295855537414144,2017-02-16 18:29:29,You are rewarded with a fabric tunic that used to belong to a ghoul. When you wear it it makes you look shorter.,0,False
832114663320145920,2017-02-16 06:29:30,"In the dragon's horde, you find an enchanted muttering cup! It has a Parzian accent and it won't stop talking about politics.",2,False
831933469332758528,2017-02-15 18:29:30,The ancient urn contains a mahogany goblet. It's embellished with engravings of a battle. It's worth about 23 copper pieces.,1,False
831752274808598528,2017-02-15 06:29:30,You smash the urn and discover a magical leather rapier. It feels cold to the touch and once belonged to a nymph.,1,False
831571079059603457,2017-02-14 18:29:29,You are rewarded with a hide breastplate that used to belong to a minotaur. When you wear it you experience mild misfortune.,0,False
831389886196416512,2017-02-14 06:29:30,"You lay your hands on an ensorcelled helm. It can heal minor wounds, like papercuts, and once belonged to a ranger.",2,False
831208692523614208,2017-02-13 18:29:30,"In the dragon's horde, you find the mythical warhammer Godsdeath, which was once used to defeat a seagull.",6,False
831027491653443585,2017-02-13 06:29:28,You spot a hide pair of trousers. It intimidates with armoured segments of rusty mithril. It's worth upwards of eight gold pieces.,0,False
830846297569689604,2017-02-12 18:29:28,You are bestowed with a magical talking short sword! It has a Dwarvern accent and it keeps making fun of you.,8,False
830665101531312128,2017-02-12 06:29:27,You detect an unearthly mithril bracer. It is haunted by the psychic energy of a dead starfish. It's worth about 77 copper.,5,False
830483907296505856,2017-02-11 18:29:27,You pilfer an eerie obsidian wand which can alter the appearance of your eyes but it catches fire whenever you use it.,5,False
830302705109311489,2017-02-11 06:29:25,A dæmon summons an ensorcelled laughing ring! It has a demonic accent and it keeps making fun of you.,3,False
830121513034592258,2017-02-10 18:29:26,You detect a tanned hide hat that used to belong to an owlbear. When you wear it you become a were-dragon.,6,False
829940318581694464,2017-02-10 06:29:26,"From under the counter, the shopkeeper produces a diabolic singing cup! It has a demonic accent and it periodically emits a piercing scream.",3,False
829759124623728640,2017-02-09 18:29:26,The Emperor Of Beholders rewards you with a diabolic yodelling spear! It has an unsettling accent and it continually insults your parents.,5,False
829577929155866624,2017-02-09 06:29:25,The Basilisk Prince awards you a diabolic laughing halberd! It has a Bloadian accent and it keeps complaining.,1,False
829456050533326852,2017-02-08 22:25:07,@HideAnGoGeek The minotaur was carrying a brass spear (haunted),0,False
829454794184089609,2017-02-08 22:20:08,"@HideAnGoGeek Sapphire cup (dirty)
Shiny aluminium mace (greasy)",0,False
829410750812811265,2017-02-08 19:25:07,"@Dont_be_a_dweeb Steel mace (doesn't harm ettins)
The wand Glorystaff (burns you when you touch it)
Emerald rapier (gives you a rash)",1,False
829401948147372038,2017-02-08 18:50:08,@zaijian The Grand Council of Zombies fobs you off with a ruby bastard sword (left-handed),0,False
829396736577851399,2017-02-08 18:29:26,You manage to steal an enchanted talking shield! It has an Elven accent and it won't stop talking about politics.,15,False
829257229182365696,2017-02-08 09:15:04,@gCrusher That's spectral wizards for you. Always messing with chemistry and causing iron oxide to form on hydrocarbon polymers.,1,False
829215540791111684,2017-02-08 06:29:25,You locate the notorious wizard's staff Bloodwand which allows you to charm pixies but it only works with your eyes closed.,3,False
829035780031012866,2017-02-07 18:35:07,"@bottitytto Tarnished brass scythe (refurbished)
Magical cup (worthless replica)",0,False
829034349395845121,2017-02-07 18:29:26,The barrel contains the infamous wand Deathscepter which can cast light but it only works when it's raining.,1,False
828853156159295488,2017-02-07 06:29:26,You lay your hands on a strange mahogany dagger. It's encrusted with armoured segments of finely-crafted mithril. It's worth a lot.,5,False
828671960884322304,2017-02-06 18:29:26,You manage to steal a hide tunic. It's adorned with embroidery of the sun. It's worth about... 91 silver?,1,False
828490764074221569,2017-02-06 06:29:25,You pilfer an aluminium pickaxe. It's covered with armoured segments of low quality cardboard. It's worthless.,3,False
828309572075057152,2017-02-05 18:29:25,You are bestowed with an unusual brass bracer. It's covered with engravings of a house. It's worth a lot.,0,False
