id,created_at,text,retweet_count,tweet.retweeted
828128376527474688,2017-02-05 06:29:25,A dæmon summons the famous warlock's staff Drnscepter which can cause druids to sneeze but only on Thursdays.,7,False
827948614857129985,2017-02-04 18:35:06,"@bottitytto In the dragon's horde, you find a shell shoe (cursed)",0,False
827947182850469891,2017-02-04 18:29:25,The Grand Council of Wraithes fobs you off with the mythical wizard's staff Brightstaff which can cast fireball but only at night.,0,False
827765989781680129,2017-02-04 06:29:25,The owlbear was carrying a rusty mahogany mace. It is haunted by the phantom of a dead nymph. It's worth a lot.,3,False
827584797014888453,2017-02-03 18:29:26,You pilfer a highly polished granite earring. It is haunted by a lonely spectre. It's worth no more than 55 copper pieces.,0,False
827403604730392576,2017-02-03 06:29:26,"The Fantasy Costco sells you the notorious axe Lawtooth, which once vanquished a seagull.",6,False
827222407903604736,2017-02-02 18:29:25,In the basilisk's backpack is a magical goblet. It can't harm elfs but does extra damage to dwarfs and once belonged to a paladin.,0,False
827041216902680577,2017-02-02 06:29:26,The barrel contains the fabled staff Deathrod which can duplicate itself but only underwater.,1,False
826922393734148105,2017-02-01 22:37:16,"@JontyCampbell @cheekbyname ""Not much call for spectral wizards round these parts. Phantasmal warlocks are all the rage nowadays.""",0,False
826922185281433602,2017-02-01 22:36:27,"@JontyCampbell @cheekbyname He carefully inspects it. ""Hmm. Acrylonitrile butadiene styrene, huh? Spectral wizard? I'll give you 50 silver"".",0,False
826860020654624779,2017-02-01 18:29:25,A passing stranger hands you a rusty plastic gauntlet. It is possessed by the spectre of a dead wizard. It's worth less than 69 silver.,4,False
826678826646302720,2017-02-01 06:29:25,In the troll's backpack is a fabric helm. It's adorned with embroidery of kelpies. It's worth upwards of $3.,2,False
826497632914784256,2017-01-31 18:29:25,Garfield the Deals Warlock offers you a leather belt. It's adorned with embroidery of an imp corpse. It's worth something like 37 silver.,4,False
826316437207781378,2017-01-31 06:29:25,You uncover a copper necklace. It's engraved with an image of a wizard battling a kelpie. It's worth roughly 70 silver pieces.,2,False
826135245955149825,2017-01-30 18:29:26,You manage to steal a rusty diamond short sword. It is possessed by the spirit of a dead dæmon. It's worth something like 88 copper.,0,False
825974362247458816,2017-01-30 07:50:08,"@t3dy Eerie clay maul (left-handed)
The warlock's staff Scepter of Hrun (out of charges)
Shiny aluminium bastard sword (made of foam)",1,False
825954050998951936,2017-01-30 06:29:25,The Fantasy Costco sells you a curious emerald staff which cause harmless tremors in the ground but only works underground.,1,False
825815822568456192,2017-01-29 21:20:09,"@DVixxin In the dragon's horde, you find a silver cloak (too small)",0,False
825814554873577476,2017-01-29 21:15:07,"@DVixxin Mahogany earring (rusty)
The wand Rod of Thunder (broken)
Unsettling aluminium great-sword (gives you a rash)",0,False
825772856533467136,2017-01-29 18:29:25,The Bugbear Queen awards you a magical yelling scythe! It has a devilish accent and it apologises to all the monsters you kill.,5,False
825591663661826048,2017-01-29 06:29:26,You find the mythical warlock's staff Darkscepter which can grant you resistance to fire but only within a nine-metre radius.,3,False
825410471452893186,2017-01-28 18:29:26,You uncover an unearthly bamboo ring. It is haunted by the ghost of a dead nymph. It's worth less than $37.,1,False
825229273594208256,2017-01-28 06:29:25,You uncover an enchanted coughing scimitar! It has a northern accent and it never shuts up.,3,False
825048071797145602,2017-01-27 18:29:23,You open the crate and see a glass crown. It's embellished with engravings of temples. It's worth roughly two gold pieces.,0,False
824866879080521729,2017-01-27 06:29:23,"The Fantasy Costco sells you the infamous longbow Godsblade, which once beheaded a unicorn.",0,False
824773949955391488,2017-01-27 00:20:07,"@kecafe Magical leather necklace (poorly made)
Eerie adamantine rapier (badly balanced)",0,False
824685684279672832,2017-01-26 18:29:23,You recover an enchanted staff which can cast light but it only works if you're singing.,0,False
824504492603404289,2017-01-26 06:29:24,"At the back of the mysterious shop, you spy the fabled maul Bloodcutter, which was once used to kill a spider.",3,False
824323296690900992,2017-01-25 18:29:23,You smash the urn and discover an unsettling flint halberd. It is bedevilled by a despondent ghost. It's worth less than 78 silver.,3,False
824142103202713600,2017-01-25 06:29:23,"In the dragon's horde, you find the well-known wizard's staff Crimsonrod which cause harmless tremors in the ground but only underwater.",2,False
823960904333201409,2017-01-24 18:29:22,"You locate a shiny diamond bastard sword. It's engraved with an image of a pixie battling a wraith. It's worth 64 copper, minimum.",2,False
823779711071436800,2017-01-24 06:29:22,"Deep in a dungeon, you discover a silk shoe. It's embroidered with an image of an orc battling a dragon. It's worthless.",1,False
823598517210017798,2017-01-23 18:29:22,The Ghoul Senior Vice President awards you a woollen helm that used to belong to a basilisk. When you wear it you feel nauseous.,1,False
