id,created_at,text,retweet_count,tweet.retweeted
847099413973663745,2017-03-29 14:53:33,"A flood temporarily shutters Agern, abcV opens for weekend dinner — and more intel https://t.co/xDle174KNW https://t.co/2iRptYl8HH",1,False
847087704965877761,2017-03-29 14:07:01,A Twin Peaks-themed bar is now open https://t.co/fcXCBufY22,3,False
847086446834044928,2017-03-29 14:02:01,"Best weekday breakfasts in Manhattan:
https://t.co/t60MKDc42H",5,False
847079146366885888,2017-03-29 13:33:01,"Eggslut moves to March 31, Friday morning: https://t.co/TQn5qMNwvC",1,False
847073862177247232,2017-03-29 13:12:01,Celebrity vegan chef Chloe Coscarelli ousted for 'gross negligence' at By Chloe https://t.co/Flwle1aX7N,8,False
