id,created_at,text,retweet_count,tweet.retweeted
845296685769220096,2017-03-24 15:30:09,A book about kingdom: Nausicaä of the Valley of the Wind by Hayao Miyazaki (1997) https://t.co/qd5kekf33j,0,False
845266468048715778,2017-03-24 13:30:04,A book about chaos: Integration of Fuzzy Logic and Chaos Theory by Zhong Li et al. (2006) https://t.co/6Kr4sWH10s,0,False
845236289314140161,2017-03-24 11:30:09,A book about comparative: Think Tanks and Civil Societies by James G. McGann &amp; R. Kent Weaver (2002) https://t.co/jXDPjURktn,0,False
845206133623181312,2017-03-24 09:30:20,A book about elimination: Elimination Practice by Dongming Wang (2004) https://t.co/yeHGMZE9RU,0,False
845175877524643842,2017-03-24 07:30:06,A book about burlesque: Victorian Classical Burlesques by Laura Monros-Gaspar (2015) https://t.co/PSGyd5GBOR,0,False
845145672345010177,2017-03-24 05:30:04,A book about sister: High Spirits by Scott Ciencin (2007) https://t.co/EQ6Ky7jDW4,0,False
845115477282213888,2017-03-24 03:30:05,A book about process: Unknown man by Elmore Leonard (1993) https://t.co/Wv1HgykzVh,0,False
845085272387801088,2017-03-24 01:30:04,A book about possession: Law and Economics of Possession by Yun-chien Chang (2015) https://t.co/cHdPt1f3Hs,0,False
845055070312054786,2017-03-23 23:30:03,A book about ambition: Necessary Dreams by Anna Fels (2005) https://t.co/Xml6Fa80ZY,0,False
845024866424279040,2017-03-23 21:30:02,A book about canine: A Practical Guide to Canine and Feline Neurology by Curtis W. Dewey (2008) https://t.co/wmUExsmMXP,0,False
844994669494853632,2017-03-23 19:30:03,A book about crisis: Art in Crisis by Amy Helene Kirschke (2007) https://t.co/X9ReAGvZKu,0,False
844964474054414336,2017-03-23 17:30:03,A book about development: Models and Tools for Managing Development Processes by Bernhard Westfechtel (1999) https://t.co/mRs1MQ4yLA,0,False
844934283210952705,2017-03-23 15:30:05,A book about invocation: Blessings and Invocations for Everyday Life by Rose Alba &amp; Penny Barham (2008) https://t.co/AeElkQgr04,0,False
844904069655343105,2017-03-23 13:30:02,A book about affect: Jewish Feeling by Richa Dwor (2015) https://t.co/vMjULh5NyI,0,False
844843677277085698,2017-03-23 09:30:03,A book about lecture: Cross-Linguistic Study of Acquired Reading Disorders by Prathibha Karanth (2003) https://t.co/JbSBCGrwkD,0,False
844783277101662208,2017-03-23 05:30:03,A book about assimilation: Walking on Uneven Paths by Rossella Ragazzi (2009) https://t.co/QPtPOruC7k,0,False
844753083079053312,2017-03-23 03:30:04,A book about anger: Surfing Mr Petrovic by Colin Bowles (1997) https://t.co/0eVe28r9Bg,0,False
844722883834327040,2017-03-23 01:30:04,A book about structure: Theoretical drug design methods by Rainer Franke (1984) https://t.co/UjO6PCuuxa,0,False
844692685097177089,2017-03-22 23:30:04,A book about divorce: Relational Shifts by Julie Rappaport et al. (2007) https://t.co/jgJavvp67y,0,False
844662504907247618,2017-03-22 21:30:08,A book about layout: Layout Essentials by Beth Tondreau (2009) https://t.co/hSQg0uXuVu,0,False
844632303229980672,2017-03-22 19:30:08,A book about shipping: Trade and Traders in Early Indian Society by Ranabir Chakravarti (2002) https://t.co/XPNtsLQxw8,0,False
844602100562759680,2017-03-22 17:30:07,A book about regression: The Great Degeneration by Niall Ferguson (2012) https://t.co/2Vft4OeGpC,0,False
844571917491339264,2017-03-22 15:30:11,A book about fiber: Handbook of Natural Fibres by Ryszard M. Kozlowski (2012) https://t.co/8pfG41DqDv,0,False
844541682712543232,2017-03-22 13:30:02,A book about Hollywood: The Dynasty Years by Jostein Gripsrud (1995) https://t.co/rZ0RcNOhVJ,0,False
844511489142743041,2017-03-22 11:30:03,A book about breeding: A handbook of pedigree cat breeding by Dorothy Silkstone Richards (1977) https://t.co/um29sfJhu8,0,False
844481298760642560,2017-03-22 09:30:05,A book about American: The Miseducation of America by Deborah Day Aikens (2012) https://t.co/X7EkzAqFSe,0,False
844451116406452227,2017-03-22 07:30:09,A book about fantastic: Guardians of the West by David Eddings (1988) https://t.co/3bu8QKKuoa,0,False
844420890590957568,2017-03-22 05:30:03,A book about catharsis: Unsent Letters by Lauren B. Smith (2002) https://t.co/5WhGma5N04,0,False
844360524636835840,2017-03-22 01:30:11,A book about litter: Recycle Rubbish by Viv Smith (2001) https://t.co/7mVUVm0JGF,0,False
844330290424283137,2017-03-21 23:30:02,A book about adolescent: Language Intervention for School-age Students by Geraldine P. Wallach (2008) https://t.co/nydAZoyVSM,0,False
