id,created_at,text,retweet_count,tweet.retweeted
850191402944401408,2017-04-07 03:40:00,"Of course it's hard. It's supposed to be hard. If it was easy, everyone would do it. Hard is what makes it great.",334,False
850189897348644864,2017-04-07 03:34:01,6 Foods That Kill Testosterone - https://t.co/hWOPZIC6r3,2,False
850188382344970240,2017-04-07 03:28:00,Too many people are trying to find the right person instead of being the right person.,249,False
850186872521404421,2017-04-07 03:22:00,Any friendship that exceeds the 7 yr mark is more likely to last an entire lifetime.,177,False
850185361267535873,2017-04-07 03:16:00,Are There Any Health Benefits of Vodka? There Sure Are!... https://t.co/MTJAe1jUTf,7,False
850183853813751808,2017-04-07 03:10:01,"“Fast” is its own opposite: It can mean “to move quickly” or “fixed, unmoving”.",39,False
850182343562334208,2017-04-07 03:04:00,"Anyone can apply to be a NASA astronaut — all you need are advanced degrees in biology, science, or math and 1000 hours of jet piloting.",70,False
850180859462389761,2017-04-07 02:58:07,"If you're having a grumpy day, these funny safety signs will definitely give you a laugh or two!... https://t.co/6t9vus6WDy",6,False
850179334384037889,2017-04-07 02:52:03,Whales commit suicide.,62,False
850177846849024000,2017-04-07 02:46:08,"A person who sleeps too much, sits too much and isn't physically active enough is more than 4 times as likely to die early.",113,False
850176336790532096,2017-04-07 02:40:08,Did you know these seven celebrities were gay? - https://t.co/2jzBRmMXOA,2,False
850174917316411392,2017-04-07 02:34:30,"The ""Alphabet song,"" ""Twinkle, Twinkle, Little Star"" and ""Baa, Baa, Black Sheep"" all use the exact same melody.",87,False
850173289926455296,2017-04-07 02:28:02,"Yawning doesn't always necessarily mean you're tired, it also means your body needs more oxygen.",87,False
