id,created_at,text,retweet_count,tweet.retweeted
771808496723562496,2016-09-02 20:34:19,"Swirl in blank viewers with thin neo platoons
Onions that flinch on my tug and teaspoons",0,False
771808239759548416,2016-09-02 20:33:18,"Svelte prying processes whacked up with clicks
These are a few of my favorite slapsticks",0,False
771807990756311040,2016-09-02 20:32:19,"Handstands on hybrids and firemen on droppings
Crisp cliched placards and mere mutant whopping",0,False
771807735264473088,2016-09-02 20:31:18,"My Favorite Things, Round 683",0,False
771446985069125632,2016-09-01 20:37:48,(I also like tortoises and monuments and wealths and fondness and deep grudging trajectories),0,False
771446732764880897,2016-09-01 20:36:48,"When the snow hare puts
When the mare fills
When I'm feeling bold
I simply remember my favorite things
And then I don't feel so sixfold",0,False
771446484508282881,2016-09-01 20:35:49,"Mum dermal cicadas cared up with drunks
These are a few of my favorite bunks",1,False
771446245311258624,2016-09-01 20:34:52,"Cop in wrong crushers with stewed jerky jewels
Juries that spit on my prey and fuels",0,False
