id,created_at,text,retweet_count,tweet.retweeted
824504526141067267,2017-01-26 06:29:32,In the junkyard your sensors show a derelict Type-78 carrier. It appears to be bigger on the inside.,0,False
824323330161381378,2017-01-25 18:29:31,In the shipyard your sensors show an abandoned Azadian freighter. Its firomactal regulators are malfunctioning.,0,False
824142136710955009,2017-01-25 06:29:31,"In the cargo container you unearth a plasma flux drive. When you try to press the power switch, it tells you it doesn't want to activate.",0,False
823960937875075073,2017-01-24 18:29:30,"In the cargo container you detect a hypometric revolver. When you pull the trigger, it starts counting down: FIVE, FOUR, THREE....",0,False
823779744596508673,2017-01-24 06:29:30,"In the trash compactor you recover a needle rifle. When you pull the trigger, it gives you a mild electric shock.",1,False
823598550739251200,2017-01-23 18:29:30,"In the locker you recover an intelligent shield generator. When you try to activate it, it takes you 4 minutes back in time.",1,False
823417370513379328,2017-01-23 06:29:34,In the trash compactor you recognise an intelligent shield generator. The motion-detector starts to bleep.,0,False
823236170603790339,2017-01-22 18:29:32,"The trader offers you a needle grenade. When you try to press the power switch, it gives you a mild electric shock.",0,False
823054982526205953,2017-01-22 06:29:34,In the scrapyard your sensors detect a dilapidated Ocean-class frigate. The cargo hold is full of deuterium conduits.,0,False
822875778379579393,2017-01-21 18:37:28,You exit the time machine and find yourself in the ruins of Washington. A tangerine-coloured android lies motionless. It has tiny hands.,6,False
822873788928983040,2017-01-21 18:29:34,"In the locker you find a quantum torpedo. When you try to press the power switch, red warning lights start 🚨flashing🚨.",1,False
822692594727735296,2017-01-21 06:29:34,"In the locker you recognise a pulse revolver. When you try to switch it on, it phases out of existence.",3,False
822511401260425216,2017-01-20 18:29:34,"In the container you find a hypometric pistol. When you pull the trigger, it vibrates violently.",0,False
822330204311822337,2017-01-20 06:29:33,"An alien merchant flogs you a sentient carbine. When you try to fire it, the isopalavial regulator malfunctions.",0,False
822149010307878912,2017-01-19 18:29:33,In the crater your sensors pick up a wrecked Azadian shuttle. The plasma tanks are empty.,0,False
821967820296769536,2017-01-19 06:29:34,"In the wrecked spacecraft you recover a particle blaster. When you try to fire it, HAZARD starts scrolling across the display.",1,False
821786615693660160,2017-01-18 18:29:31,In the locker you find an intelligent Mind. The AI refuses to co-operate.,3,False
821605421173665794,2017-01-18 06:29:31,"In the locker you discover a dart pistol. When you try to press the power switch, the screen displays: ERROR&lt;Drive Ruptured&gt;.",1,False
821424229421895680,2017-01-17 18:29:32,"In the cargo container you find a psychic cooling system. When you try to switch it on, a large hologrammatic ⛽ symbol appears.",0,False
821243033907855360,2017-01-17 06:29:31,In the crater you locate an abandoned T-6 destroyer. Its warp drives are malfunctioning.,0,False
821061840113385472,2017-01-16 18:29:31,In the locked container you discover a plasma brain. It's covered in mysterious warning symbols.,2,False
820880646965002240,2017-01-16 06:29:32,In the scrapyard you detect an abandoned Geth freighter. It appears to be bigger on the inside.,0,False
820699452973445120,2017-01-15 18:29:32,In the scrap heap you detect a derelict Range-class shuttle. Its sensors are leaking dilithium.,0,False
820518248563245057,2017-01-15 06:29:29,"In the trash compactor you detect a phase generator. When you try to switch it on, the screen displays: ERROR&lt;Drive Faulty&gt;.",0,False
820337056371064833,2017-01-14 18:29:30,On the derelict dreadnaught you recognise an intelligent Mind. Someone has hastily scratched 'WARNING➡' onto the casing.,1,False
820155862748643328,2017-01-14 06:29:30,"In the alien tomb you discover a pulse torpedo. When you pull the trigger, a loud voice says 'CAUTION'.",0,False
819974669696663552,2017-01-13 18:29:30,In the crater you identify a deserted Sovereign-class fighter-bomber. Its photon launchers are faulty.,0,False
819793474304122880,2017-01-13 06:29:29,Near the spacestation your sensors detect a wrecked Intrepid-class interceptor. Its gauss torpedoes won't fire.,0,False
819612289313677316,2017-01-12 18:29:32,"Drifting in space, you recognise a deserted Culture scout ship. The cargo hold is full of faulty arrays.",0,False
819431096597225472,2017-01-12 06:29:32,In the storage room you detect a laser disruptor. You hear approaching footsteps.,0,False
819249898642112512,2017-01-11 18:29:31,"In the cargo bay you find a mass-driver launcher. When you try to fire it, it starts counting down: FIVE, FOUR, THREE....",0,False
819068705820786688,2017-01-11 06:29:31,Orbiting the moon a sensor ping shows an abandoned Hell-class bomber. The anti-matter tanks are empty.,0,False
818887512026480640,2017-01-10 18:29:31,"The trade-bot sells you a malfunctioning cyborg. When you try to switch it on, a large hologrammatic 📡 symbol appears.",3,False
818706318135529472,2017-01-10 06:29:31,"In the cargo container you unearth a pulse carbine. When you try to turn it on, there is a distant rumbling.",0,False
818525123011612673,2017-01-09 18:29:31,You exit the time-machine and uncover a gauss projector. It's labelled '☢HAZARD☢'.,2,False
818343930370621440,2017-01-09 06:29:31,"While looting the captured dropship you locate a corroded android. When you try to turn it on, the Heisenberg assembly malfunctions.",1,False
818162738648285188,2017-01-08 18:29:32,In the shipyard your sensors show an abandoned Geth bomber. Its neutron cannons seem to have a mind of their own.,0,False
817981541062246400,2017-01-08 06:29:31,"In the locked container you unearth a neural glove. When you try to boot it up, tiny alien bugs start swarming out of a hole in the side.",0,False
817800349587226626,2017-01-07 18:29:31,Half-buried on the asteroid's surface you locate a dilapidated Executor-class freighter. It's infested with nano-bots!,1,False
817619156971487232,2017-01-07 06:29:32,"The alien trader offers you a concussion torpedo. When you pull the trigger, a large hologrammatic ⚠ symbol appears.",1,False
817437959750295553,2017-01-06 18:29:31,"In the cargo bay you recognise a powered cryo-chamber. When you try to boot it up, it tries to communicate with you telepathically.",1,False
817256766635315200,2017-01-06 06:29:31,"Near the spacestation you recover an abandoned Sabre-class tanker. When you try to fire the quantum torpedoes, they overheat and implode!",1,False
817075572870434816,2017-01-05 18:29:31,"In the locker you recover an electromagnetic gun. When you pull the trigger, the sun begins to get brighter.",1,False
