id,created_at,text,retweet_count,tweet.retweeted
801569510142672896,2016-11-23 23:33:58,"PLEASE READ! Hearing that DAPL wants to bring in ""agitators"" disguised as protectors /… https://t.co/sD8oLznovw",647,False
801492823006707712,2016-11-23 18:29:14,Here is the link! It's really special with these ladies are doing over there-live from #standingrock https://t.co/Tpv4CgcZUj,680,False
801483387945025536,2016-11-23 17:51:45,@NikkiReed_I_Am an @shailenewoodley are  live on Nikki's Facebook right now! Log in! It's truly important,324,False
801478422417514497,2016-11-23 17:32:01,Going live on Facebook looped in with my @NikkiReed_I_Am live from #standingrock in just a bit come join the conversation!,645,False
801428616215138304,2016-11-23 14:14:06,Repost I'm borrowing from my #tvd sister @katgraham Thanks for such an inspiring message Kat. I… https://t.co/uO8bZU1UpL,966,False
801420119218024448,2016-11-23 13:40:20,I will be live streaming via Facebook live with iamnikkireed's photo https://t.co/aL9wr9Up55 later today,713,False
801288395427368961,2016-11-23 04:56:55,Good night lovely world... lots to do tomorrow,1932,False
801145591451545604,2016-11-22 19:29:28,iamnikkireed's video https://t.co/kAVfTbbavV  The fact that the National Guard is standing for oil and not the people is not okay,847,False
801144953929728000,2016-11-22 19:26:56,How is this true...? https://t.co/pWHj7Y8hjL    Come on America!,703,False
799605081607958528,2016-11-18 13:28:02,"It's coming... The North Pole is an insane 36 degrees warmer than normal as winter descends - The Washington Post
https://t.co/GwjPoly4tM",1789,False
798625054875496448,2016-11-15 20:33:45,shailenewoodley's photo https://t.co/ExCNnjr42H,1073,False
798408561445498884,2016-11-15 06:13:29,Good night world... I hope tomorrow is filled with kindness,3574,False
797546057026732033,2016-11-12 21:06:12,RT @MarkRuffalo: Say it with me. Tell @POTUS #NoDAPL by signing the #StandWithStandingRock petition: https://t.co/JeLVkEFpuw https://t.co/s…,7975,False
797545845604384768,2016-11-12 21:05:21,"Rest In Peace dear &amp; amazing #LeonardCohen You were such a huge influence on me. I'm grateful sir, you'll be missed.
Ian Somerhalder",1287,False
797302838758174720,2016-11-12 04:59:44,"@julieplec  My boss, my friend and my fellow https://t.co/Uom0Dz2F3a simply,bravely, compassionately&amp;truly you put… https://t.co/whX2ikphe2",566,False
797296731176181761,2016-11-12 04:35:28,WTF? I haven't researched this yet but it looks awful- dive in https://t.co/Mgz4W6tVvL,1230,False
797242258127015936,2016-11-12 00:59:01,#TVD is on RIGHT NOW East Coast and Central Time Zones! https://t.co/ND0xkNxVtr,1209,False
796526692177211396,2016-11-10 01:35:36,Speaking of climate change-TONIGHT Is another killer episode of @YEARSofLIVING ! 10/9c on @NatGeoChannel https://t.co/TkSGzXKrvi,910,False
796526363700240384,2016-11-10 01:34:18,"I 2nd that, your misguided vote for a for 3rd party gave Trump the election.I'm sure you meant well but you changed… https://t.co/67OsvNUHp0",4254,False
796030201884971008,2016-11-08 16:42:44,"VOTE VOTE VOTE!!!!
;) VOTING for a candidate that believes climate change is a hoax is the… https://t.co/kaLLCio8eo",905,False
796029566666100736,2016-11-08 16:40:12,"VOTE VOTE VOTE!!!!
;) VOTING for a candidate that believes climate change is a hoax is the MOST dangerous person to… https://t.co/9djbNptWNV",1534,False
796004973398134785,2016-11-08 15:02:29,https://t.co/vQ2hR1ucNN,519,False
796004672133799936,2016-11-08 15:01:17,This is unreal!WATCH THIS ENDORSEMENT WHILE YOURE AT THE POLLS! #trump endorses #HillaryClinton   behind your backs… https://t.co/BZUNw7uxrI,641,False
796002912476524544,2016-11-08 14:54:18,The polls are open! How is everyone feeling?!YOUNG PEOPLE&amp; MILLENNIALS THIS IS YOUR VOTE!YOUR FUTURE! #HillaryClinton she is our only hope,1737,False
795850591289376769,2016-11-08 04:49:01,https://t.co/XrZuobx7SN,539,False
795847189247492096,2016-11-08 04:35:30,Good night beautiful world… I hope my country does the right thing tomorrow and puts  @HillaryClinton in the White House-so we can breathe,3179,False
795834662673412096,2016-11-08 03:45:44,BTW- NBC is playing an @nbcsnl aka  SNL retrospective RIGHT NOW of this election of Clinton&amp;Trump its genius..,514,False
795770049114099712,2016-11-07 23:28:59,I made this video for you... https://t.co/XrZuobx7SN,776,False
795734460352364544,2016-11-07 21:07:34,This just came out! How are you feeling today IG? Big day coming up... https://t.co/7rPwfIB8y3,730,False
795729549065601024,2016-11-07 20:48:03,"Twitter,I just kicked you some great retweets that are well worth the read before we make history tomorrow! @HillaryClinton LETS DO THIS!!!",1222,False
795729054829834244,2016-11-07 20:46:05,How are you feeling America?,1303,False
795728979575664641,2016-11-07 20:45:47,"RT @Nickelbacker01: The world is counting on Americans not to make a catastrophically wrong choice in tomorrow’s election 
https://t.co/S5e…",333,False
795728658002546688,2016-11-07 20:44:30,"RT @fieldnegro: Bad news for trumpsters, the mass transit strike in Philly is over for now. Folks in Philly will be able to go to the polls…",338,False
795728585524973568,2016-11-07 20:44:13,"RT @washingtonpost: ""I don’t trust Mr. Crazy"": Motivated by opposition to Trump, Hispanics are poised for historic turnout https://t.co/ya0…",425,False
795620697724882944,2016-11-07 13:35:30,This is no Bullshit-read these reasons @HillaryClinton should be in office-compare them w/ #DumpTrump #trump pales… https://t.co/ityzs1GZBG,946,False
795619515715436544,2016-11-07 13:30:49,"Good morning https://t.co/Yi2lD2fJ1X is your day.We will make history tomorrow.We cannot let #DumpTrump ,a climate denier in The White House",1220,False
