id,created_at,text,retweet_count,tweet.retweeted
666717942780964864,2015-11-17 20:41:59,"Ooo! In Kingston, Jamaica, Aleshia found work as a casino floor person. Mysterious. https://t.co/SCVL4fKc5u",0,False
666678062776508416,2015-11-17 18:03:31,Say a friendly hello to Russell the bichon frise. He is dating an insurance adjuster from West Virginia. https://t.co/G8lZf9fzCU,0,False
666660058013548544,2015-11-17 16:51:58,Say a friendly hello to Sherice the porcupine. She is dating a job analyst from Hollywood. Good times. https://t.co/RaOVP8bieW,0,False
666644958221369344,2015-11-17 15:51:58,Atm machine servicer (and wolf) Lili rocks out in Augusta. Last of her kind. https://t.co/fmGAkWrbjz,0,False
666607164048457729,2015-11-17 13:21:47,Raphael the black russian terrier. Just being his bad self. https://t.co/1FKMorjw98,0,False
666451618745987073,2015-11-17 03:03:42,Who else? Who lives the good life in Oklahoma City? Lindsay the stag beetle -- duh! He's a wigmaker. https://t.co/H9FWt1Ewva,0,False
666443733018259456,2015-11-17 02:32:22,Which black rhinoceros chills in Avarua? None other than Carter the black rhinoceros! https://t.co/6IqopP9Zge,0,False
666398500545044481,2015-11-16 23:32:38,"LOL. In Kosovo, Wilfredo the snake found work as a military officer. Don't hate the player. https://t.co/2B21Jm58on",1,False
666373180391596032,2015-11-16 21:52:01,Unbelievable. Kathleen the japanese chin. Just being her bad self. Just lovely. https://t.co/sYji5LVchu,0,False
666300354900959233,2015-11-16 17:02:38,"So: In Dallas, Mohammed the bernese mountain dog found work as a career counselor. https://t.co/YlQ3k0KGRr",0,False
666297548597035011,2015-11-16 16:51:29,"Yo. Visiting Philadelphia? Why not pay a visit to this norfolk terrier, Morris the glass blower? Peerless. https://t.co/yl7E8A8i2p",0,False
666295260574822400,2015-11-16 16:42:23,Man of the hour! Which stick insect rocks out in Putrajaya? None other than Denny the stick insect! https://t.co/BmXRFmDG5Y,0,False
666277505800781824,2015-11-16 15:31:50,Everyone's favorite appeals referee: Humberto the horned frog. Check him out! https://t.co/wpNlU1F6aW,0,False
666244826837426176,2015-11-16 13:21:59,"Though he makes his home in Kenya, Kent is a globetrotting himalayan. What a serious fellow. https://t.co/DlhjIufexl",0,False
666096399990280196,2015-11-16 03:32:11,"As a music therapist of some renown, Alison the baboon is the mayor of Ramallah. https://t.co/t3zyC6tGoS",0,False
666089216896598017,2015-11-16 03:03:39,Presenting the materials inspector of the hour: Raymonde the marine toad from Bosnia and Herzegovina! https://t.co/uUsKCiftXh,0,False
666068762622353408,2015-11-16 01:42:22,What's that you say? Lynelle the legal secretary from Kuala Lumpur is at your service. https://t.co/6L81wFJgG2,0,False
666059008713838592,2015-11-16 01:03:37,Who lives the good life in Bakersfield? Ronni the pelican -- duh! She's a hospital administrator. https://t.co/dzw0IY7Lv7,0,False
666036120367534080,2015-11-15 23:32:40,What's that you say? Say a friendly hello to Ashlee the wombat. She is dating a real estate broker from Uzbekistan. https://t.co/mknM5GSGDG,0,False
666003228652388352,2015-11-15 21:21:58,"If you're in need of a coachmaker, Van is your man. Always go galapagos penguin. https://t.co/t4zjMVIozm",0,False
665990684508336129,2015-11-15 20:32:07,"Visiting Chandler? Why not pay a visit to this tapir, Tony the air crew officer? https://t.co/RShA7iNC1F",0,False
665985659048448000,2015-11-15 20:12:09,Who's that? Everyone's favorite gunsmith: Bradley the zebu. https://t.co/mzWkZcQDXQ,0,False
665968463018631170,2015-11-15 19:03:49,Everyone's favorite tax examiner: Bella the squirrel monkey. https://t.co/wwMLifCYWz,0,False
665953275976511488,2015-11-15 18:03:28,OMG. OMG. This is Dillon. Do you know a finer insurance underwriter from Ethiopia? What a butterfly. He's a doll. https://t.co/6WcoUPnj1l,0,False
665935272744497153,2015-11-15 16:51:56,Zelda the gecko. Just being her bad self in Wisconsin. There's Sunday for ya. https://t.co/owaDubtDUI,0,False
665932784792379392,2015-11-15 16:42:02,Meet Jeramy. This akita is an industrial arts teacher from Baton Rouge. https://t.co/Aap6koDsoQ,0,False
665912655539019776,2015-11-15 15:22:03,"Visiting Alabama? Why not pay a visit to this pug, Antonietta the music teacher? https://t.co/ATT22taBq5",0,False
665723856691310592,2015-11-15 02:51:50,"If you're in need of a compensation specialist, Sunni is your woman. Always go bison. https://t.co/T9xG2UaO0I",1,False
665721366172311552,2015-11-15 02:41:56,Materials inspector (and magpie) Hoa spends her days in Massachusetts. Unrivaled. https://t.co/gI3fFXgZ4G,0,False
665688921335062528,2015-11-15 00:33:01,Marci the border collie. Just being her bad self in Columbia. Master of her domain. https://t.co/hxGE3AbyXa,0,False
665676074836205568,2015-11-14 23:41:58,Everyone's favorite vending machine mechanic: Annette the puffer fish. https://t.co/ZoqEipyY7Y,1,False
665658543341703168,2015-11-14 22:32:18,OMG. OMG. Which doberman pinscher lives the good life in Norway? None other than Scotty the doberman pinscher! https://t.co/ZmUG6a62lK,0,False
665651264668217348,2015-11-14 22:03:23,Maria the sumatran rhinoceros. Just being her bad self. https://t.co/2MoyTQhD6Q,0,False
665595480261468160,2015-11-14 18:21:43,Which heron makes her home in Knoxville? None other than Nu the heron! https://t.co/rmRnsoCfNF,1,False
665575783444955136,2015-11-14 17:03:27,So: Everyone's favorite restaurant manager: Shana the walrus. She's got a heart of gold. https://t.co/cYgibTbh0x,0,False
665550212090478593,2015-11-14 15:21:50,Ahoy! Many a hedgehog envies Ali's career as a labor relations advisor. Smart. https://t.co/3LpqxvZrvG,0,False
665535126097539072,2015-11-14 14:21:53,Stop the presses! Tiffany alert! Clemmie is in the house repping Cincinnati where she is a clinical sociologist. https://t.co/MdJicK0fA0,0,False
665532696815382528,2015-11-14 14:12:14,Brokerage clerk (and sea squirt) Ruthann resides in Praia. What a serious gal. https://t.co/gG7w4bW1bO,0,False
665502464054046721,2015-11-14 12:12:06,Tony the south china tiger. Just being his bad self in Carlsbad. Good times. https://t.co/uglZmHtGzX,0,False
665361456309866496,2015-11-14 02:51:47,Perhaps you've heard... Everyone's favorite security guard: Clyde the salamander. Watch him go! https://t.co/XOmmzcKzHK,0,False
