id,created_at,text,retweet_count,tweet.retweeted
667168859921645568,2015-11-19 02:33:46,JAE: Role of Access to Credit in Rice Production in Sub-Saharan Africa: The Case of Mwea Irrigation Scheme in Kenya https://t.co/1ceimpyhYq,0,False
666265227474829312,2015-11-16 14:43:03,"NBER: Work Incentives in the Social Security Disability Benefit Formula -- by Gopi Shah Goda, John B. Shoven, ... https://t.co/Ah9Lw8n5iY",1,False
665437794412724224,2015-11-14 07:55:08,JEG: Urbanization with and without industrialization https://t.co/oljRyjMhOQ,2,False
664993412488138753,2015-11-13 02:29:19,JAE: Quantifying the Process and Performance of River Basin Water Management Decentralisation in Sub-Saharan Africa https://t.co/lbpobnLuiJ,0,False
663860308272771073,2015-11-09 23:26:46,EDCC: The Link between Manufacturing Growth and Accelerated Services Growth in India https://t.co/HOv9eMNsnP,0,False
663860307530387456,2015-11-09 23:26:45,EDCC: Feeding Africa’s Cities: The Case of the Supply Chain of Teff to Addis Ababa https://t.co/M0rOQwsmM9,0,False
663724855376777216,2015-11-09 14:28:31,"NBER: Caloric Requirements and Food Consumption Patterns of the Poor -- by Shari Eli, Nicholas Li https://t.co/EIfnAcRceM",1,False
663590286010937344,2015-11-09 05:33:47,AEJ EcPol: The Impact of Regulation on Mortgage Risk: Evidence from India https://t.co/j6dTVVN4jW,0,False
662462290831142912,2015-11-06 02:51:32,JAE: FDI and Migration of Skilled Workers Towards Developing Countries: Firm-Level Evidence from Sub-Saharan Africa https://t.co/tq2YkCmIRE,1,False
662075891820851200,2015-11-05 01:16:08,RePEc: The Quest to Lower High Remittance Costs to Africa: A Brief Review of the Use of Mobile Banking and Bitcoins https://t.co/7FGbgFHBWU,1,False
662075860917227521,2015-11-05 01:16:00,RePEc: Estimating the Enduring Effects of Fertilizer Subsidies on Commercial Fertilizer Demand and Maize Produ... https://t.co/F8yL8ZSLet,0,False
662014353051291648,2015-11-04 21:11:36,RePEc: What Drives Land Sales and Rentals in Rural Africa: Evidence from Western Burkina Faso https://t.co/E0Eqg3EhKL,0,False
662014251129659392,2015-11-04 21:11:11,RePEc: The Long-Term Effects of Conflict on Welfare: Evidence from Burundi https://t.co/R0ouHGl9CA,1,False
661993042543382528,2015-11-04 19:46:55,RePEc: The role of livestock portfolios and group-based approaches for building resilience in the face of acce... https://t.co/vZgJpP2Q5n,0,False
661993016589029376,2015-11-04 19:46:49,RePEc: Agricultural Technology Adoption and Market Participation under Learning Externality: Impact Evaluation... https://t.co/5hUJ51M1iM,0,False
661948130460495872,2015-11-04 16:48:27,RePEc: Infrastructure Gap in South Asia: Inequality of Access to Infrastructure Services https://t.co/Ibe80gELH0,0,False
661925626304004096,2015-11-04 15:19:01,RePEc: The Impact of Three Mexican Nutritional Programs: The Case of Dif-Puebla https://t.co/0OZfyGXEez,0,False
661193442622504960,2015-11-02 14:49:35,"NBER: Patent Assertions:  Are We Any Closer to Aligning Reward to Contribution? -- by Fiona Scott Morton, Carl... https://t.co/cuqpeUU7zw",0,False
661193441599094788,2015-11-02 14:49:35,"NBER: Fiscal Stimulus in Economic Unions: What Role for States? -- by Gerald Carlino, Robert P. Inman https://t.co/wDM5PkLPLj",0,False
660295868596142081,2015-10-31 03:22:57,QJE: A Unified Theory of Firm Selection and Growth https://t.co/TGePvahwoh,2,False
659664992812183552,2015-10-29 09:36:04,"EJ: History, Path Dependence and Development: Evidence from Colonial Railroads, Settlers and Cities in Kenya https://t.co/d27MvbLPUe",4,False
659443120489168896,2015-10-28 18:54:26,RePEc: Understanding poverty reduction in Sri Lanka : evidence from 2002 to 2012/13 https://t.co/j5IEbVeKIr,1,False
659225984894300160,2015-10-28 04:31:37,RePEc: Income and Malaria : Evidence from an agricultural intervention in Uganda https://t.co/6CRvhl0rA6,4,False
659207013746896896,2015-10-28 03:16:14,RePEc: Ethnic disadvantage in Vietnam : Evidence using panel data https://t.co/JLDYxpRQUA,0,False
659188514827796481,2015-10-28 02:02:43,RePEc: Microfinance and Moneylenders: Long-run Effects of MFIs on Informal Credit Market in Bangladesh https://t.co/dqfaWjpQTf,0,False
659188427053641728,2015-10-28 02:02:22,RePEc: Gender inequality and the empowerment of women in rural Viet Nam https://t.co/Ayatj99PLG,0,False
659150554405339136,2015-10-27 23:31:53,RePEc: Person Equivalent Headcount Measures of Poverty https://t.co/lKs5NI95n6,0,False
659109018061828096,2015-10-27 20:46:50,RePEc: Higher education and fertility: Evidence from a natural experiment in Ethiopia https://t.co/HKrDFTaIxD,0,False
659088345998319616,2015-10-27 19:24:41,RePEc: The causal impacts of child labor law in Brazil : some preliminary findings https://t.co/pFXFzlodNE,0,False
659088273415888896,2015-10-27 19:24:24,RePEc: Worms at work: Long-run impacts of a child health investment https://t.co/TeJVR1BwZj,1,False
659021967303905281,2015-10-27 15:00:55,RePEc: Crop diversification and child health: Empirical evidence from Tanzania https://t.co/HxJmRQjaHf,0,False
657797118745153537,2015-10-24 05:53:49,RePEc: Does Economic Growth Reduce Child Malnutrition in Egypt? New Evidence from National Demographic and Hea... https://t.co/dsNfLTtFfo,0,False
657604840160276480,2015-10-23 17:09:46,RePEc: Formalizing rural land rights in West Africa : early evidence from a randomized impact evaluation in Benin https://t.co/CJfBC3fW0X,3,False
657559914110291968,2015-10-23 14:11:15,"RePEc: Civil conflicts in Africa: Climate, economic shocks, nighttime lights and spill-over effects https://t.co/loyUOhYZt2",1,False
657537405575168000,2015-10-23 12:41:48,RePEc: THE QUALITY OF RURAL EMPLOYMENT AND AGRICULTURAL PRODUCTION EFFICIENCY - EMPIRICAL EVIDENCE FROM SUB-SA... https://t.co/8DPbZkLIyM,0,False
