id,created_at,text,retweet_count,tweet.retweeted
841359853750738944,2017-03-13 18:46:35,.@MassEMA EOC will be activating tomorrow AM to provide situational awareness &amp; coordinate requested assistance to cities &amp; towns. #MAsnow,15,False
841359506982461442,2017-03-13 18:45:12,Exercise caution &amp; patience on the roads. #DontCrowdThePlow &amp; allow road crews &amp; first responders plenty of space to do their jobs. #MAsnow,44,False
841359363763761155,2017-03-13 18:44:38,We encourage employers to allow folks to work from home to cut down on traffic volume &amp; avoid dangerous driving conditions. #MAsnow,89,False
841359264522350596,2017-03-13 18:44:15,We are urging the public to please stay off the roads unless absolutely necessary and to take public transit when possible. #MAsnow,124,False
841359020199940096,2017-03-13 18:43:16,.@MassDOT highway crews &amp; contractors will be activated for snow &amp; ice ops and deployed as conditions warrant in each part of MA. #MAsnow,16,False
841358705077682176,2017-03-13 18:42:01,"The combination of very high winds and wet snow could lead to a significant amount of downed tree limbs &amp; power lines, esp. SE Mass. #MAsnow",23,False
841358518083043328,2017-03-13 18:41:17,"Forecasts predict a snowfall rate of 2""–4” per hour for much of Tuesday. Extreme caution is urged for anyone who must travel. #MAsnow",46,False
841358104684056576,2017-03-13 18:39:38,"Forecasts are calling for a total #MAsnow accumulation of at least 12 inches across most of MA, with potential for… https://t.co/2u3QTvj1HR",17,False
841344069489983488,2017-03-13 17:43:52,Gov. Baker and transportation &amp; public safety officials discuss tomorrow’s winter storm. #MAsnow https://t.co/JPFz1H1GMl,57,False
841298324770582529,2017-03-13 14:42:05,Gov. Baker welcomes @endakennytd &amp; Ambassador Anderson. 🇮🇪 @irelandembusa #Ireland https://t.co/YQoNfM5D4T,20,False
841010015997698053,2017-03-12 19:36:27,Nashoba Valley Technical High School gets grants to bolster its Engineering Academy. More from @SentandEnt: https://t.co/F5DdI7U3Q2,9,False
840608283480199170,2017-03-11 17:00:07,"More than $860,000 in #CommunityCompact grants were awarded statewide, including three in #Berkshire County. #WMass… https://t.co/ETDmppRvee",5,False
840243902993072128,2017-03-10 16:52:12,These grants will help communities &amp; school districts work together to improve regionalization &amp; efficiency efforts: https://t.co/ZlhaK0DXQQ,14,False
840243515850444800,2017-03-10 16:50:39,"We formed the #CommunityCompact Cabinet, led by @MassLtGov, to solidify state government’s role as a reliable partner for cities and towns.",8,False
839966377339392001,2017-03-09 22:29:24,"RT @MassGovernor: ""There are no longer any families who are homeless being sheltered by the state in a hotel in Danvers."" @salemnews: https…",28,False
839927992818221057,2017-03-09 19:56:53,.@MassANF  Sec. Lepore testified before the Joint Committee on Ways &amp; Means in support of our FY18 budget proposal.… https://t.co/psB9S8vyvY,5,False
839912450103394304,2017-03-09 18:55:07,"To better manage our water resources, we have filed a bill seeking state control of water protection efforts:… https://t.co/OuihG7A6CI",7,False
839893101791559681,2017-03-09 17:38:14,RT @perkinsvision: @MassGovernor helped kick off #BlindNewWorld Week this Monday in a moving ceremony at the State House: https://t.co/j60P…,11,False
839885443902623747,2017-03-09 17:07:48,"Yesterday, we filed legislation seeking federal delegation of water protection efforts from @EPA to @MassDEP: https://t.co/yhkEaMuxS1",10,False
839845650460213248,2017-03-09 14:29:41,"""There are no longer any families who are homeless being sheltered by the state in a hotel in Danvers."" @salemnews:… https://t.co/NZEbHfyjES",28,False
839565893759823872,2017-03-08 19:58:02,"Today, Gov. Baker filed a bill seeking federal delegation of water protection efforts already enjoyed by 46 states… https://t.co/yIzCGuHEcH",16,False
839534012775419904,2017-03-08 17:51:21,Governor Baker's statement on the Governor’s Council’s unanimous confirmation of Justice Elspeth Cypher to the Supr… https://t.co/J3gbMEALx2,3,False
839514672193744901,2017-03-08 16:34:29,"This bill will allow MA to work more closely with cities, towns, environmental advocates, &amp; industries during the d… https://t.co/XxYRCZq8X7",14,False
839514240226627584,2017-03-08 16:32:46,Giving @MassDEP the ability to make science-based permitting decisions using up-to-date water quality data is a gre… https://t.co/a1zaglWRYD,20,False
839513824042631169,2017-03-08 16:31:07,"By joining 46 states w the federal delegation, MA will implement a strong science-based program focused on protecti… https://t.co/eoer1Nd3v7",31,False
839512976319213568,2017-03-08 16:27:45,Massachusetts has a proud history of protecting &amp; improving water quality; this bill places the NPDES program into… https://t.co/Jyv36CRETx,19,False
839507850606981120,2017-03-08 16:07:23,Gov. Baker files legislation seeking federal delegation of water protection efforts https://t.co/VkjgGmhCQA,41,False
839474239367446528,2017-03-08 13:53:49,"At Gloucester High, Skills Capital grant will align machine technology program with workforce demands of employers… https://t.co/q2kycJLBEe",7,False
839213685570744320,2017-03-07 20:38:29,"In Chelsea, @FBIBoston will help create good jobs, advance local development and remain a partner in cyber security… https://t.co/kBT0pphP62",12,False
839209416373207041,2017-03-07 20:21:31,Excited to join @FBIBoston &amp; many members of the law enforcement community in celebrating the state-of-the-art divi… https://t.co/lFDyyoy3AI,7,False
839188583344898048,2017-03-07 18:58:44,Governor Baker commends @UMass Board of Trustees and President @MartyMeehan for selection of Robert Johnson as… https://t.co/esLdwVgo3K,7,False
839127670126481408,2017-03-07 14:56:41,The public-private partnership we announce today ensures the long running #BostonJuly4th tradition will continue to enchant into the future.,8,False
839127301631664128,2017-03-07 14:55:13,The #BostonJuly4th spectacular is a time-honored tradition on the Esplanade where people from around the nation cel… https://t.co/TkG0tOZvj3,2,False
838898738420670464,2017-03-06 23:46:59,".@MartyMeehan recognized Patrice Charlot, the 1st in her family to attend college. She now works at @BottomLineOrg. https://t.co/nVOTaJjOXC",6,False
838892307671891969,2017-03-06 23:21:26,Attended @MartyMeehan's #StateofUMass tonight. @UMass &amp; its graduates are ensuring the Commonwealth remains both a… https://t.co/6Ji6L12lOg,24,False
838870236141137922,2017-03-06 21:53:44,Pleased to proclaim #BlindNewWorld Week to support inclusiveness/opportunity for MA’s blind and visually impaired.… https://t.co/KyEnzioSfy,31,False
838846501484965890,2017-03-06 20:19:25,".@TheMeganHouse is celebrating its 19th graduate. On Friday, we announced our investment in their recovery program:… https://t.co/jIMrY8Xuts",8,False
838833444079689728,2017-03-06 19:27:32,"For decades, Ken was a major force in Boston real estate &amp; responsible for some truly transformative community development. He'll be missed.",7,False
838832863810301952,2017-03-06 19:25:14,Deeply saddened to hear of the tragic loss of Ken Guscott &amp; his father-in-law Leroy Whitmore. My thoughts &amp; prayers are with their families.,8,False
838824016685199360,2017-03-06 18:50:04,"Sign up to receive the next ""Corner Office Connect"": https://t.co/HeeICcIub6 https://t.co/P6kbPNslhW",1,False
838813221620494338,2017-03-06 18:07:11,"On Friday, the administration announced expanded residential treatment for women fighting substance use disorders https://t.co/nKYopSDJFR",13,False
838795981709783041,2017-03-06 16:58:40,"Grateful for the generosity supporting @The_BMC's research, training and prevention efforts to fight the public hea… https://t.co/FcATWJeNMt",12,False
838766372431794176,2017-03-06 15:01:01,Colonel James Suhr takes command of the @104fighterwing via @WWLP22News https://t.co/cv6ctPvKbr https://t.co/47Gpej1Pqi,4,False
838747323517784064,2017-03-06 13:45:19,Change of command ceremony held at Barnes Air National Guard via @masslivenews https://t.co/au97N4Rgk1 https://t.co/GWMIanZfry,3,False
838536088142639105,2017-03-05 23:45:57,"Today we welcomed Col. Jim Suhr into @TheNationsFirst, administering the oath of enlistment as he takes over comman… https://t.co/Xv0AixQd0N",5,False
838135403618127875,2017-03-04 21:13:46,"""It's a quicker, streamlined process,"" said one local official as communities start seeing effects of regs overhaul: https://t.co/eFQjTleQCu",7,False
838123483620126722,2017-03-04 20:26:24,Rededicating Murphy Rink in Southie. @BostonFire FF Francis Murphy's commitment to his community extended to teachi… https://t.co/xpF2d0ljfN,13,False
838055879836581888,2017-03-04 15:57:46,"""Build the kinds of skills that people here in the Commonwealth need to build lives, build careers &amp; be successful."" https://t.co/tNV8X3ban8",4,False
837817099443634177,2017-03-04 00:08:57,RT @Pembroke_Titans: Very proud to accept this Governor's Citation on behalf of PHS's White Ribbon Club. @MassGovernor #WhiteRibbonDay @jan…,9,False
837791188166004736,2017-03-03 22:25:59,"The Baker-Polito Administration was in Greater Lowell &amp; the Merrimack Valley today. Check out the Moments:⚡️ 

https://t.co/6kB9bSxLfR",4,False
837753481792471040,2017-03-03 19:56:09,The schools that receive grants partner with local businesses to ensure they create curriculums that meet the deman… https://t.co/lWVYjcDvo5,9,False
837749552363028480,2017-03-03 19:40:32,To ensure MA's economy continues to grow we must train the next generation to meet the employment &amp; talent demands for the jobs of tomorrow.,23,False
837749137160433664,2017-03-03 19:38:53,"RT @middlesex_cc: .@MassGovernor awards $489,750 MA Skills Capital Grant to MCC to improve #STEM learning environments &amp; academic pathways…",12,False
837748911934746626,2017-03-03 19:37:59,Thrilled to be at @GrLowellTech_HS to announce $11.8 million in Skills Capital Grants to 32 schools to invest in ne… https://t.co/KTbmfMxGpz,15,False
837748012071931904,2017-03-03 19:34:25,"RT @BHCCBoston: Thank you @MassGovernor and Workforce Skills Cabinet for receiving $386,540 grant for a new electrical engineering lab http…",5,False
837745944623992833,2017-03-03 19:26:12,RT @MassEducation: .@MassEducation Sec. Peyser visits @UTEC_Lowell after @MassGovernor Cabinet #Lowell https://t.co/B5ts7M6Wko,5,False
837745798892892161,2017-03-03 19:25:37,RT @MassDOT: Secretary Pollack checks #Lowell Regional Transit Authority lobby renovation. https://t.co/xm6yd1gN6q https://t.co/z17fr0Vi4D,2,False
837745634740428802,2017-03-03 19:24:58,RT @MassLtGov: Touring a #CompleteStreets infrastructure project location with @MassDOT Sec Pollack &amp; @CityofLowellMA Mayor Kennedy. Grant…,7,False
837745526321864707,2017-03-03 19:24:32,RT @MassHHS: Thank you to Lowell @Mass_DCF for hosting us today! The work you do is appreciated everyday but esp during #socialworkmonth ht…,8,False
837694339383975936,2017-03-03 16:01:08,On the @UMassLowell campus with our full cabinet this morning for our weekly meeting. Great to have local officials… https://t.co/9cq993Ng3g,16,False
837632360946499584,2017-03-03 11:54:51,"RT @Urena: Massachusetts Governor Charlie Baker has ordered American &amp; Commonwealth flags lowered to half-staff Saturday, March 4, 2017 #Ho…",73,False
837418526730244097,2017-03-02 21:45:09,The First Lady had a lot of fun at the Francis Wyman Elementary School in Burlington reading Dr. Seuss with student… https://t.co/NX00UbZSMM,17,False
837404810542469121,2017-03-02 20:50:39,Enjoyed the opportunity to address the impressive and engaged young leaders from @YIGPRESS during their annual conf… https://t.co/UJlBibZKaa,10,False
