id,created_at,text,retweet_count,tweet.retweeted
797182309036425217,2016-11-11 21:00:48,This weekend is your last chance to submit to the #IEW2016 Video Contest! The deadline is MONDAY at noon: https://t.co/hSanaqjmhL,0,False
797099138869510144,2016-11-11 15:30:18,Don't forget to RSVP for a Chinatown Walking Tour this Monday #IEW2016 https://t.co/4ARkgKLzis https://t.co/U48WXGtQmA,0,False
797079948624281600,2016-11-11 14:14:03,FOOD and FUN! Join the Singapore Students Association for a Singaporean take on Thanksgiving dinner this Saturday: https://t.co/r21fo7MGUo,0,False
796753821804412928,2016-11-10 16:38:08,The LGBTQ Student Center will be holding a healing and community space TODAY from 12-2 in Kimmel 602. Stop by for lunch and discussion.,0,False
796717551770333184,2016-11-10 14:14:01,"International Education Week begins! Free food, movie screenings, walking tours are all available today: https://t.co/68WjBRT3ne",0,False
796462367261491200,2016-11-09 21:20:00,TOMORROW: A film all about the international struggle of finding a job with the right papers. RSVP to tune in: https://t.co/hmNUzObKsh,0,False
796383373639974912,2016-11-09 16:06:07,We revised the deadline of our IEW Video Contest! Submit by Nov. 14 for a chance to win a $300 bookstore voucher: https://t.co/nDIjr1wDrd,2,False
796376102382039041,2016-11-09 15:37:13,TOMORROW is the start of International Education Week 2016! Join in on the fun with a week of global celebrations:… https://t.co/HUl9iEywZ3,2,False
795646004653682688,2016-11-07 15:16:04,Watch this election cycle come to an end tomorrow night at the Election Night Extravaganza in Kimmel! Register here:https://t.co/2NoM4X3qU5,1,False
795630412726931456,2016-11-07 14:14:07,Download NYU's mobile app to gain access to new information and resources: https://t.co/fjLEvAaETV https://t.co/bBcutoUJcw,0,False
794575861802561537,2016-11-04 16:23:42,RT @nyunews: .@NYUDPS has updated its emergency call boxes at 9 locations on campus for urgent matters and immediate threats https://t.co/u…,4,False
794528137900134400,2016-11-04 13:14:04,RSVP for a Diwali/Garba Celebration this Sunday. Food and festivities provided! All students welcome:… https://t.co/W2t6VjpIDG,0,False
794224127339012096,2016-11-03 17:06:02,"Check out Scholly, an online database with bunches of scholarships. Apply using your NYUID and password:… https://t.co/mVbK5MXSJG",0,False
794207730005405696,2016-11-03 16:00:53,Enter the International Student Club raffle for the chance win tickets to the opera Don Giovanni on November 16:… https://t.co/NyXIzLsHWO,0,False
794165753230594048,2016-11-03 13:14:05,Join OnetoWorld for a Cuban extravaganza November 9! Register fo comida cubana and a guaranteed great time: https://t.co/bnD4xu9wfl,0,False
793845328332066816,2016-11-02 16:00:49,"RT @NYUWeinstein: The first day of Dia de los Muertos honors children who have died, while the second day honors the adults #nyucelebrates…",2,False
793830131768909826,2016-11-02 15:00:26,This Monday is the last day to withdraw from a course or register for pass/fail. Hop on it before its too late: https://t.co/uDfCVIBsXT,0,False
793813603568713728,2016-11-02 13:54:46,"RT @NYUGSL: A space for prayer, healing, and community. Today 12-1 PM. https://t.co/wt4bnbpMde",2,False
793501355495260160,2016-11-01 17:14:00,Halloween may be over but it's not too late for horror. Check out the scary movies that NYU alums have starred in: https://t.co/7e1d9S2pvK,0,False
793463045578223616,2016-11-01 14:41:46,RT @nyuniversity: ONE WEEK to Election Day—attend a discussion or event on campus: https://t.co/mH5ZIbQmKT https://t.co/53UnUKhrXm,2,False
793440970058653696,2016-11-01 13:14:03,"OPT Workshops TODAY, 3:00 PM at NYU Brooklyn. Learn about employment options and get specialized help. RSVP here: https://t.co/lmtI3urqE6",0,False
793120630514262016,2016-10-31 16:01:08,Do any of these match up? Read to see how countries around the world celebrate Halloween: https://t.co/PiMHZyb9IT,5,False
793097927468122115,2016-10-31 14:30:55,This week is your last chance to submit to the IEW Video Contest for a chance to win a $300 bookstore reimbursement… https://t.co/JzvlBKdJFy,0,False
793078581077368832,2016-10-31 13:14:03,Can I work off­-campus? Join us TODAY at 2:00 PM at the new StudentLink Center to answer questions like these: https://t.co/9yKVfxrhQ9,0,False
792093863087370240,2016-10-28 20:01:08,Have fun and don't eat too much candy this weekend! Send us your spookiest Halloween costumes for a chance to get r… https://t.co/BrNfVEQSgc,0,False
791991409503010816,2016-10-28 13:14:01,"TODAY: A discussion on Race, Racism and Xenophobia in a Global Context in Hemerdinger Hall. More info here: https://t.co/dp3wEDZbZh",0,False
791837223033380865,2016-10-28 03:01:20,"I have to hit the dance floor now, so I'm going to sign out. Thanks for following! ❤️ NYU #NYUInternational https://t.co/KEg9TBUtV2",0,False
791782099758047232,2016-10-27 23:22:17,"But before that, I need a nap! Can't party like an undergrad anymore #NYUInternational #late20s",0,False
791781371782000640,2016-10-27 23:19:24,@TanJingyeee Hi Ethel. Fall Ball is an NYU Law event organised by OSA and SBA.,0,False
791777282776006657,2016-10-27 23:03:09,"Just left school and it is pouring with rain!! Time to get ready for NYU Fall Ball, my first Halloween event! Excited! #NYUInternational",0,False
791733608381812737,2016-10-27 20:09:36,"Q. How do you satisfy that desire? A. For the outdoors, discovering nearby beaches &amp; hikes. For family, FaceTime! (2/2) #NYUInternational",0,False
791732771949510656,2016-10-27 20:06:17,"Q. What do I miss most about Australia? A. Family and the outdoors. Beaches, sun, surfing and fresh produce (1/2) #NYUInternational",0,False
791726076670177282,2016-10-27 19:39:40,Glamorous Library Photo Contest: Who took it best? #NYUInternational https://t.co/2kwY0d2OAi,0,False
791725099909021696,2016-10-27 19:35:48,Trying to take a glamorous photo of the library to share. My friend is scouting out various angles. Results to follow #NYUInternational,0,False
791718463991611392,2016-10-27 19:09:25,"Just picked up my shiny new NYU Law business cards. Once I create a 1 page US style resume, I'll be set for networking 💪🏼 #NYUInternational",0,False
791699357594685445,2016-10-27 17:53:30,A trademark litigator is our guest in class today. Next week Sarah Jessica Parker comes to speak at NYU! Only in New York! #NYUInternational,0,False
791688177002115073,2016-10-27 17:09:04,Scoffing down spaghetti bolognese in between classes. There's nothing like homemade comfort food on a busy rainy da… https://t.co/seOp4gSYMS,0,False
791674578384855040,2016-10-27 16:15:02,"Advanced Copyright class: 16 students (6 international) discussing ""Pretty Woman"" rap parody, Google books and fair use #NYUInternational",0,False
791657339988373505,2016-10-27 15:06:32,Rushing to get to class b/c that couch selfie. Took the subway. It's very efficient. I never have to look up a time… https://t.co/QeCzXnmUap,0,False
791648599922925568,2016-10-27 14:31:48,Hi! I'm Hannah from Australia studying an LL.M. at NYU Law. First time twitter takeover. Let's see how it goes!… https://t.co/LyLewAe9ts,0,False
791638536080556032,2016-10-27 13:51:49,Follow the OGS Twitter Takeover as we hand our account over to an NYU international student today! #NYUInternational,0,False
791375608223850496,2016-10-26 20:27:02,"Start off Halloweekend with the International Students Club! Join them TOMORROW for pumpkin carving, cider and pie:… https://t.co/5RIcWRI6ow",0,False
791296841904230400,2016-10-26 15:14:03,Head to the Avery Room TONIGHT at 4:30 in Bobst for a chat about NYU Library's #OpenAccessWeek and free access to digital information.,0,False
791278300635262976,2016-10-26 14:00:22,Learn how to ace that Skype interview with the @NYUWasserman digital interview workshop today at 2:00 : https://t.co/FCKWok5r5B,0,False
791266630491856896,2016-10-26 13:14:00,Eat FREE FOOD from around the world today at #NYU Tandon Gym from 3:00-5:00 as part of the NYU World Tour!,0,False
790964648896040960,2016-10-25 17:14:02,Head to Kimmel 806 TONIGHT at 6:00 for a pop up art gallery displaying diverse art from different countries as part of the #NYU World Tour!,1,False
790939945158504448,2016-10-25 15:35:52,"RT @80Laf: Diwali signifies the victory of light over darkness, good over evil, knowledge over ignorance, hope over despair #nyucelebrates…",1,False
790918543369990144,2016-10-25 14:10:49,TODAY: OPT Workshop at 11:00 in 383 Lafayette! Check out event details and attend to learn about employment options: https://t.co/WsElLyo1UW,1,False
790569645539549184,2016-10-24 15:04:26,Don't forget! Submit a video about your experiences to the International Education Week Video Contest to win big!… https://t.co/sgenIMS4oj,0,False
790541868761243648,2016-10-24 13:14:03,Today marks the beginning of NYU's World Tour! Experience a global field trip right here on campus: https://t.co/wBpsKoR6Qk,2,False
789525289567133696,2016-10-21 17:54:32,"RT @nyuniversity: Take a peek inside 383 Lafayette, NYU's new StudentLink center for registrar, bursar, and other services: https://t.co/13…",7,False
