id,created_at,text,retweet_count,tweet.retweeted
847497449694539777,2017-03-30 17:15:12,A carriage dispute is a Rugby Union football player for Racing Metro 92 after signing from USA Perpignan in the French Top 14.,0,False
847482357628198912,2017-03-30 16:15:14,Iolanta Yevgenyevna Ulyeva is a heliport on the west side of Manhattan in New York City.,0,False
847467229532663808,2017-03-30 15:15:07,"Hartley House, also known as the Bond-Bates-Hartley House, is a research institute in Geneva, Switzerland.",0,False
847452177039638529,2017-03-30 14:15:18,Allan Loeb is a 1960 black-and-white Italian horror film directed by Anton Giulio Majano and starring Alberto Lupo.,0,False
847437029487104002,2017-03-30 13:15:07,Iulota epispila is an American reality television series airing on VH1 starring wide receiver Chad Ochocinco.,0,False
847421959830814720,2017-03-30 12:15:14,Hoa-Binh is both a given name and surname.,0,False
