id,created_at,text,retweet_count,tweet.retweeted
5104323935600640,2010-11-18 03:45:40,"Okay, after this Sony deal was inked, McClain went to work putting together the first album",63,False
5103961233166337,2010-11-18 03:44:13,Im sorry its taking so long I get emotional,47,False
5103478619766784,2010-11-18 03:42:18,Maybe they were too busy getting deals done,58,False
5103342241980416,2010-11-18 03:41:46,Neither of the executors didn't show up to pay their respects,74,False
5102992311193601,2010-11-18 03:40:22,"I invited McClain to the burial, Ironically, he didn't show up",83,False
5102666518626304,2010-11-18 03:39:05,"Like AEG, they were cutting deals with the Estate before I could get my brother in the ground. May he rest in peace.",106,False
5102347009138689,2010-11-18 03:37:48,"In fact, when I heard about the Sony deal, it made me sick",81,False
5102187751407616,2010-11-18 03:37:11,"Sony has 250 mil reasons to convince the public that it is his voice, if you know what I mean.",135,False
