id,created_at,text,retweet_count,tweet.retweeted
825388750825996289,2017-01-28 17:03:07,FedEX issues statement about driver who fought thugs burning USA flag. Video: https://t.co/GHdXFSkh8N,105,False
825381418935148544,2017-01-28 16:33:59,"DML's Walk &amp; Talk at 4pmET. Until then, please take our DACA poll: https://t.co/y8bYBPLkvp",39,False
825366166600310784,2017-01-28 15:33:23,Iraqi refugees detained in US airport after new Trump exec order.  DETAILS: https://t.co/h49ArMIu0m,55,False
825158084146425857,2017-01-28 01:46:32,OBAMA's daughter joins Pipeline protesters.  https://t.co/9ai9R6UoAk,94,False
825143728817987584,2017-01-28 00:49:30,Anti-Trump Liberals Fleeing to Canada Get Rejected. DETAILS: https://t.co/WlJELPyuGs,274,False
825063784968515584,2017-01-27 19:31:49,REPORT: Univ. study finds Clinton rec'd massive number of illegal votes. Details: https://t.co/m5YdNU8Ulj,347,False
825019213744132096,2017-01-27 16:34:43,DML walk n talk in 6 min. https://t.co/79mYTqkY17,18,False
824990849398403073,2017-01-27 14:42:00,Philly mayor puts out statement claiming Trump gave false report: https://t.co/eTjqy8PFGC,25,False
824773254267150337,2017-01-27 00:17:22,BREAKING: Major metropolitan to stop acting as a sanctuary city. https://t.co/sdWa8XBQRw,172,False
824655703054884867,2017-01-26 16:30:15,DML going live in 10 min. DML app or https://t.co/79mYTqkY17,19,False
