id,created_at,text,retweet_count,tweet.retweeted
798974720108396544,2016-11-16 19:43:12,"This month, I’m thinking of all those impacted by pancreatic cancer. With the 21st Century Cures Act, we are on the… https://t.co/mW4iw5M4if",2,False
798667810893348864,2016-11-15 23:23:39,"Today, we passed an important bill, the Iran Sanctions Extension Act, for the national security of the U.S. &amp; our a… https://t.co/QXxgf0rohf",4,False
798613080880148480,2016-11-15 19:46:10,Thanks to these @UF students for coming out to my D.C. office! Their passion for bettering our country is inspiring… https://t.co/jBIIK2f62d,2,False
798586670270545921,2016-11-15 18:01:13,Self-driving cars are no longer a far off idea—the technology is here. I joined my colleagues on @HouseCommerce to… https://t.co/ZugPIaS79f,7,False
798253459619377152,2016-11-14 19:57:10,Let’s get the 21st Century Cures Act across the finish line &amp; give hope to millions of patients &amp; families #CuresNow https://t.co/L5ggfbImgU,7,False
797139385628196865,2016-11-11 18:10:14,Happy Veterans Day! I was honored to recognize some true American heroes today in Timber Pines. God bless our Veter… https://t.co/5SpkuIF2Mg,2,False
796825432352026625,2016-11-10 21:22:42,"I was at SPC today for the opening of “Remembering Florida’s Fallen,"" a memorial to those who gave their lives whil… https://t.co/7azoF8XoY7",8,False
796793245149888513,2016-11-10 19:14:48,"Happy 241st birthday @USMC. Special shout out to my District Director, Michael Ciminna &amp; congressional fellow, Mich… https://t.co/38HqOtCmgZ",1,False
796407538199724032,2016-11-09 17:42:08,Help spread the word about this great event tomorrow for local businesses and Veteran &amp; Military business owners:  https://t.co/m91OPWirwv,2,False
795346014442049540,2016-11-06 19:24:01,Special ceremony today at Elfers Post Office for local Purple Heart hero Private First Class Felton Roger Fussell. https://t.co/9eqwPF6ACI,4,False
795015606110134272,2016-11-05 21:31:05,"With Veterans Day coming up, it was a privilege to speak today in New Port Richey at the First Baptist Church's Vet… https://t.co/HobnjUGLFY",3,False
794585600858947584,2016-11-04 17:02:24,Great to speak to the @RootersClubFL today and support our local businesses. https://t.co/Itd6Xpc4rs,0,False
793919389884088320,2016-11-02 20:55:07,The brave men &amp; women of our military do not serve alone. Thank you to those who stand by our nation’s service memb… https://t.co/swLXNFpTOq,13,False
793565544079298561,2016-11-01 21:29:04,"I've been busy in 114th Congress: 6 laws, 20+ public meetings, &amp; 80k+ letters &amp; emails later, I’m still working har… https://t.co/PjG97AhiMB",13,False
793451983768285184,2016-11-01 13:57:49,ICYMI I was recently in Oldsmar to host a town hall meeting with local Veterans and Veterans’ service organizations. https://t.co/8gfR1d0HhH,0,False
792114325192372224,2016-10-28 21:22:26,"Proud to join the West Pasco Dental Assoc. today for Stars, Stripes, &amp; Smiles, an event to provide local Veterans d… https://t.co/SsMuvWt1RY",2,False
792000481891610624,2016-10-28 13:50:04,"76 yrs ago, Greek soldiers refused Mussolini’s advances during WWII, demonstrating commitment to freedom with just… https://t.co/nmCjwZjVT1",43,False
791761402436386817,2016-10-27 22:00:03,FEMA officials will be at the NPR Lowe’s today - Nov. 1 to provide free advice on preparing for future hurricanes. https://t.co/yZjHjx7fA2,1,False
791738754528481280,2016-10-27 20:30:03,"Glad to join Chasco Middle School today to help raise awareness about drug abuse, addiction, and prevention. https://t.co/bq0iKotgZB",4,False
791375718835949568,2016-10-26 20:27:29,"Today for National #DayoftheDeployed, join me in sending a message of gratitude to our deployed service members &amp; t… https://t.co/3JoldOd6oe",2,False
791345146419961860,2016-10-26 18:26:00,Answered questions and gave an update on legislation to support our military &amp; Veterans to the @MilitaryOfficer cha… https://t.co/hLLYkEuaLd,2,False
791301820417204225,2016-10-26 15:33:50,"After sending a letter yesterday, I am very pleased that DoD will now allow Veterans to keep their bonuses. https://t.co/az21hlAYn0",3,False
791019517262585856,2016-10-25 20:52:04,I have requested the Secretary of the Army allow Veterans to keep the bonuses they were promised for their service:… https://t.co/JCssOGFv9t,19,False
790962281744072704,2016-10-25 17:04:37,"Great to be back at my alma mater, Tarpon Springs HS, this morning with these awesome US history students. Go Spong… https://t.co/rYfw00S8z0",1,False
790939586662981632,2016-10-25 15:34:27,We’ve seen this before: Premiums will double next year under Obamacare. Read a Better Way to fix health care here--… https://t.co/BmcR213OkI,33,False
790191045078228993,2016-10-23 14:00:00,Looking forward to teaming w/ Facebook &amp; Blue Star Families to promote Veteran small businesses. More info here: https://t.co/m91OPWA2o3,3,False
789828669472509953,2016-10-22 14:00:03,"Today is National Drug Take Back Day. Safe disposal of unused/expired meds is free, anonymous, &amp; reduces the risk o… https://t.co/fF5zCl7Yfd",3,False
789575972609744896,2016-10-21 21:15:56,Fun morning riding “undercover” with UPS on their route in Safety Harbor. These folks help keep our local economy g… https://t.co/vJPQqYAEo7,1,False
789495148237520901,2016-10-21 15:54:46,"This week, I presented these outstanding @SheriffPinellas officers with flags flown over the U.S. Capitol in their… https://t.co/u0HJTnUKmA",7,False
789180376040083456,2016-10-20 19:03:58,The President’s speech about Obamacare stands in stark contrast to the Obamacare I hear about from my constituents: https://t.co/WNFCNXN9ZT,0,False
789147334521327616,2016-10-20 16:52:40,Joined the Stamas Yacht team in Tarpon Springs yesterday to talk to local students about pursuing careers in manufa… https://t.co/vPA7CEirZn,3,False
789114767193571328,2016-10-20 14:43:16,Thank you @JDRFTampaBay—it was great to meet you all and hear your stories. https://t.co/CQsHL8gXls,0,False
788812891059355649,2016-10-19 18:43:43,"If you or your business were affected by Hurricane Hermine, FEMA has opened Disaster Recovery Centers in our area. https://t.co/fqSzESU8Y9",1,False
788740093087539209,2016-10-19 13:54:26,"On #SupportYourLocalChamberOfCommerce Day, I’d like to thank all the local chambers for the fantastic work they do… https://t.co/FTMYa56mz7",5,False
786965370775232512,2016-10-14 16:22:20,I had a great time this morning visiting Ms. Durnell’s third grade class at Sutherland Elementary in Palm Harbor. https://t.co/SyET78rlpJ,1,False
786590183353413632,2016-10-13 15:31:28,"241 years ago today, the world’s most powerful naval force came to be. Happy birthday to the U.S. Navy. https://t.co/98M5691Gjj",14,False
786309088690991104,2016-10-12 20:54:30,"Contrary to what they say, the VA is doing very little to hold failing managers accountable. This must change. https://t.co/8berMQ8vKf",2,False
786260140571910144,2016-10-12 17:40:00,Wishing a meaningful and easy fast to my friends observing Yom Kippur today. https://t.co/UHpYKlo7Ng,2,False
785964047124529153,2016-10-11 22:03:25,"Veterans in Pasco County seeking dental care should call my office at 727-232-2921 to sign up for my annual Stars,… https://t.co/kT8GRAOOqS",8,False
784098068413181952,2016-10-06 18:28:42,"Folks—with storm force winds approaching our area, Pasco &amp; Pinellas County schools are closed tomorrow. Stay safe! https://t.co/tvedwWuVjt",1,False
783727501214412802,2016-10-05 17:56:11,My statement on the VA Inspector General report revealing continued delays and mismanagement at Phoenix VA facility: https://t.co/J57KZPZtbO,3,False
783680229101436928,2016-10-05 14:48:21,"October is Breast Cancer Awareness Month, a time to renew our commitment to finding a cure. https://t.co/lIpVxNbz9y",8,False
783356686648111105,2016-10-04 17:22:42,I’d like to wish my Jewish friends across Florida’s 12th district a happy and blessed new year. L’Shana Tova! https://t.co/xsqDRQVCbc,0,False
773879993868881920,2016-09-08 13:45:43,"10AM TODAY: @HouseCommerce #SubHealth reviews 5 bipartisan bills, including my bill to help patients w/ #CHD: https://t.co/KNbX53ljrr",1,False
773560330211426304,2016-09-07 16:35:29,Are you getting my weekly newsletter? Sign up here: https://t.co/6Kc1qYYIBX,2,False
773517600194191360,2016-09-07 13:45:41,Tune in to @housevetaffairs hearing on the future of VA Healthcare @ 10:30am  &gt;&gt; https://t.co/CSCYCrCmtY,3,False
773265885301772289,2016-09-06 21:05:28,Happening in the House this week &gt;&gt; https://t.co/zahLCOU1Mo,2,False
773200531397509120,2016-09-06 16:45:46,Taking YOUR #FL12 ideas back to DC today! Thanks to all who met w/ me this summer – I will continue working to support you.,0,False
773142611364343809,2016-09-06 12:55:37,A look back at a great summer in #FL12 &gt;&gt;&gt; https://t.co/hggJwc1oir,1,False
772795301950263296,2016-09-05 13:55:32,Happy #LaborDay! Thanks to all of our workers in #FL12 &amp; across America helping our economy thrive! https://t.co/XawzqdieOL,3,False
771740921595592704,2016-09-02 16:05:48,August 2016 by the numbers &gt;&gt; https://t.co/hggJwc1oir,3,False
771704359642103808,2016-09-02 13:40:31,ICYMI: Read my @Medium posts on how I’m working to help our nation grow &amp; prosper https://t.co/VNdvIBwf22 #BetterWay https://t.co/UhidIshb2h,3,False
771465238269071360,2016-09-01 21:50:20,"Thanks to all who met w/ me, participated in my town halls, &amp; showed me the work they're doing for #FL12: https://t.co/hggJwc1oir",1,False
771438611917135872,2016-09-01 20:04:32,RT @HouseCommerce: NEXT WEEK: #SubHealth hearing to examine 5 #bipartisan bills to improve #publichealth &gt;&gt; https://t.co/5JrIojREfX,6,False
771423735563874305,2016-09-01 19:05:25,Highlights from last month &gt;&gt;&gt; https://t.co/hggJwc1oir,1,False
771377337208279040,2016-09-01 16:01:03,"#FL12 - for help, please reach out to my office at 727-232-2921. Stay safe &amp; review these emergency tips: https://t.co/L7SmNTu6q3 #Hermine",6,False
771367112539566080,2016-09-01 15:20:25,RT @usairforce: It could mean the world to someone for you to #BeThere. #SuicidePrevention 365. https://t.co/ZYNO51Gw6x https://t.co/YaxoLz…,159,False
771338050165145600,2016-09-01 13:24:56,Stay safe &amp; continue to monitor our local news outlets during #Hermine!,3,False
771337991214206977,2016-09-01 13:24:42,RT @PalmHarborPatch: Tropical Storm Hermine Intensifies On Way to Florida's Gulf Coast https://t.co/p4CrV7fTsr https://t.co/rEVtZXKvaW,2,False
771084164959465472,2016-08-31 20:36:05,"#FL12 residents, stay safe through Tropical Storm #Hermine! Be alert and prepare for flooding &amp; high winds. https://t.co/EEI9bnN3nm",1,False
771080665702031360,2016-08-31 20:22:11,RT @abcactionnews: JUST IN | Pasco Schools closed Thursday due to #TSHermine.  More closings here: https://t.co/l0wTGMqCh3,5,False
771079537237041152,2016-08-31 20:17:42,"RT @BN9: Update: Pasco County Schools is closed Thursday, Sept. 1. https://t.co/ySl7k2yU3H #Hermine",4,False
