id,created_at,text,retweet_count,tweet.retweeted
850433137427574784,2017-04-07 19:40:34,"On this week’s #DiscussWithGus: Internet privacy, the House investigation of Russia, &amp; protecting VA whistleblowers. https://t.co/6SzceRdwHI",3,False
850065339518001152,2017-04-06 19:19:05,.@DAVHQ does incredible work on behalf of our Veterans. I will keep fighting to ensure every Vet gets the care they… https://t.co/HrRucsPCDu,14,False
849994733296504832,2017-04-06 14:38:31,RT @GoHART: Thanks @RepGusBilirakis for the shout out on our upcoming autonomous vehicle pilot and for your continued support! https://t.co…,1,False
849748775191146497,2017-04-05 22:21:10,"Proud to receive the @NDSS Champion of Change award, but the real winner is my friend Abigail and her family from F… https://t.co/QbOPt6Xlfk",1,False
849721386876641280,2017-04-05 20:32:20,Today with my strong support the House passed bipartisan legislation to continue the Veterans Choice Program beyond… https://t.co/T57JZwhuxz,2,False
849669922628218880,2017-04-05 17:07:50,RT @NDSS: Thank you @RepGusBilirakis for your support! We are glad you were able to accept your award today! https://t.co/RDqfufk6oi,5,False
849403715492642816,2017-04-04 23:30:01,"With the VA’s Veterans Crisis Line, the stakes are too high for even one call to go unanswered. https://t.co/LPrDQFzO5V",0,False
849373515518169088,2017-04-04 21:30:01,Productive meeting today with Jacksonville Army Corps of Engineers about Ridge Road extension &amp; dredging the Anclot… https://t.co/jixv4nyGbJ,6,False
849358435078422528,2017-04-04 20:30:05,"Thanks to Pinellas County Commissioners Janet Long, Pat Gerard, &amp; PSTA CEO Brad Miller for bringing the voices of o… https://t.co/4m6j4BcHSg",1,False
849343313521950720,2017-04-04 19:30:00,"Capt Simms, Col Amodeo, &amp; Tech Sgt Bennett of the 927th Air Refueling Wing at MacDill came by my office today. Grat… https://t.co/6ZNISOb9FP",1,False
849326147208957956,2017-04-04 18:21:47,The VA GORDIAN KNOT Act helps the VA better serve Veterans by increasing the accuracy &amp; integrity of data reported.… https://t.co/u4UfOC6Yiv,1,False
847812522300387329,2017-03-31 14:07:11,"On this week’s #DiscussWithGus: NIH funding, President Trump’s picture in VA hospitals, and tax reform. https://t.co/33BtYP84eZ",6,False
847505607045169152,2017-03-30 17:47:37,I encourage all high school artists from FL12 to enter the 2017 Congressional Art Competition! Learn more:… https://t.co/WnGwGSycdZ,7,False
847455275548160001,2017-03-30 14:27:37,"RT @SSNAlerts: .@RepGusBilirakis goes to bat for reforming the @DeptVetAffairs, expanding dental benefits for veterans: https://t.co/IbhOmg…",10,False
847223423503708161,2017-03-29 23:06:19,The opioid epidemic affects FL12. I look forward to working with @POTUS on our shared goal to fight this crisis. https://t.co/YZDkOCVH4J,2,False
847196008685678592,2017-03-29 21:17:23,"We need to modernize 911 services to work with our next generation technology &amp; better assist elderly, disabled &gt;&gt; https://t.co/EDm9FrqKWq",3,False
847156033663447041,2017-03-29 18:38:32,"Today is the first ever National Vietnam War Veterans Day. Now, and on every March 29th going forward, we honor thi… https://t.co/i5Ci5Sfevj",9,False
847137599835820032,2017-03-29 17:25:17,My bill the VA GORDIAN KNOT Act helps untangle some core VA problems: lack of accountability &amp; manipulation of data. https://t.co/xaJ08mjgPO,5,False
846829307557281793,2017-03-28 21:00:14,"Great mtg w/ Dr. Diaz with Florida Cancer Specialists on making health care accessible &amp; affordable, especially for… https://t.co/XFQlnbiPD5",3,False
846801833783967746,2017-03-28 19:11:04,"My bill, the VET CARE Act, will implement a 4-year pilot program to expand access to dental care for Veterans  &gt;&gt; https://t.co/ybBFESgcr5",6,False
846775916575571969,2017-03-28 17:28:05,Over 30 #AIPAC members from Florida stopped by my office this afternoon for a fantastic meeting on reinforcing the… https://t.co/RtxW0uuCTZ,2,False
846753103391211521,2017-03-28 15:57:26,"7,000 rare diseases &amp; 30 million Americans affected, but only 500 treatments. The OPEN Act will help change that. https://t.co/YqGVB5tCD1",7,False
845660082788618240,2017-03-25 15:34:09,Happy Greek Independence Day to my fellow Greek-Americans! https://t.co/M7pLC46Gi7,26,False
845394091122790400,2017-03-24 21:57:12,"My main concern has been, and will continue to be, making sure my constituents have access to the best possible hea… https://t.co/CzmAM2BCwh",8,False
845326167653695491,2017-03-24 17:27:18,Enjoyed answering your calls today on AHCA. I hope you'll continue to stay in touch on the issues that matter to yo… https://t.co/b2XHYTo2MD,6,False
845041140747436033,2017-03-23 22:34:42,I’m thrilled we took a positive step forward today to turn the Ridge Road extension project into a reality: https://t.co/wffZUA8qvI,7,False
845007967011393536,2017-03-23 20:22:53,"On this week’s Discuss with Gus: Meals on Wheels, compensating Veterans fairly, and expanding choices for patients: https://t.co/XCpodk137x",5,False
844710212011540480,2017-03-23 00:39:43,Flooding &amp; high flood insurance premiums are big issues for Florida. The FL delegation met today to discuss strengt… https://t.co/tOxZLDIY2J,4,False
844295316308459523,2017-03-21 21:11:04,Fentanyl is a major part of the opioid crisis. We need to raise awareness &amp; help communities tackle this head on. https://t.co/ig4I8vtHpv,8,False
844204194554941441,2017-03-21 15:08:59,Great to hear from @POTUS this morning as he spoke to House Republicans in support of the American Health Care Act… https://t.co/XfVhO84baC,4,False
842514171266826241,2017-03-16 23:13:26,Most VA staff are dedicated to helping #Veterans but some bad actors hurt Vets &amp; the agency. Glad we passed the VA… https://t.co/2LSIK1a5X6,9,False
842153429023764480,2017-03-15 23:19:58,"Celebrating the 100th birthday of James “Maggie” Magellas, a WWII Army officer &amp; most decorated officer in the hist… https://t.co/G8NgsES9yt",11,False
842095882837360646,2017-03-15 19:31:18,"RT @SuncoastNews: Constituents in the district of @RepGusBilirakis may submit nominations for 'Heroes Among Us' recognition
https://t.co/em…",3,False
842062310415953920,2017-03-15 17:17:54,The House will soon vote on the VA Accountability First Act to bring accountability and transparency to the VA. Pro… https://t.co/aYIpvK88HZ,8,False
841659139101216769,2017-03-14 14:35:50,Do you know somebody who makes a positive impact on our community? Nominate them for my Heroes Among Us award. https://t.co/6KgtaJMd54,3,False
841346192072138752,2017-03-13 17:52:18,Happy National K9 Veterans Day to the military canines who served alongside our men and women in uniform! https://t.co/LbdjUNAAyS,7,False
839873719854108672,2017-03-09 16:21:13,Short break from 24+hrs of committee debate on the American Health Care Act to meet w/ Gov. Scott &amp; discuss solidif… https://t.co/7ZKBWScXTK,5,False
839495192092737537,2017-03-08 15:17:05,Firefighters from Clearwater and Tarpon Springs were out in Washington this week. Thank you for everything you do f… https://t.co/rKsfHGG4XY,1,False
838926034166820864,2017-03-07 01:35:27,Delivering on the promise to repeal &amp; replace the ACA in an open and transparent manner. Read the bill text here: https://t.co/8tQaHCXyDT,39,False
838854784732053508,2017-03-06 20:52:20,Met with the Community Health Centers of Pinellas team today – they do amazing work to provide quality health care… https://t.co/gUjGjGV6t4,3,False
837705827666518021,2017-03-03 16:46:47,"Happy birthday, Florida! The great state we call home was granted statehood on March 3, 1845. https://t.co/TVTJPlcunc",12,False
837426900423278592,2017-03-02 22:18:26,I announced my 2nd annual Heroes Among Us event to recognize the men &amp; women who make FL12 such a special place!… https://t.co/X429jj4mX9,3,False
837342827931631616,2017-03-02 16:44:21,"Proud to be a partner in the fight against congenital heart disease, but the real champions are CHD patients and th… https://t.co/o2y06K3nE3",7,False
836797007461249025,2017-03-01 04:35:28,The President's #JointAddress was uplifting &amp; unifying. He reached out to both parties to work together for the goo… https://t.co/oXpYZZq3wV,512,False
836772224682045440,2017-03-01 02:56:59,We must stand up for our true American heroes—our Veterans. Glad President Trump spoke on this tonight. #JointAddress,7,False
836769670699094016,2017-03-01 02:46:50,I look forward to working with @POTUS to fight on behalf of the 30 million Americans living with rare diseases #RareDiseaseDay #JointAddress,26,False
836687546247688192,2017-02-28 21:20:30,"Productive meeting w/ @FLGovScott &amp; Pasco Commissioners today on Ridge Road extension, a critical infrastructure &amp;… https://t.co/Hrl4VniDii",7,False
836601536700624897,2017-02-28 15:38:44,"In honor of #RareDiseaseDay, I introduced the OPEN Act to help open the door to potentially hundreds of new treatme… https://t.co/7y9f2njjGl",27,False
836351876006305792,2017-02-27 23:06:40,Glad to have Colin from FL12 as my guest for the President's speech to Congress. His passion for politics at such a… https://t.co/fysKGgHrP1,5,False
835229270511337473,2017-02-24 20:45:50,"Great mtg today w/ local doctors, patients, &amp; health care experts about ACA replacement. I look forward to bringing… https://t.co/Z9w2HVw7Ng",3,False
834915759746920451,2017-02-24 00:00:03,Today we commemorate 72 years since this iconic moment—U.S. Marines raising the stars and stripes over Iwo Jima dur… https://t.co/he4gS12Rfi,4,False
834880857345249280,2017-02-23 21:41:22,At the top of the agenda in my meeting w/ local Veterans leaders: Improving transition assistance programs for our… https://t.co/yYkitwS15x,2,False
834776923402285056,2017-02-23 14:48:22,I greatly appreciate everyone who came out yesterday and helped make this year’s job fair a success! Our community… https://t.co/GphGspS6oc,0,False
834552680488042497,2017-02-22 23:57:18,We can find common ground and have a constructive exchange of ideas. That’s what democracy is all about! https://t.co/OiP1NyY4e3,5,False
834540118044180480,2017-02-22 23:07:23,"My 3rd town hall this month is underway. It's my duty as a representative to listen to my constituents, whether we… https://t.co/NYG9LjfZY8",22,False
834151948765032448,2017-02-21 21:24:57,Congrats to Bethany from Land O’Lakes on receiving a Congressional Award for community service &amp; on her appointment… https://t.co/uP8cyxwjR1,8,False
834089538083549184,2017-02-21 17:16:57,Job seekers of all ages and skills are encouraged to attend my 9th annual job fair in Tarpon Springs! https://t.co/bT3peE6kyY,6,False
833706286348955648,2017-02-20 15:54:02,I’m holding a health care listening session on Wed. in Wesley Chapel. My 3rd event this month. Hope to see you there https://t.co/iUIxwjUsVV,8,False
832696871667642368,2017-02-17 21:02:59,Enjoyed meetings these bright students from Wesley Chapel in D.C. for @jsajuniorstate Winter Congress. Keep up the… https://t.co/OQUylVTW0V,6,False
832651547913773058,2017-02-17 18:02:53,I cosponsored legislation to ensure coverage for those with pre-existing conditions under ACA replacement --&gt; https://t.co/p25yjLkzjJ,9,False
832270573774454785,2017-02-16 16:49:02,.@JayPreble Already held 2 town halls this month &amp; planning another soon. Telephone events help reach those who can’t make it in-person.,3,False
831970623672950785,2017-02-15 20:57:08,Fantastic to meet these Florida heroes from @JewishWarVets. I'm deeply grateful for their service and sacrifice on… https://t.co/FLAITveAcI,4,False
831946292599332864,2017-02-15 19:20:27,Proud to announce the House passed the WINGMAN Act to help congressional offices better assist Veterans w/ VA issues https://t.co/GAzUzfu4Re,5,False
831572440396468227,2017-02-14 18:34:54,"Happy Valentine's Day to my beautiful wife, Eva! https://t.co/IHdW7Dfg5I",1,False
830499123946221569,2017-02-11 19:29:55,Thank you to everyone who came out to my listening session in New Port Richey. I will bring your input back with me… https://t.co/wHL7dZiwXJ,7,False
830439075559649281,2017-02-11 15:31:19,In 09 Dems passed ACA w/o listening to the people first. Held town halls after it became law. I want to do it diffe… https://t.co/cP7J5UPnep,6,False
830432698716082178,2017-02-11 15:05:58,"It's my duty to hear you out, even if we may disagree. I want today's town hall to be constructive and I want to fi… https://t.co/M1OSgRG86X",12,False
829707128336216064,2017-02-09 15:02:49,"RT @SuncoastNews: Bipartisan bill aims to lower prescription drug costs
— Bilirakis wants to spur cheaper generic medicine production
https…",7,False
829060801021562880,2017-02-07 20:14:32,February is #BlackHistoryMonth. Let's recognize &amp; celebrate the contributions of all African Americans who helped s… https://t.co/HyjOWSZNQH,6,False
828006271693553664,2017-02-04 22:24:13,Thank you to everyone who came to my health care reform listening session this morning in Pinellas County. https://t.co/JYMlHAXRdM,11,False
827218777536335872,2017-02-02 18:15:00,My view at the health subcommittee hearing as we examine reforms to keep our nation’s health care system affordable… https://t.co/2G6AEl02ZW,0,False
826908620239548416,2017-02-01 21:42:32,"Honored to meet Lt. Jim Downing, oldest known Pearl Harbor survivor at 103 years old, &amp; thank him for his dedicated… https://t.co/xmQQuUpu9h",5,False
826890221203636225,2017-02-01 20:29:26,".@KevinJCoupal1 Kevin, please call my office at 727-232-2921 and we will do everything we can to help. Thank you for your service.",2,False
826863719221174272,2017-02-01 18:44:07,"Enjoyed meeting folks with @NFB_voice yesterday! Loss of sight does not mean loss of an active, meaningful life. https://t.co/MsDZk2Qbxu",2,False
826822197490700288,2017-02-01 15:59:08,"RT @IAFC: Thanks @RepGusBilirakis, @RepPeteKing, @SusanWBrooks for supporting biopreparedness for fire responders!... https://t.co/4Jfqz0up…",3,False
826628380040773632,2017-02-01 03:08:58,Judge Neil Gorsuch will serve the court and the American people well. I applaud his nomination to the U.S. Supreme Court.,3,False
826594027361488897,2017-02-01 00:52:28,My legislation to secure grant funding for countermeasures &amp; equipment for first responders has passed the House --… https://t.co/YSxndvG7H9,1,False
826448871421333504,2017-01-31 15:15:40,RT @SSNAlerts: .@RepGusBilirakis teams with @RepSchrader to ensure more generic drug production https://t.co/J0cqTppdlL #SSNalerts #sayfie…,2,False
825067467785502720,2017-01-27 19:46:27,"On #HolocaustRemembranceDay, let us keep in our hearts the over six million victims of the Holocaust and vow “Never… https://t.co/EL1WOnYGkb",9,False
825006705461325824,2017-01-27 15:45:01,Floridians visiting D.C. for #MarchForLife are welcome to stop by my office Rayburn 2112 for coffee and donuts this afternoon!,10,False
824639021628399616,2017-01-26 15:23:58,My letter to President Trump urging the importance of completing the Ridge Road project for Pasco County residents:… https://t.co/stsnwJIkEk,15,False
824274185140707328,2017-01-25 15:14:14,I will be holding health care reform listening sessions in Pasco and Pinellas counties—and I want to hear from you!… https://t.co/g19vejR8pn,7,False
823899934814588928,2017-01-24 14:27:06,"If you need help with a federal agency, my staff is holding office hours in Wesley Chapel on Thurs. We will do our… https://t.co/2uRECDSufH",3,False
822504787086364672,2017-01-20 18:03:17,God bless America today &amp; every day in this new chapter of her history. #Inauguration2017 https://t.co/uiv0d0296Y,12,False
821783252453101568,2017-01-18 18:16:10,"Thanks to the Upper Tampa Bay Chamber for inviting me to their meeting! Tax reform, health care, &amp; helping small bi… https://t.co/Vq1lN9QXnu",0,False
821757297819054081,2017-01-18 16:33:01,"Floridians visiting Washington, D.C. for the inauguration are invited to my office for an open house tomorrow. Hope… https://t.co/7balkwodVO",7,False
821099708873441281,2017-01-16 21:00:00,"On National Religious Freedom Day, let us join together in honor of one of the fundamental principles our great nat… https://t.co/S3Awh2fTis",2,False
821029344210546691,2017-01-16 16:20:24,"Today we honor the life of a great man and a pioneer of justice, Martin Luther King, Jr. May his legacy live on. https://t.co/fEpAYMdzC1",13,False
820328942238388224,2017-01-14 17:57:15,"Finally, those Veterans who were exposed to toxic water while serving at Camp Lejeune will get the benefits they ne… https://t.co/PNt48dymy5",7,False
819667320683589633,2017-01-12 22:08:12,"My bill, the Medical Preparedness Allowable Use Act, ensures our first responders have the tools they need to keep… https://t.co/tirAXCBDdY",10,False
819642458707546113,2017-01-12 20:29:25,Honored to be named Vice Chairman of @HouseVetAffairs &amp; work w/ @DrPhilRoe to improve care for Veterans &amp; reform VA. https://t.co/2IFy1vyZER,14,False
819254909505781763,2017-01-11 18:49:26,"Human trafficking isn’t only happening in other countries, we’ve seen it in Pasco County. We must stop this &amp; resto… https://t.co/yNGlsB1WCn",11,False
818886954418864128,2017-01-10 18:27:18,Families across Florida are feeling the burden of Obamacare. We need a health care system that empowers patients--n… https://t.co/pgCNN9WNN5,18,False
817501185125023746,2017-01-06 22:40:45,My staff &amp; I are ready to work for you! Call my office in DC at 202-225-5755 or in Florida at 727-232-2921 if we ca… https://t.co/v5bjJqJS0W,8,False
817490995369693184,2017-01-06 22:00:16,My prayers are with the #FLL victims and their families after today’s shooting. Thank you to the first responders for your courage.,1,False
817467127561158660,2017-01-06 20:25:25,Today I’m thinking of my friends celebrating Epiphany Day in Tarpon Springs. I hope to be with you all next year. X… https://t.co/0MgO5nL5TP,3,False
817167706256445440,2017-01-06 00:35:38,My statement on tonight's vote to condemn the anti-Israel resolution adopted by the UN Security Council:… https://t.co/0zQLlohONF,2,False
817116067692707840,2017-01-05 21:10:26,The men &amp; women who dedicated their lives to military service should be compensated fairly. That’s exactly what my… https://t.co/PfGhmdLgVc,0,False
817070363217694721,2017-01-05 18:08:49,"Today, I gave my first speech of the 115th Congress to outline my vision for reforming the VA and improving care fo… https://t.co/GDrcsGO4qg",4,False
816673700263116800,2017-01-04 15:52:37,The very first bill of 2017 passed by the House helps hold those who care for our Veterans accountable --&gt; https://t.co/L1OcTzea9x,1,False
816369471317245952,2017-01-03 19:43:44,It's a privilege to be sworn into the 115th Congress today! I pledge to keep working hard to solve problems here in Florida &amp; across the US.,4,False
816349456320917504,2017-01-03 18:24:12,I opposed the measure to change the Office of Congressional Ethics from the start &amp; I'm glad it will not have a place in the 115th Congress.,7,False
815573300021559296,2017-01-01 15:00:02,May 2017 be filled with happiness and good health. Happy New Year! https://t.co/f8r8kE2QsU,7,False
814831886203842561,2016-12-30 13:53:55,"All along in 2016, my main focus was always working hard on behalf of Florida’s 12th District --&gt; https://t.co/sqwT0pKJ86",2,False
814516344028741633,2016-12-29 17:00:04,"My office is here to serve you, the people of Florida’s 12th District. Here’s how we can help --&gt; https://t.co/GxcWT4BfqL",4,False
814138844933025793,2016-12-28 16:00:01,"Throughout 2016 I had the opportunity to meet with many of you across Florida’s 12th District, listen to your feedb… https://t.co/uF1zUmy7H8",4,False
813414076747419650,2016-12-26 16:00:03,16 of my initiatives were signed into law in 2016 --&gt; watch to learn more. https://t.co/kNuEBuPXsh,2,False
812779894639718400,2016-12-24 22:00:02,"On this first night of Hanukkah, I’d like to wish all my friends who celebrate a joyous holiday. https://t.co/fthXGNPpBj",2,False
812719519986614273,2016-12-24 18:00:07,"This Christmas, we must unite in the name of religious liberty &amp; remember the millions around the world who are per… https://t.co/J9oifM9xKm",8,False
812674230101782528,2016-12-24 15:00:09,Wishing a special Merry Christmas to the men and women serving in our nation’s military. Thank you for your service… https://t.co/Gg3z4ZIJUm,5,False
811941259770269696,2016-12-22 14:27:36,"111 initiatives signed into law later, I'm looking forward to a continued #RecordOfSuccess from @HouseCommerce next… https://t.co/fFu4WcYd7d",4,False
810908965076877312,2016-12-19 18:05:37,"A potential game-changer, the Faster Care for Veterans Act seeks to give our Veterans the option to book VA doctors… https://t.co/70CeEvBw6R",1,False
809450660697690112,2016-12-15 17:30:51,Three big takeaways from 21st Century Cures: https://t.co/uHJQjnZvYG #CuresNow,5,False
809156102076170242,2016-12-14 22:00:22,I'm requesting the VA provide details on the fired employees &amp; others involved in the Bay Pines VA hospital inciden… https://t.co/k8THOYyKbY,1,False
808793332579205124,2016-12-13 21:58:51,21st Century Cures has been signed into law! Cures is about helping patients--and their voices are certainly heard… https://t.co/t9Q27wqoWB,13,False
806913848540364801,2016-12-08 17:30:27,ICYMI I joined Jack and Tedd this morning on @970wfla to discuss helping our nation’s heroes &amp; reforming the VA: https://t.co/8uU6090wx4,1,False
806605099317465088,2016-12-07 21:03:36,"Celebrating w/ my friend Max, an advocate of 21st Century Cures &amp; a rare disease patient, as Cures heads to the Pre… https://t.co/BxyaOAuZie",16,False
806561701265022976,2016-12-07 18:11:09,Wonderful to spend time today at the @RedCross Holiday Mail for Heroes event writing cards to our men and women ser… https://t.co/OK6iafpoqS,2,False
806521648660840448,2016-12-07 15:32:00,"Today, the 75th anniversary of the attack on Pearl Harbor, join me in thanking the Greatest Generation for their se… https://t.co/qVn5GUMKlI",5,False
806213909204111360,2016-12-06 19:09:09,The WIIN Act we're voting on this week supports flood relief initiatives by promoting private-public partnerships f… https://t.co/kMX515hnIg,3,False
806161779155996672,2016-12-06 15:42:00,The 21st Century Cures Act will bring hope to millions of patients &amp; families impacted by a deadly disease. https://t.co/HgRLXQG2Zd,10,False
804757808612773888,2016-12-02 18:43:07,The NDAA we passed today is about strengthening our military to keep Americans safe &amp; giving our troops a much-dese… https://t.co/Esu5aD8MO0,10,False
804417225511702528,2016-12-01 20:09:46,I spoke on the House floor today to honor the life and service of an American hero from Pinellas County: Tuskegee A… https://t.co/CwBMQAVzIS,4,False
804362273229783040,2016-12-01 16:31:24,"Presented the family of Jason Simcakoski the official copy of Jason's law, the PROMISE Act, our bill to fix VA opio… https://t.co/A3vngKJGxi",1,False
804348628575862785,2016-12-01 15:37:11,.@gretchen_church Could not have done it without you! #Cures is going to make a difference for many people living w… https://t.co/rbf3MQ1Bk8,2,False
804128307243532288,2016-12-01 01:01:43,#Cures has passed the House! I'm proud to say that a lot of the input I heard from residents of Florida's 12th Dist… https://t.co/tCEXxONf9V,10,False
804034529669316609,2016-11-30 18:49:04,"RT @SenatorBaldwin: Livestream today’s roundtable with Simcakoski family, @RepGusBilirakis, @DeptVetAffairs, @pewhealth, @VFWHQ &amp; more: htt…",4,False
803743851802480640,2016-11-29 23:34:01,"This week, the House votes on the finalized 21st Century Cures Act for faster discovery, development, &amp; delivery of… https://t.co/s5RoryzAtI",8,False
803635218427117568,2016-11-29 16:22:21,Residents of Florida’s 12th District are invited to attend my Holiday Open House in Tarpon Springs on December 12--… https://t.co/BzmjDMX5st,2,False
802512233007824896,2016-11-26 14:00:00,Today is all about shopping local and supporting the small businesses that make our communities special.… https://t.co/u29E9MPjws,0,False
801802576547213312,2016-11-24 15:00:05,Happy Thanksgiving! Special thoughts &amp; prayers go out to our service members who could not be home to celebrate w/… https://t.co/OwfIsvMv8a,5,False
801475324177510400,2016-11-23 17:19:42,Congrats to Nikhil from Land O’Lakes HS for winning the Congressional App Challenge for Florida’s 12th district! https://t.co/CXmczKW73d,0,False
801177154549641216,2016-11-22 21:34:53,"This November, we celebrate America’s entrepreneurs and our nation’s entrepreneurial spirit, always striving for th… https://t.co/xOKK1lMMih",5,False
801134180755210240,2016-11-22 18:44:07,"Check out my latest op-ed on 21st Century Cures &amp; the OPEN Act, legislation to find cures for deadly &amp; rare diseases https://t.co/KnOj16AzfB",1,False
800802155783483396,2016-11-21 20:44:46,"My thoughts are w/ police officers across the nation after the horrific shootings in TX, MO, &amp; Sanibel, FL. https://t.co/7x9SfJHXZ0",3,False
800779670056738816,2016-11-21 19:15:25,Rest in peace to an American hero from St. Petersburg: Tuskegee Airman Willie Rogers. https://t.co/ceFxRkbB3k,3,False
799322056408047616,2016-11-17 18:43:23,The best baklava was from my grandfather’s bakery in Tarpon Springs where I worked as a kid. #NationalBaklavaDay https://t.co/4NaXK0R1ga,2,False
799283365388029952,2016-11-17 16:09:38,"For the sake of millions of patients and their families, let’s get the 21st Century Cures Act across the finish lin… https://t.co/kEHZDiop9I",5,False
