id,created_at,text,retweet_count,tweet.retweeted
842172367719796736,2017-03-16 00:35:13,Cranberry KhāDī: Blend post-rock with jujube. Top with lymph and tinplate.,0,False
842127068875874312,2017-03-15 21:35:13,Cantaloupe Tinplate: Stir futurism with synovial fluid. Mix neptunium and iodine. Top with dysprosium and worldbeat.,0,False
842081771466424320,2017-03-15 18:35:14,Hot Challis: Layer classicism and mud on de stijl. Cook for 1 hour.,0,False
842036466054230017,2017-03-15 15:35:12,"Classic Jamdani: Stir VBScript, boron, and rayonism with social realism. Serve warm.",0,False
841991165331308544,2017-03-15 12:35:11,Sweet Mesh: Stir rhenium in a glass. Stir persimmon and wire rope in a vacuum cleaner. Serve chilled.,0,False
841945866789347329,2017-03-15 09:35:11,"Mystified Silicon: Layer molybdenum, cellophane, and wallpaper on copper. Top with foam peanut and neptunium.",0,False
841900566972399617,2017-03-15 06:35:11,"Exuberant Velostat: Layer concrete, velostat, and ruthenium on polyester. Serve over bubble wrap.",0,False
841855268795367425,2017-03-15 03:35:11,American-Style Clay: Mix electroclash and aluminium foil. Serve with guava.,0,False
841809970605789184,2017-03-15 00:35:11,Alienated Dornix: Blend apple with garbage. Top with gravel and samarium.,1,False
841764663482286080,2017-03-14 21:35:09,Cold Structuralism: Mix rebar and actinium. Serve immediately.,0,False
841719365301071872,2017-03-14 18:35:09,Classic Velostat: Stir romanticism with corrugated plastic. Mix damson and plastic film. Serve with divisionism.,0,False
841674068508188672,2017-03-14 15:35:10,"Metropolitan Tartan: Layer plaster, jambul, and electro-industrial on ego-futurism. Serve over velostat.",0,False
841628768817033216,2017-03-14 12:35:09,Bilberry Date: Mix darmstadtium and structuralism. Serve chilled.,1,False
841583472191909888,2017-03-14 09:35:10,American-Style Coutil: Mix nintendocore and ORANGEBLOSSOM. Serve over metallised film.,0,False
841538170957242368,2017-03-14 06:35:09,"Raisin Plastic Film: Layer ruthenium, cerebrospinal fluid, and paint on tungsten. Add mandarine and grill for 50 mins.",0,False
841492873073836032,2017-03-14 03:35:09,Pomelo SQLite: Blend copernicium with synchronism. Mix MONKEYCALENDAR and indium. Top with cushioning and structuralism.,0,False
841447576658407424,2017-03-14 00:35:10,Nerdy Charvet: Stir rhodium and copper with pointilism. Top with doom metal.,0,False
