id,created_at,text,retweet_count,tweet.retweeted
850287298893811714,2017-04-07 10:01:04,Diverse protocols for correlative super-resolution fluorescence imaging and electron microscopy of chemically fixe… https://t.co/XtnHIWgfGK,0,False
850287297320931329,2017-04-07 10:01:03,"The telomeric DNA damage response occurs in the absence of chromatin decompaction. by  Vancevska A, Douglass KM, P… https://t.co/jNlFLC4hqA",0,False
850287295995547648,2017-04-07 10:01:03,"Stochastic fluorescence switching of nucleic acids under visible light illumination. by  Dong B, Almassalha LM, So… https://t.co/0EB0owj5O9",0,False
850287294447792129,2017-04-07 10:01:03,"Three-dimensional wide-field pump-probe structured illumination microscopy. by  Kim YH, So PT https://t.co/eh2GRtnlC4",0,False
849925183104331776,2017-04-06 10:02:09,STED microscopy visualizes energy deposition of single ions in a solid-state detector beyond diffraction limit. by… https://t.co/iIrvDQHw4A,0,False
849925180990291968,2017-04-06 10:02:08,"Characterization of Plasma Membrane Ceramides by Super-Resolution Microscopy. by  Burgert A, Schlegel J, Bécam J, … https://t.co/zjBCfMFIr1",0,False
849925177295196160,2017-04-06 10:02:07,"Controlling the orbital angular momentum of high harmonic vortices. by  Kong F, Zhang C, Bouchard F, Li Z, Brown G… https://t.co/5dIdG4lSF6",0,False
849925175298707456,2017-04-06 10:02:07,"Composite functional metasurfaces for multispectral achromatic optics. by  Avayu O, Almeida E, Prior Y, Ellenbogen… https://t.co/eAmqm7gDPl",0,False
849925170936643584,2017-04-06 10:02:06,Stability of a Bifunctional Cu-Based CoreZeolite Shell Catalyst for Dimethyl Ether Synthesis Under Redox Condition… https://t.co/9XSLMlqC7u,0,False
849562847931715584,2017-04-05 10:02:21,"Microsphere-assisted super-resolved Mirau digital holographic microscopy for cell identification. by  Aakhte M, Ab… https://t.co/uAe2ijjlGn",0,False
849562845134155776,2017-04-05 10:02:21,"Super-resolution microscopy in the diagnosis of platelet granule disorders. by  Knight AE, Gomez K, Cutler DF https://t.co/R0CAQQK1SN",1,False
849562841363476480,2017-04-05 10:02:20,"Analyzing Single Molecule Localization Microscopy Data Using Cubic Splines. by  Babcock HP, Zhuang X https://t.co/2gJ5vFplW0",1,False
849200434057183233,2017-04-04 10:02:15,"Hydroxylated fluorescent dyes for live cell labeling: synthesis, spectra and superresolution STED** microscopy. by… https://t.co/Dy7gS4JqL6",0,False
849200432509575168,2017-04-04 10:02:15,"A protocol for registration and correction of multicolour STED superresolution images. by  Hebisch E, Wagner E, We… https://t.co/Ik8F91KNCs",0,False
849200430718611456,2017-04-04 10:02:14,Clustered localization of STAT3 during the cell cycle detected by super-resolution fluorescence microscopy. by  Ga… https://t.co/YHFBel5hzZ,0,False
849200429141544961,2017-04-04 10:02:14,"Distinct mechanisms for the upconversion of NaYF4:Yb(3+),Er(3+) nanoparticles revealed by stimulated emission depl… https://t.co/ZryOCBb4pX",0,False
849200427451265024,2017-04-04 10:02:13,"Evidence of Presynaptic Localization and Function of the c-Jun N-Terminal Kinase. by  Biggi S, Buccarello L, Sclip… https://t.co/vt33GZYOXz",0,False
849200425467293696,2017-04-04 10:02:13,"Fast Single Image Super-Resolution Using Estimated Low-Frequency k-Space Data in MRI. by  Luo J, Mou Z, Qin B, Li … https://t.co/KyJACylfAh",0,False
848476172606427137,2017-04-02 10:04:18,Super-resolved 3-D imaging of live cells' organelles from bright-field photon transmission micrographs. by  Rychtá… https://t.co/MGTY7c2xzq,0,False
848476170911965184,2017-04-02 10:04:17,"Lateral segregation of photosystem I in cyanobacterial thylakoids. by  MacGregor-Chatwin C, Sener M, Barnett SF, H… https://t.co/jRCiSQByUW",0,False
848476167908847616,2017-04-02 10:04:17,"Facilitating trypanosome imaging. by  Glogger M, Subota I, Pezzarossa A, Denecke AL, Carrington M, Fenz SF, Engstl… https://t.co/zsi0tbxghW",0,False
848115016033329153,2017-04-01 10:09:11,"Caging and Photoactivation in Single-Molecule Förster Resonance Energy Transfer Experiments. by  Jazi AA, Ploetz E… https://t.co/2Q027tUFJo",0,False
848115013541924864,2017-04-01 10:09:11,Heterologous expression of the Halothiobacillus neapolitanus carboxysomal gene cluster in Corynebacterium glutamic… https://t.co/kobfNEDTe6,0,False
847750362308067330,2017-03-31 10:00:11,"Localizing order to boost signaling. by  Bálint Š, Dustin ML https://t.co/VcTtGa99Yc",0,False
847388156601159683,2017-03-30 10:00:54,Podosome Force Generation Machinery: a Local Balance between Protrusion at the Core and Traction at the Ring. by  … https://t.co/uvzVyhcnx3,0,False
846663969653866496,2017-03-28 10:03:15,"Endocytic proteins are partitioned at the edge of the clathrin lattice in mammalian cells. by  Sochacki KA, Dickey… https://t.co/M11aqncAdJ",0,False
846663966864609282,2017-03-28 10:03:14,"Single NMR image super-resolution based on extreme learning machine. by  Wang Z, Xin J, Wang Z, Tian S, Qiu X https://t.co/oqmpkZi6xn",0,False
845912896051822594,2017-03-26 08:18:45,The trans-Golgi Network and the Golgi Stacks Behave Independently During Regeneration After Brefeldin A Treatment … https://t.co/MngkBNKQFo,1,False
845912894411825152,2017-03-26 08:18:44,"Ginsenoside PPD's Antitumor Effect via Down-Regulation of mTOR Revealed by Super-Resolution Imaging. by  Teng B, J… https://t.co/DYBeznF4y5",0,False
845215342532218880,2017-03-24 10:06:55,"Effect of probe diffusion on the SOFI imaging accuracy. by  Vandenberg W, Dedecker P https://t.co/wMWZHVPF6M",1,False
845215340921532416,2017-03-24 10:06:55,"MAD2L2 Promotes Open Chromatin in Embryonic Stem Cells and Derepresses the Dppa3 Locus. by  Rahjouei A, Pirouz M, … https://t.co/JkgDz0Fwww",0,False
845215338954395649,2017-03-24 10:06:54,"Facial nerve tractography: A new tool to detect perineural invasion in parotid cancers. by  Rouchy RC, Attyé A, Tr… https://t.co/Zfojoe5Bqf",0,False
844851710111563777,2017-03-23 10:01:58,"Polarization sensitive localization based super-resolution microscopy with a birefringent wedge. by  Sinkó J, Gajd… https://t.co/ox5q6tZX3C",0,False
844851706936541185,2017-03-23 10:01:58,Investigation of C3 S hydration mechanism by transmission electron microscope (TEM) with integrated Super-X(TM) ED… https://t.co/zp87GMfkNy,0,False
844851704210178048,2017-03-23 10:01:57,"STED Imaging in Drosophila Brain Slices. by  Fendl S, Pujol-Martí J, Ryan J, Borst A, Kasper R https://t.co/2oLBvvU4z5",0,False
844851702071148546,2017-03-23 10:01:57,Sample Preparation and Choice of Fluorophores for Single and Dual Color Photo-Activated Localization Microscopy (P… https://t.co/heDCWOIHgV,0,False
844851698925371393,2017-03-23 10:01:56,"Introduction to Modern Methods in Light Microscopy. by  Ryan J, Gerhold AR, Boudreau V, Smith L, Maddox PS https://t.co/pzTIpIjNfx",0,False
844851695850942465,2017-03-23 10:01:55,"An alternative polysaccharide uptake mechanism of marine bacteria. by  Reintjes G, Arnosti C, Fuchs BM, Amann R https://t.co/lxSFYVlOg1",0,False
844851693279862788,2017-03-23 10:01:54,Quantitative analyses of the 3D nuclear landscape recorded with super-resolved fluorescence microscopy. by  Schmid… https://t.co/tSyJeendog,0,False
844851690050224129,2017-03-23 10:01:54,EGF and NRG induce phosphorylation of HER3/ERBB3 by EGFR using distinct oligomeric mechanisms. by  van Lengerich B… https://t.co/QwfWBCD6lE,0,False
844128835859894276,2017-03-21 10:09:32,"DNA probes for monitoring dynamic and transient molecular encounters on live cell membranes. by  You M, Lyu Y, Han… https://t.co/XkAJV2IYHj",1,False
844128834245017600,2017-03-21 10:09:31,"Evidence of a minority monoclinic LaNiO2.5 phase in lanthanum nickelate thin films. by  López-Conesa L, Rebled JM,… https://t.co/pgfvvROlkI",0,False
844128832684744704,2017-03-21 10:09:31,"Achromatic light patterning and improved image reconstruction for parallelized RESOLFT nanoscopy. by  Chmyrov A, L… https://t.co/xM6okJPIsJ",1,False
844128831216738304,2017-03-21 10:09:31,"Quantifying Transcription Factor Binding Dynamics at the Single-molecule Level in Live Cells. by  Presman DM, Ball… https://t.co/3UlfXcykjf",0,False
844128829660643328,2017-03-21 10:09:30,Characterization of a human point mutation of VGLUT3 (p.A211V) in the rodent brain suggests a non-uniform distribu… https://t.co/yn00qIQjH6,0,False
843043944346935296,2017-03-18 10:18:33,"Optical Super-Resolution Imaging of Surface Reactions. by  Chen T, Dong B, Chen K, Zhao F, Cheng X, Ma C, Lee S, Z… https://t.co/r67gH2NBaW",2,False
843043942581125120,2017-03-18 10:18:33,"All-passive pixel super-resolution of time-stretch imaging. by  Chan AC, Ng HC, Bogaraju SC, So HK, Lam EY, Tsia KK https://t.co/d9nAa6Zqui",2,False
842680299104489476,2017-03-17 10:13:34,"Mechanisms of Autophagy Initiation. by  Hurley JH, Young LN https://t.co/T4JlDNPUqP",0,False
842680297351233536,2017-03-17 10:13:33,"NicoLase-An open-source diode laser combiner, fiber launch, and sequencing controller for fluorescence microscopy.… https://t.co/j7onRObfG9",4,False
842680295342116864,2017-03-17 10:13:33,"Dissection of mechanical force in living cells by super-resolved traction force microscopy. by  Colin-York H, Egge… https://t.co/RHIaQHO6lC",0,False
842317855643295744,2017-03-16 10:13:20,"Nanoscale Structural Plasticity of the Active Zone Matrix Modulates Presynaptic Function. by  Glebov OO, Jackson R… https://t.co/bM9bYDFXFp",0,False
842317854204665856,2017-03-16 10:13:20,Diversity of actin architecture in human osteoclasts: network of curved and branched actin supporting cell shape a… https://t.co/J9mJ9jhTUW,0,False
842317852543725570,2017-03-16 10:13:20,New insights into protein secretion: TANGO1 runs rings around the COPII coat. by  Glick BS https://t.co/SGfQeClNfI,0,False
842317850803073024,2017-03-16 10:13:19,"Membrane nanoclusters of FcγRI segregate from inhibitory SIRPα upon activation of human macrophages. by  Lopes FB,… https://t.co/ziWsETb7tB",0,False
842317848542355456,2017-03-16 10:13:19,The small protein SgrT controls transport activity of the glucose-specific phosphotransferase system. by  Lloyd CR… https://t.co/LlpEuqkO0F,0,False
841590538965008384,2017-03-14 10:03:15,"Genetically encoded biosensors for visualizing live-cell biochemical activity at super-resolution. by  Mo GC, Ross… https://t.co/N0eTKQvP5x",0,False
841590537362784257,2017-03-14 10:03:14,"Single-Molecule Localization Microscopy in Eukaryotes. by  Sauer M, Heilemann M https://t.co/RmHa0Ko1lV",0,False
841590535857065984,2017-03-14 10:03:14,"Mapping of Bernal and non-Bernal stacking domains in bilayer graphene using infrared nanoscopy. by  Jeong G, Choi … https://t.co/rCvV50N5Bq",0,False
841590534451974145,2017-03-14 10:03:14,Quantum correlation enhanced super-resolution localization microscopy enabled by a fibre bundle camera. by  Israel… https://t.co/n792m78eB4,0,False
841590532639981568,2017-03-14 10:03:13,SPAD imagers for super resolution localization microscopy enable analysis of fast fluorophore blinking. by  Antolo… https://t.co/mTzRFuqSpi,0,False
841590530756730882,2017-03-14 10:03:13,Modulation of Plant RAB GTPase-Mediated Membrane Trafficking Pathway at the Interface Between Plants and Obligate … https://t.co/BZBiTXcCIk,0,False
840520496810717184,2017-03-11 11:11:17,"PEGylated Perylenemonoimide-Dithienylethene for Super-Resolution Imaging of Liposomes. by  Liu JX, Xin B, Li C, Xi… https://t.co/2ctBJw6sPe",0,False
840520494369640448,2017-03-11 11:11:16,"Extreme Ultraviolet Fractional Orbital Angular Momentum Beams from High Harmonic Generation. by  Turpin A, Rego L,… https://t.co/IDB9ObwKdJ",0,False
840520491295211521,2017-03-11 11:11:15,"Malaria Parasite Invasion: Achieving Superb Resolution. by  Baum J, Richard D, Riglar DT https://t.co/NtSEcbuqWe",0,False
840155645559091200,2017-03-10 11:01:29,Optimized labeling of membrane proteins for applications to super-resolution imaging in confined cellular environm… https://t.co/J4wgKnSijM,2,False
840155642325278721,2017-03-10 11:01:29,"Single Molecule Tracking and Localization of Mitochondrial Protein Complexes in Live Cells. by  Appelhans T, Busch… https://t.co/ECSxXE8JCM",1,False
840155636780453888,2017-03-10 11:01:27,"Transmission of HBV DNA Mediated by Ceramide-Triggered Extracellular Vesicles. by  Sanada T, Hirata Y, Naito Y, Ya… https://t.co/c8n0iLhMgL",0,False
839793517136326657,2017-03-09 11:02:31,"Defined chromosome structure in the genome-reduced bacterium Mycoplasma pneumoniae. by  Trussart M, Yus E, Martine… https://t.co/CBIVmUsg27",0,False
839793515336970241,2017-03-09 11:02:31,"Structured illumination microscopy with unknown patterns and a statistical prior. by  Yeh LH, Tian L, Waller L https://t.co/QQddT2JXfC",2,False
839069981706964992,2017-03-07 11:07:27,Spatial distribution of high copy number plasmids in bacteria. by  Wang Y https://t.co/ZZaE4mL2Nm,0,False
839069980322840577,2017-03-07 11:07:27,Ground State Depletion Nanoscopy Resolves Semiconductor Nanowire Barcode Segments at Room Temperature. by  Oracz J… https://t.co/frbAczABVz,0,False
839069978804510720,2017-03-07 11:07:26,"Stimulated Emission Depletion Microscopy. by  Blom H, Widengren J https://t.co/5ZZiUaJ4EP",0,False
839069977273647104,2017-03-07 11:07:26,High-magnification super-resolution FINCH microscopy using birefringent crystal lens interferometers. by  Siegel N… https://t.co/q495eAkvKG,0,False
839069974991933440,2017-03-07 11:07:25,Spatial Mapping of Protein Adsorption on Mesoporous Silica Nanoparticles by Stochastic Optical Reconstruction Micr… https://t.co/lrUTDNDR1M,0,False
838343923546406912,2017-03-05 11:02:21,"Cadmium-induced changes in vacuolar aspects of Arabidopsis thaliana. by  Sharma SS, Yamamoto K, Hamaji K, Ohnishi … https://t.co/OaaxHNtOvL",0,False
837983294872555520,2017-03-04 11:09:21,"Hybrid Nanoscopy of Hybrid Nanomaterials. by  Bondia P, Jurado R, Casado S, Domínguez-Vera JM, Gálvez N, Flors C https://t.co/MeclA66hHH",0,False
837983293274533889,2017-03-04 11:09:20,"Configurations of the Re-scan Confocal Microscope (RCM) for biomedical applications. by  DE Luca GM, Desclos E, Br… https://t.co/6WkwlJJW5l",0,False
837983290632122368,2017-03-04 11:09:20,"Fluorescent Nanowire Ring Illumination for Wide-Field Far-Field Subdiffraction Imaging. by  Liu X, Kuang C, Hao X,… https://t.co/WcNvtduLfo",1,False
837983288916586496,2017-03-04 11:09:19,"Universal Super-Resolution Multiplexing by DNA Exchange. by  Schueder F, Strauss MT, Hoerl D, Schnitzbauer J, Schl… https://t.co/NhPrL7Lmrx",2,False
837983287612145665,2017-03-04 11:09:19,Zyxin regulates endothelial von Willebrand factor secretion by reorganizing actin filaments around exocytic granul… https://t.co/H7XNbVog1M,0,False
837983286089691138,2017-03-04 11:09:19,"Super-resolution Analysis of TCR-Dependent Signaling: Single-Molecule Localization Microscopy. by  Barr VA, Yi J, … https://t.co/9D0vWk7Ogc",0,False
837983284512587778,2017-03-04 11:09:18,T Cell Receptor Activation of NF-κB in Effector T Cells: Visualizing Signaling Events Within and Beyond the Cytopl… https://t.co/wZDNBSgr5D,0,False
837983282692239360,2017-03-04 11:09:18,"Fluorescence-Based Assays to Analyse Phosphatidylinositol 5-Phosphate in Autophagy. by  Vicinanza M, Gratian MJ, B… https://t.co/tKYAKRUFSe",0,False
837983281001947136,2017-03-04 11:09:17,"Correlative Live Cell and Super Resolution Imaging of Autophagosome Formation. by  Walker SA, Karanasios E, Ktista… https://t.co/bNldtczOdR",0,False
837619641811873792,2017-03-03 11:04:19,"Single particle maximum likelihood reconstruction from superresolution microscopy images. by  Verdier T, Gunzenhau… https://t.co/weh43A2fev",1,False
837619640264196100,2017-03-03 11:04:19,"Joint reconstruction strategy for structured illumination microscopy with unknown illuminations. by  Labouesse S, … https://t.co/dZIVu2HngV",0,False
837619639001747456,2017-03-03 11:04:18,"The RhoGAP protein, ARHGAP18/SENEX localises to microtubules and regulates their stability in endothelial cells. b… https://t.co/i28NI0YTJR",0,False
837619636837445632,2017-03-03 11:04:18,"Analysis of Myosin II Minifilament Orientation at Epithelial Zonula Adherens. by  Michael M, Liang X, Gomez GA https://t.co/LCwCgEzghB",0,False
837257252658610177,2017-03-02 11:04:19,"Image scanning microscopy: an overview. by  Ward EN, Pal R https://t.co/luisC3W8hC",0,False
837257250355957760,2017-03-02 11:04:18,"Magnetization shaping generated by tight focusing of azimuthally polarized vortex multi-Gaussian beam. by  Yan W, … https://t.co/OSHZSe4338",0,False
836894648597626880,2017-03-01 11:03:27,N-terminal SAP97 isoforms differentially regulate synaptic structure and postsynaptic surface pools of AMPA recept… https://t.co/iCUAuUEcO2,0,False
836894646823440384,2017-03-01 11:03:27,"One-colour control of activation, excitation and deactivation of a fluorescent diarylethene derivative in super-re… https://t.co/0KA0cYbuP6",0,False
836894645095399427,2017-03-01 11:03:26,"Compact lensless phase imager. by  Rostykus M, Soulez F, Unser M, Moser C https://t.co/T0FaYchn3Y",0,False
836894641744130049,2017-03-01 11:03:25,"Spectroscopic super-resolution fluorescence cell imaging using ultra-small Ge quantum dots. by  Song M, Karatutlu … https://t.co/ajbkosxLdh",1,False
836894639001042946,2017-03-01 11:03:25,Meta-nanocavity model for dynamic super-resolution fluorescent imaging based on the plasmonic structure illuminati… https://t.co/eo1DQqTEGM,0,False
836894636912349186,2017-03-01 11:03:24,"Intensity-based axial localization approaches for multifocal plane microscopy. by  Velmurugan R, Chao J, Ram S, Wa… https://t.co/79eWZsXoYC",0,False
836533500174020608,2017-02-28 11:08:23,"Modeling of the axon membrane skeleton structure and implications for its mechanical properties. by  Zhang Y, Abir… https://t.co/AfiNpk9wjD",0,False
836533498592772096,2017-02-28 11:08:22,Three-dimensional mouse brain cytoarchitecture revealed by laboratory-based x-ray phase-contrast tomography. by  T… https://t.co/SENF5v9TwA,2,False
836533495249805312,2017-02-28 11:08:21,"Single Molecule Localization Microscopy of DNA Damage Response Pathways in Cancer. by  Whelan DR, Yin Y, Bermudez-… https://t.co/swO1vY4GMc",1,False
835973484819906560,2017-02-26 22:03:05,Aptamers provide superior stainings of cellular receptors studied under super-resolution microscopy. by  Gomes de … https://t.co/YYNlMNK94Z,0,False
835082425831141376,2017-02-24 11:02:20,Cytoplasmic deadenylase Ccr4 is required for translational repression of LRG1 mRNA in the stationary phase. by  Du… https://t.co/rQwomoitbt,0,False
835082423050326016,2017-02-24 11:02:19,"Super-resolution in light microscopy. by  Moreno N, Martins NP, Martins G https://t.co/EXMUrnicuD",0,False
835082420261126144,2017-02-24 11:02:18,Drebrin-mediated microtubule-actomyosin coupling steers cerebellar granule neuron nucleokinesis and migration path… https://t.co/KoF2dvHpiN,0,False
834721548326035457,2017-02-23 11:08:20,"Amplified stimulated emission in upconversion nanoparticles for super-resolution nanoscopy. by  Liu Y, Lu Y, Yang … https://t.co/cpS46QsSly",0,False
834721546937782272,2017-02-23 11:08:19,"Imaging mRNA and protein interactions within neurons. by  Eliscovich C, Shenoy SM, Singer RH https://t.co/NkRGWRNfXa",0,False
834359128239779842,2017-02-22 11:08:12,"Epilepsy and synaptic proteins. by  Fukata Y, Fukata M https://t.co/8bTddy5Hbp",0,False
834359126151032833,2017-02-22 11:08:11,"Super-resolution imaging of self-assembly of amphiphilic photoswitchable macrocycles. by  Hua QX, Xin B, Xiong ZJ,… https://t.co/wgbvcnNpjI",0,False
832909044511805440,2017-02-18 11:06:05,"Super-Resolution Microscopy: Shedding Light on the Cellular Plasma Membrane. by  Stone MB, Shelby SA, Veatch SL https://t.co/d7Baoaef3a",1,False
832545690156937216,2017-02-17 11:02:15,Direct Formation of Large-Area 2D Nanosheets from Fluorescent Semiconducting Homopolymer with Orthorhombic Crystal… https://t.co/bSnyKGCew4,0,False
832545687397101568,2017-02-17 11:02:14,"Super-resolution mapping of scaffold nucleoporins in the nuclear pore complex. by  Ma J, Kelich JM, Junod SL, Yang… https://t.co/qzWGVamPMq",2,False
832183298478714881,2017-02-16 11:02:14,"Image scanning fluorescence emission difference microscopy based on a detector array. by  Li Y, Liu S, Liu D, Sun … https://t.co/lenUoaF5TF",0,False
832183296687734784,2017-02-16 11:02:13,"Precise background subtraction in stimulated emission double depletion nanoscopy. by  Gao P, Ulrich Nienhaus G https://t.co/SmZnGk94Ap",0,False
832183294515113985,2017-02-16 11:02:13,Influence of the background medium on imaging performance of microsphere-assisted super-resolution microscopy. by … https://t.co/w5O8jQKWbe,0,False
832183292359241728,2017-02-16 11:02:12,"Patch-Based Super-Resolution of MR Spectroscopic Images: Application to Multiple Sclerosis. by  Jain S, Sima DM, S… https://t.co/USXEpSBxCX",0,False
831822304405573632,2017-02-15 11:07:46,"Molecule counts in localization microscopy with organic fluorophores. by  Heilemann M, Fricke F, Karathanasis C, H… https://t.co/dnlgDY3Nbc",5,False
831822302857793537,2017-02-15 11:07:46,A generalized framework unifying image registration and respiratory motion models and incorporating image reconstr… https://t.co/JlgXEJ9rYz,0,False
831822300848676864,2017-02-15 11:07:45,Dynamic multimodal full-field optical coherence tomography and fluorescence structured illumination microscopy. by… https://t.co/mAgxXRc1uP,0,False
831822299141640193,2017-02-15 11:07:45,Peptoids successfully inhibit the growth of gram negative E. coli causing substantial membrane damage. by  Mojsosk… https://t.co/0i82lloDnQ,0,False
831822297346502656,2017-02-15 11:07:44,"Expression of a Novel Ciliary Protein, IIIG9, During the Differentiation and Maturation of Ependymal Cells. by  Ci… https://t.co/TT5yvqjtaZ",0,False
831822295467438080,2017-02-15 11:07:44,Strong signal increase in STED fluorescence microscopy by imaging regions of subdiffraction extent. by  Göttfert F… https://t.co/bMufG9fUSv,0,False
831458798611136517,2017-02-14 11:03:20,"Optical photon reassignment with increased axial resolution by structured illumination. by  Roth S, Heintzmann R https://t.co/eChARhhykx",0,False
831458796627165184,2017-02-14 11:03:19,Single-molecule analysis of fluorescent carbon dots towards localization-based super-resolution microscopy. by  Ve… https://t.co/lyPhopZP7k,0,False
830734036674961411,2017-02-12 11:03:23,Accelerated Singular Value-Based Ultrasound Blood Flow Clutter Filtering with Randomized Singular Value Decomposit… https://t.co/xEtACgICR2,0,False
830734034997223424,2017-02-12 11:03:22,"Evaluation of SLIce Dithered Enhanced Resolution Simultaneous MultiSlice (SLIDER-SMS) for human fMRI. by  Vu AT, B… https://t.co/Qk31iBJczP",0,False
830734033176952832,2017-02-12 11:03:22,"Flipping nanoscopy on its head. by  Xiao J, Ha T https://t.co/ByqM3nQnpH",1,False
830008539821260800,2017-02-10 11:00:31,Resolution and super-resolution. by  Sheppard CJ https://t.co/CxvDvqSfjq,1,False
830008537875095552,2017-02-10 11:00:30,Track-weighted imaging methods: extracting information from a streamlines tractogram. by  Calamante F https://t.co/wa4a2T3X1u,0,False
830008536054820865,2017-02-10 11:00:30,Super-resolution imaging of alpha-synuclein polymorphisms and their potential role in neurodegeneration. by  Nugen… https://t.co/4cYOEEYex2,0,False
830008534087655425,2017-02-10 11:00:29,"Unfolding DNA condensates produced by DNA-like charged depletants: A force spectroscopy study. by  Lima CH, Rocha … https://t.co/IGJxCtysir",0,False
829646196817981442,2017-02-09 11:00:42,"Astrocytes Resist HIV-1 Fusion but Engulf Infected Macrophage Material. by  Russell RA, Chojnacki J, Jones DM, Joh… https://t.co/IsiGBoulij",0,False
829646195240890368,2017-02-09 11:00:41,"7T-Guided Super-Resolution of 3T MRI. by  Bahrami K, Shi F, Rekik I, Gao Y, Shen D https://t.co/j5LLCgbUhU",0,False
829646192875302915,2017-02-09 11:00:41,"Integrity of the human centromere DNA repeats is protected by CENP-A, CENP-C, and CENP-T. by  Giunta S, Funabiki H https://t.co/fPgjFPlWkU",0,False
829646190685859840,2017-02-09 11:00:40,"Subwavelength motion-correction for ultrafast ultrasound localization microscopy. by  Hingot V, Errico C, Tanter M… https://t.co/fu4TDPxrY4",0,False
828922310937759744,2017-02-07 11:04:14,"Optical Nanoscopy of High-Tc Cuprate Nano-Constriction Devices Patterned by Helium Ion Beams. by  Gozar AM, Litomb… https://t.co/LGy0MAIxL6",0,False
828922308920299520,2017-02-07 11:04:13,"Two-dimensional Talbot self-imaging via Electromagnetically induced lattice. by  Wen F, Wang W, Ahmed I, Wang H, Z… https://t.co/KvDFOnEfHM",0,False
828559916302483456,2017-02-06 11:04:12,"Dynamic reorganization of the endomembrane system during spermatogenesis in Marchantia polymorpha. by  Minamino N,… https://t.co/k0j0C0b1If",0,False
828559914826080257,2017-02-06 11:04:12,"STED properties of Ce3+, Tb3+, and Eu3+ doped inorganic scintillators. by Alekhin MS, Renger J, Kasperczyk M, Doui… https://t.co/kJUXEtsJM2",0,False
828559913072861184,2017-02-06 11:04:11,"Stimulated scintillation emission depletion X-ray imaging. by  Alekhin MS, Patton G, Dujardin C, Douissard PA, Leb… https://t.co/DVdgNJ8Tc7",0,False
828559911588093952,2017-02-06 11:04:11,"Remote classification from an airborne camera using image super-resolution. by  Woods M, Katsaggelos A https://t.co/DNyeSQhMyl",0,False
828559910048784385,2017-02-06 11:04:11,Polycomb Repressive Complex 1 Generates Discrete Compacted Domains that Change during Differentiation. by  Kundu S… https://t.co/gPiju7tFit,0,False
828559908429766656,2017-02-06 11:04:10,Valence band dispersion measurements of perovskite single crystals using angle-resolved photoemission spectroscopy… https://t.co/HskBZB3z7s,0,False
